{"schema": "v1", "run_id": "1da75a0acadd", "event_id": "a4c8665e2ca3", "ts": 1774384469, "type": "proposal", "episode_id": "1da75a0acadd", "iter": 0, "params": {"learning_rate": 0.0001, "max_steps": 30, "num_generations": 3, "temperature": 0.7, "lora_rank": 4, "_type": "param"}}
{"schema": "v1", "run_id": "1da75a0acadd", "event_id": "3608f21ad363", "ts": 1774384750, "type": "iteration", "episode_id": "1da75a0acadd", "iter": 0, "status": "ok", "decision": "keep", "metrics": {"rank": 4.0, "eval_score": 0.432727, "decision_accuracy": 0.2, "json_compliance": 0.963636, "loss": 0.00401, "training_seconds": 76.8}, "params": {"learning_rate": 0.0001, "max_steps": 30, "num_generations": 3, "temperature": 0.7, "lora_rank": 4, "_type": "param"}, "elapsed_s": 280.6025648806244}
{"schema": "v1", "run_id": "1da75a0acadd", "event_id": "144d0fa1832b", "ts": 1774385055, "type": "proposal", "episode_id": "1da75a0acadd", "iter": 1, "params": {"learning_rate": 5e-05, "max_steps": 50, "num_generations": 2, "temperature": 0.9, "lora_rank": 8, "_type": "param"}}
{"schema": "v1", "run_id": "1da75a0acadd", "event_id": "27a515c17751", "ts": 1774385454, "type": "iteration", "episode_id": "1da75a0acadd", "iter": 1, "status": "ok", "decision": "keep", "metrics": {"rank": 8.0, "eval_score": 0.492727, "decision_accuracy": 0.2, "json_compliance": 0.954545, "loss": 0.003858, "training_seconds": 133.6}, "params": {"learning_rate": 5e-05, "max_steps": 50, "num_generations": 2, "temperature": 0.9, "lora_rank": 8, "_type": "param"}, "elapsed_s": 397.6375816203654}
{"schema": "v1", "run_id": "1da75a0acadd", "event_id": "12290cf7eb55", "ts": 1774385723, "type": "proposal", "episode_id": "1da75a0acadd", "iter": 2, "params": {"learning_rate": 0.0003, "max_steps": 30, "num_generations": 3, "temperature": 0.7, "lora_rank": 16, "_type": "param"}}
{"schema": "v1", "run_id": "1da75a0acadd", "event_id": "6e3ffd02d222", "ts": 1774385966, "type": "iteration", "episode_id": "1da75a0acadd", "iter": 2, "status": "ok", "decision": "discard", "metrics": {"rank": 16.0, "eval_score": 0.406364, "decision_accuracy": 0.2, "json_compliance": 0.954545, "loss": 0.002435, "training_seconds": 118.6}, "params": {"learning_rate": 0.0003, "max_steps": 30, "num_generations": 3, "temperature": 0.7, "lora_rank": 16, "_type": "param"}, "elapsed_s": 242.12364293914288}
{"schema": "v1", "run_id": "1da75a0acadd", "event_id": "1317a014d946", "ts": 1774386240, "type": "proposal", "episode_id": "1da75a0acadd", "iter": 3, "params": {"learning_rate": 5e-05, "max_steps": 30, "num_generations": 2, "temperature": 0.9, "lora_rank": 8, "_type": "param"}}
{"schema": "v1", "run_id": "1da75a0acadd", "event_id": "331e0740c24c", "ts": 1774386538, "type": "iteration", "episode_id": "1da75a0acadd", "iter": 3, "status": "ok", "decision": "keep", "metrics": {"rank": 8.0, "eval_score": 0.515455, "decision_accuracy": 0.218182, "json_compliance": 0.963636, "loss": 0.001867, "training_seconds": 61.7}, "params": {"learning_rate": 5e-05, "max_steps": 30, "num_generations": 2, "temperature": 0.9, "lora_rank": 8, "_type": "param"}, "elapsed_s": 296.6336941914633}
{"schema": "v1", "run_id": "1da75a0acadd", "event_id": "d716c67f86ed", "ts": 1774386591, "type": "proposal", "episode_id": "1da75a0acadd", "iter": 4, "params": {"learning_rate": 5e-05, "max_steps": 80, "num_generations": 2, "temperature": 0.9, "lora_rank": 16, "_type": "param"}}
{"schema": "v1", "run_id": "1da75a0acadd", "event_id": "fcf75fd101a4", "ts": 1774387039, "type": "iteration", "episode_id": "1da75a0acadd", "iter": 4, "status": "ok", "decision": "keep", "metrics": {"rank": 16.0, "eval_score": 0.521818, "decision_accuracy": 0.209091, "json_compliance": 0.963636, "loss": 0.000564, "training_seconds": 169.7}, "params": {"learning_rate": 5e-05, "max_steps": 80, "num_generations": 2, "temperature": 0.9, "lora_rank": 16, "_type": "param"}, "elapsed_s": 447.3079194109887}
{"schema": "v1", "run_id": "1da75a0acadd", "event_id": "d00279375fe1", "ts": 1774387310, "type": "proposal", "episode_id": "1da75a0acadd", "iter": 5, "params": {"learning_rate": 5e-05, "max_steps": 30, "num_generations": 2, "temperature": 0.9, "lora_rank": 4, "_type": "param"}}
{"schema": "v1", "run_id": "1da75a0acadd", "event_id": "ce9e2699ab69", "ts": 1774387576, "type": "iteration", "episode_id": "1da75a0acadd", "iter": 5, "status": "ok", "decision": "discard", "metrics": {"rank": 4.0, "eval_score": 0.507273, "decision_accuracy": 0.209091, "json_compliance": 0.963636, "loss": 0.002949, "training_seconds": 66.0}, "params": {"learning_rate": 5e-05, "max_steps": 30, "num_generations": 2, "temperature": 0.9, "lora_rank": 4, "_type": "param"}, "elapsed_s": 265.4734183680266}
{"schema": "v1", "run_id": "1da75a0acadd", "event_id": "a8fd76d128aa", "ts": 1774387888, "type": "proposal", "episode_id": "1da75a0acadd", "iter": 6, "params": {"learning_rate": 0.0003, "max_steps": 30, "num_generations": 2, "temperature": 0.7, "lora_rank": 16, "_type": "param"}}
{"schema": "v1", "run_id": "1da75a0acadd", "event_id": "b6aa2c508a67", "ts": 1774388230, "type": "iteration", "episode_id": "1da75a0acadd", "iter": 6, "status": "ok", "decision": "discard", "metrics": {"rank": 16.0, "eval_score": 0.520909, "decision_accuracy": 0.209091, "json_compliance": 0.954545, "loss": 0.001746, "training_seconds": 64.7}, "params": {"learning_rate": 0.0003, "max_steps": 30, "num_generations": 2, "temperature": 0.7, "lora_rank": 16, "_type": "param"}, "elapsed_s": 340.9680158039555}
{"schema": "v1", "run_id": "1da75a0acadd", "event_id": "355b84722188", "ts": 1774388347, "type": "proposal", "episode_id": "1da75a0acadd", "iter": 7, "params": {"learning_rate": 5e-05, "max_steps": 50, "num_generations": 2, "temperature": 0.9, "lora_rank": 16, "_type": "param"}}
{"schema": "v1", "run_id": "1da75a0acadd", "event_id": "3eab1fd16aae", "ts": 1774388523, "type": "iteration", "episode_id": "1da75a0acadd", "iter": 7, "status": "ok", "decision": "discard", "metrics": {"rank": 16.0, "eval_score": 0.517727, "decision_accuracy": 0.209091, "json_compliance": 0.963636, "loss": 0.001233, "training_seconds": 82.1}, "params": {"learning_rate": 5e-05, "max_steps": 50, "num_generations": 2, "temperature": 0.9, "lora_rank": 16, "_type": "param"}, "elapsed_s": 175.56051325052977}
{"schema": "v1", "run_id": "1da75a0acadd", "event_id": "6e53c1a80d17", "ts": 1774388523, "type": "episode_summary", "episode_id": "1da75a0acadd", "mean": 0.489375, "median": 0.5113639999999999, "min": 0.406364, "max": 0.521818, "stdev": 0.04466116888304649, "count": 8, "trend_slope": 0.01244047619047621}
{"schema": "v1", "run_id": "1da75a0acadd", "event_id": "f8a42ab5ff87", "ts": 1774425865, "type": "proposal", "episode_id": "1da75a0acadd", "iter": 8, "params": {"learning_rate": 0.0001, "max_steps": 30, "num_generations": 3, "temperature": 0.7, "lora_rank": 4, "_type": "param"}}
{"schema": "v1", "run_id": "1da75a0acadd", "event_id": "7598caf5791d", "ts": 1774426131, "type": "iteration", "episode_id": "1da75a0acadd", "iter": 8, "status": "ok", "decision": "discard", "metrics": {"rank": 4.0, "eval_score": 0.475909, "decision_accuracy": 0.190909, "json_compliance": 0.918182, "loss": 0.006054, "training_seconds": 79.3}, "params": {"learning_rate": 0.0001, "max_steps": 30, "num_generations": 3, "temperature": 0.7, "lora_rank": 4, "_type": "param"}, "elapsed_s": 265.2261830139905}
{"schema": "v1", "run_id": "1da75a0acadd", "event_id": "c61451889500", "ts": 1774426965, "type": "proposal", "episode_id": "1da75a0acadd", "iter": 9, "params": {"diff": "--- a/train.py\n+++ b/train.py\n@@ -372,3 +372,5 @@\n         traceback.print_exc()\n         print(f\"FATAL: {exc}\", flush=True)\n         raise SystemExit(1)\n+\n+use_qk_norm = True\n", "_type": "diff"}}
{"schema": "v1", "run_id": "1da75a0acadd", "event_id": "3659942abfbb", "ts": 1774426965, "type": "iteration", "episode_id": "1da75a0acadd", "iter": 9, "status": "failed", "decision": "discard", "metrics": {}, "params": {"diff": "--- a/train.py\n+++ b/train.py\n@@ -372,3 +372,5 @@\n         traceback.print_exc()\n         print(f\"FATAL: {exc}\", flush=True)\n         raise SystemExit(1)\n+\n+use_qk_norm = True\n", "_type": "diff"}, "elapsed_s": 0.0}
{"schema": "v1", "run_id": "1da75a0acadd", "event_id": "048882222173", "ts": 1774427788, "type": "proposal", "episode_id": "1da75a0acadd", "iter": 10, "params": {"diff": "--- a/train.py\n+++ b/train.py\n@@ -372,3 +372,5 @@\n         traceback.print_exc()\n         print(f\"FATAL: {exc}\", flush=True)\n         raise SystemExit(1)\n+\n+use_qk_norm = True\n", "_type": "diff"}}
{"schema": "v1", "run_id": "1da75a0acadd", "event_id": "34b1383cee7e", "ts": 1774427788, "type": "iteration", "episode_id": "1da75a0acadd", "iter": 10, "status": "failed", "decision": "discard", "metrics": {}, "params": {"diff": "--- a/train.py\n+++ b/train.py\n@@ -372,3 +372,5 @@\n         traceback.print_exc()\n         print(f\"FATAL: {exc}\", flush=True)\n         raise SystemExit(1)\n+\n+use_qk_norm = True\n", "_type": "diff"}, "elapsed_s": 0.0}
{"schema": "v1", "run_id": "1da75a0acadd", "event_id": "11b9cd742f0b", "ts": 1774428594, "type": "proposal", "episode_id": "1da75a0acadd", "iter": 11, "params": {"diff": "--- a/train.py\n+++ b/train.py\n@@ -372,3 +372,5 @@\n         traceback.print_exc()\n         print(f\"FATAL: {exc}\", flush=True)\n         raise SystemExit(1)\n+\n+use_qk_norm = True\n", "_type": "diff"}}
{"schema": "v1", "run_id": "1da75a0acadd", "event_id": "76c8fa2def41", "ts": 1774428594, "type": "iteration", "episode_id": "1da75a0acadd", "iter": 11, "status": "failed", "decision": "discard", "metrics": {}, "params": {"diff": "--- a/train.py\n+++ b/train.py\n@@ -372,3 +372,5 @@\n         traceback.print_exc()\n         print(f\"FATAL: {exc}\", flush=True)\n         raise SystemExit(1)\n+\n+use_qk_norm = True\n", "_type": "diff"}, "elapsed_s": 0.0}
{"schema": "v1", "run_id": "1da75a0acadd", "event_id": "e3c193b744ae", "ts": 1774428881, "type": "proposal", "episode_id": "1da75a0acadd", "iter": 12, "params": {"learning_rate": 0.0003, "max_steps": 30, "num_generations": 3, "temperature": 0.7, "lora_rank": 16, "_type": "param"}}
{"schema": "v1", "run_id": "1da75a0acadd", "event_id": "62d68d25a4fe", "ts": 1774429102, "type": "iteration", "episode_id": "1da75a0acadd", "iter": 12, "status": "ok", "decision": "discard", "metrics": {"rank": 16.0, "eval_score": 0.403636, "decision_accuracy": 0.2, "json_compliance": 0.945455, "loss": 0.004908, "training_seconds": 81.2}, "params": {"learning_rate": 0.0003, "max_steps": 30, "num_generations": 3, "temperature": 0.7, "lora_rank": 16, "_type": "param"}, "elapsed_s": 220.7622164171189}
{"schema": "v1", "run_id": "1da75a0acadd", "event_id": "fa5d1b6860a9", "ts": 1774429379, "type": "proposal", "episode_id": "1da75a0acadd", "iter": 13, "params": {"learning_rate": 5e-05, "max_steps": 30, "num_generations": 2, "temperature": 0.9, "lora_rank": 8, "_type": "param"}}
{"schema": "v1", "run_id": "1da75a0acadd", "event_id": "050931edd5e9", "ts": 1774429615, "type": "iteration", "episode_id": "1da75a0acadd", "iter": 13, "status": "ok", "decision": "discard", "metrics": {"rank": 8.0, "eval_score": 0.517273, "decision_accuracy": 0.209091, "json_compliance": 0.963636, "loss": 0.002003, "training_seconds": 63.2}, "params": {"learning_rate": 5e-05, "max_steps": 30, "num_generations": 2, "temperature": 0.9, "lora_rank": 8, "_type": "param"}, "elapsed_s": 235.09386754594743}
{"schema": "v1", "run_id": "1da75a0acadd", "event_id": "2f96c4f612e2", "ts": 1774429898, "type": "proposal", "episode_id": "1da75a0acadd", "iter": 14, "params": {"learning_rate": 5e-05, "max_steps": 30, "num_generations": 2, "temperature": 0.9, "lora_rank": 4, "_type": "param"}}
{"schema": "v1", "run_id": "1da75a0acadd", "event_id": "ca67236c3b18", "ts": 1774430038, "type": "iteration", "episode_id": "1da75a0acadd", "iter": 14, "status": "ok", "decision": "discard", "metrics": {"rank": 4.0, "eval_score": 0.5, "decision_accuracy": 0.209091, "json_compliance": 0.963636, "loss": 0.000763, "training_seconds": 62.9}, "params": {"learning_rate": 5e-05, "max_steps": 30, "num_generations": 2, "temperature": 0.9, "lora_rank": 4, "_type": "param"}, "elapsed_s": 139.0470677325502}
{"schema": "v1", "run_id": "1da75a0acadd", "event_id": "c29e21411c4d", "ts": 1774430315, "type": "proposal", "episode_id": "1da75a0acadd", "iter": 15, "params": {"learning_rate": 0.0003, "max_steps": 30, "num_generations": 2, "temperature": 0.7, "lora_rank": 16, "_type": "param"}}
{"schema": "v1", "run_id": "1da75a0acadd", "event_id": "f66dff124414", "ts": 1774430456, "type": "iteration", "episode_id": "1da75a0acadd", "iter": 15, "status": "ok", "decision": "discard", "metrics": {"rank": 16.0, "eval_score": 0.521818, "decision_accuracy": 0.2, "json_compliance": 0.963636, "loss": 0.000138, "training_seconds": 60.9}, "params": {"learning_rate": 0.0003, "max_steps": 30, "num_generations": 2, "temperature": 0.7, "lora_rank": 16, "_type": "param"}, "elapsed_s": 139.67969274614006}
{"schema": "v1", "run_id": "1da75a0acadd", "event_id": "75b609a11795", "ts": 1774430576, "type": "proposal", "episode_id": "1da75a0acadd", "iter": 16, "params": {"learning_rate": 5e-05, "max_steps": 50, "num_generations": 2, "temperature": 0.9, "lora_rank": 16, "_type": "param"}}
{"schema": "v1", "run_id": "1da75a0acadd", "event_id": "a9c9f0330e08", "ts": 1774430766, "type": "iteration", "episode_id": "1da75a0acadd", "iter": 16, "status": "ok", "decision": "discard", "metrics": {"rank": 16.0, "eval_score": 0.505455, "decision_accuracy": 0.209091, "json_compliance": 0.954545, "loss": 0.004303, "training_seconds": 88.1}, "params": {"learning_rate": 5e-05, "max_steps": 50, "num_generations": 2, "temperature": 0.9, "lora_rank": 16, "_type": "param"}, "elapsed_s": 189.5656614722684}
{"schema": "v1", "run_id": "1da75a0acadd", "event_id": "b73210ef3c84", "ts": 1774430792, "type": "proposal", "episode_id": "1da75a0acadd", "iter": 17, "params": {"learning_rate": 5e-05, "max_steps": 80, "num_generations": 2, "temperature": 0.9, "lora_rank": 8, "_type": "param"}}
{"schema": "v1", "run_id": "1da75a0acadd", "event_id": "5f26458b0df0", "ts": 1774431195, "type": "iteration", "episode_id": "1da75a0acadd", "iter": 17, "status": "ok", "decision": "keep", "metrics": {"rank": 8.0, "eval_score": 0.555455, "decision_accuracy": 0.209091, "json_compliance": 0.963636, "loss": 0.001183, "training_seconds": 103.3}, "params": {"learning_rate": 5e-05, "max_steps": 80, "num_generations": 2, "temperature": 0.9, "lora_rank": 8, "_type": "param"}, "elapsed_s": 402.98328904621303}
{"schema": "v1", "run_id": "1da75a0acadd", "event_id": "a6ddb088ed9f", "ts": 1774431471, "type": "proposal", "episode_id": "1da75a0acadd", "iter": 18, "params": {"learning_rate": 0.0003, "max_steps": 50, "num_generations": 2, "temperature": 0.7, "lora_rank": 4, "_type": "param"}}
{"schema": "v1", "run_id": "1da75a0acadd", "event_id": "548340684c8b", "ts": 1774431831, "type": "iteration", "episode_id": "1da75a0acadd", "iter": 18, "status": "ok", "decision": "discard", "metrics": {"rank": 4.0, "eval_score": 0.52, "decision_accuracy": 0.2, "json_compliance": 0.954545, "loss": 0.000846, "training_seconds": 80.3}, "params": {"learning_rate": 0.0003, "max_steps": 50, "num_generations": 2, "temperature": 0.7, "lora_rank": 4, "_type": "param"}, "elapsed_s": 359.4029231881723}
{"schema": "v1", "run_id": "1da75a0acadd", "event_id": "2467a315a1e3", "ts": 1774431928, "type": "proposal", "episode_id": "1da75a0acadd", "iter": 19, "params": {"learning_rate": 5e-05, "max_steps": 80, "num_generations": 2, "temperature": 0.9, "lora_rank": 16, "_type": "param"}}
{"schema": "v1", "run_id": "1da75a0acadd", "event_id": "3b0f7aee62e2", "ts": 1774432123, "type": "iteration", "episode_id": "1da75a0acadd", "iter": 19, "status": "ok", "decision": "discard", "metrics": {"rank": 16.0, "eval_score": 0.539091, "decision_accuracy": 0.209091, "json_compliance": 0.963636, "loss": 0.00054, "training_seconds": 107.0}, "params": {"learning_rate": 5e-05, "max_steps": 80, "num_generations": 2, "temperature": 0.9, "lora_rank": 16, "_type": "param"}, "elapsed_s": 194.43533167336136}
{"schema": "v1", "run_id": "1da75a0acadd", "event_id": "12f32b2e4caa", "ts": 1774432401, "type": "proposal", "episode_id": "1da75a0acadd", "iter": 20, "params": {"learning_rate": 0.0003, "max_steps": 30, "num_generations": 3, "temperature": 0.9, "lora_rank": 4, "_type": "param"}}
{"schema": "v1", "run_id": "1da75a0acadd", "event_id": "c4ffada723c6", "ts": 1774432576, "type": "iteration", "episode_id": "1da75a0acadd", "iter": 20, "status": "ok", "decision": "keep", "metrics": {"rank": 4.0, "eval_score": 0.615455, "decision_accuracy": 0.209091, "json_compliance": 0.990909, "loss": 0.012992, "training_seconds": 84.8}, "params": {"learning_rate": 0.0003, "max_steps": 30, "num_generations": 3, "temperature": 0.9, "lora_rank": 4, "_type": "param"}, "elapsed_s": 174.32953631319106}
{"schema": "v1", "run_id": "1da75a0acadd", "event_id": "00b14288aa94", "ts": 1774432623, "type": "proposal", "episode_id": "1da75a0acadd", "iter": 21, "params": {"learning_rate": 0.0003, "max_steps": 50, "num_generations": 3, "temperature": 0.9, "lora_rank": 4, "_type": "param"}}
{"schema": "v1", "run_id": "1da75a0acadd", "event_id": "b9cc54380d69", "ts": 1774433109, "type": "iteration", "episode_id": "1da75a0acadd", "iter": 21, "status": "ok", "decision": "discard", "metrics": {"rank": 4.0, "eval_score": 0.515455, "decision_accuracy": 0.190909, "json_compliance": 0.954545, "loss": 0.001576, "training_seconds": 133.1}, "params": {"learning_rate": 0.0003, "max_steps": 50, "num_generations": 3, "temperature": 0.9, "lora_rank": 4, "_type": "param"}, "elapsed_s": 479.1872517056763}
{"schema": "v1", "run_id": "1da75a0acadd", "event_id": "48b7349e9f54", "ts": 1774433388, "type": "proposal", "episode_id": "1da75a0acadd", "iter": 22, "params": {"learning_rate": 0.0003, "max_steps": 30, "num_generations": 3, "temperature": 0.7, "lora_rank": 4, "_type": "param"}}
{"schema": "v1", "run_id": "1da75a0acadd", "event_id": "e7ffa733c99e", "ts": 1774433707, "type": "iteration", "episode_id": "1da75a0acadd", "iter": 22, "status": "ok", "decision": "discard", "metrics": {"rank": 4.0, "eval_score": 0.308182, "decision_accuracy": 0.063636, "json_compliance": 0.590909, "loss": 0.008207, "training_seconds": 103.4}, "params": {"learning_rate": 0.0003, "max_steps": 30, "num_generations": 3, "temperature": 0.7, "lora_rank": 4, "_type": "param"}, "elapsed_s": 311.4177431827411}
{"schema": "v1", "run_id": "1da75a0acadd", "event_id": "72220b575dca", "ts": 1774433757, "type": "proposal", "episode_id": "1da75a0acadd", "iter": 23, "params": {"learning_rate": 0.0003, "max_steps": 30, "num_generations": 3, "temperature": 0.9, "lora_rank": 8, "_type": "param"}}
{"schema": "v1", "run_id": "1da75a0acadd", "event_id": "c0e11ac21698", "ts": 1774434135, "type": "iteration", "episode_id": "1da75a0acadd", "iter": 23, "status": "ok", "decision": "discard", "metrics": {"rank": 8.0, "eval_score": 0.521818, "decision_accuracy": 0.2, "json_compliance": 0.963636, "loss": 0.008016, "training_seconds": 90.1}, "params": {"learning_rate": 0.0003, "max_steps": 30, "num_generations": 3, "temperature": 0.9, "lora_rank": 8, "_type": "param"}, "elapsed_s": 377.901169879362}
{"schema": "v1", "run_id": "1da75a0acadd", "event_id": "020cd0b1339c", "ts": 1774434156, "type": "proposal", "episode_id": "1da75a0acadd", "iter": 24, "params": {"learning_rate": 0.0003, "max_steps": 30, "num_generations": 3, "temperature": 0.9, "lora_rank": 16, "_type": "param"}}
{"schema": "v1", "run_id": "1da75a0acadd", "event_id": "f5bdfec7feda", "ts": 1774434352, "type": "iteration", "episode_id": "1da75a0acadd", "iter": 24, "status": "ok", "decision": "discard", "metrics": {"rank": 16.0, "eval_score": 0.416364, "decision_accuracy": 0.072727, "json_compliance": 0.681818, "loss": 0.013638, "training_seconds": 92.4}, "params": {"learning_rate": 0.0003, "max_steps": 30, "num_generations": 3, "temperature": 0.9, "lora_rank": 16, "_type": "param"}, "elapsed_s": 194.17100362293422}
{"schema": "v1", "run_id": "1da75a0acadd", "event_id": "7be05aaa613a", "ts": 1774434641, "type": "proposal", "episode_id": "1da75a0acadd", "iter": 25, "params": {"learning_rate": 0.0003, "max_steps": 80, "num_generations": 2, "temperature": 0.9, "lora_rank": 4, "_type": "param"}}
{"schema": "v1", "run_id": "1da75a0acadd", "event_id": "0629b1d586b2", "ts": 1774434838, "type": "iteration", "episode_id": "1da75a0acadd", "iter": 25, "status": "ok", "decision": "discard", "metrics": {"rank": 4.0, "eval_score": 0.525455, "decision_accuracy": 0.209091, "json_compliance": 0.963636, "loss": 0.000184, "training_seconds": 110.5}, "params": {"learning_rate": 0.0003, "max_steps": 80, "num_generations": 2, "temperature": 0.9, "lora_rank": 4, "_type": "param"}, "elapsed_s": 195.78919992875308}
{"schema": "v1", "run_id": "1da75a0acadd", "event_id": "817cdcf9729f", "ts": 1774435125, "type": "proposal", "episode_id": "1da75a0acadd", "iter": 26, "params": {"learning_rate": 0.0003, "max_steps": 80, "num_generations": 2, "temperature": 0.7, "lora_rank": 16, "_type": "param"}}
{"schema": "v1", "run_id": "1da75a0acadd", "event_id": "ae62c663b0ed", "ts": 1774435306, "type": "iteration", "episode_id": "1da75a0acadd", "iter": 26, "status": "ok", "decision": "discard", "metrics": {"rank": 16.0, "eval_score": 0.525455, "decision_accuracy": 0.209091, "json_compliance": 0.963636, "loss": 6e-05, "training_seconds": 101.8}, "params": {"learning_rate": 0.0003, "max_steps": 80, "num_generations": 2, "temperature": 0.7, "lora_rank": 16, "_type": "param"}, "elapsed_s": 179.76654014363885}
{"schema": "v1", "run_id": "1da75a0acadd", "event_id": "279b0bab386a", "ts": 1774435357, "type": "proposal", "episode_id": "1da75a0acadd", "iter": 27, "params": {"learning_rate": 0.0003, "max_steps": 80, "num_generations": 3, "temperature": 0.9, "lora_rank": 4, "_type": "param"}}
