{"schema": "v1", "run_id": "1da75a0acadd", "event_id": "8025560c84ab", "ts": 1774435620, "type": "iteration", "episode_id": "1da75a0acadd", "iter": 27, "status": "ok", "decision": "discard", "metrics": {"rank": 4.0, "eval_score": 0.42, "decision_accuracy": 0.209091, "json_compliance": 0.981818, "loss": 0.003109, "training_seconds": 161.6}, "params": {"learning_rate": 0.0003, "max_steps": 80, "num_generations": 3, "temperature": 0.9, "lora_rank": 4, "_type": "param"}, "elapsed_s": 261.0507219489664}
{"schema": "v1", "run_id": "1da75a0acadd", "event_id": "5071e79fd5cf", "ts": 1774435670, "type": "proposal", "episode_id": "1da75a0acadd", "iter": 28, "params": {"learning_rate": 0.0001, "max_steps": 50, "num_generations": 2, "temperature": 0.9, "lora_rank": 8, "_type": "param"}}
{"schema": "v1", "run_id": "1da75a0acadd", "event_id": "14bcb9c68598", "ts": 1774435845, "type": "iteration", "episode_id": "1da75a0acadd", "iter": 28, "status": "ok", "decision": "discard", "metrics": {"rank": 8.0, "eval_score": 0.525455, "decision_accuracy": 0.209091, "json_compliance": 0.963636, "loss": 0.001052, "training_seconds": 82.0}, "params": {"learning_rate": 0.0001, "max_steps": 50, "num_generations": 2, "temperature": 0.9, "lora_rank": 8, "_type": "param"}, "elapsed_s": 174.16019460745156}
{"schema": "v1", "run_id": "1da75a0acadd", "event_id": "97e64f20351f", "ts": 1774436150, "type": "proposal", "episode_id": "1da75a0acadd", "iter": 29, "params": {"learning_rate": 5e-05, "max_steps": 80, "num_generations": 2, "temperature": 0.9, "lora_rank": 8, "_type": "param"}}
{"schema": "v1", "run_id": "1da75a0acadd", "event_id": "4bd8b2088c35", "ts": 1774436330, "type": "iteration", "episode_id": "1da75a0acadd", "iter": 29, "status": "ok", "decision": "discard", "metrics": {"rank": 8.0, "eval_score": 0.510909, "decision_accuracy": 0.209091, "json_compliance": 0.963636, "loss": 0.000467, "training_seconds": 101.5}, "params": {"learning_rate": 5e-05, "max_steps": 80, "num_generations": 2, "temperature": 0.9, "lora_rank": 8, "_type": "param"}, "elapsed_s": 179.84750929754227}
{"schema": "v1", "run_id": "1da75a0acadd", "event_id": "82a021857862", "ts": 1774436623, "type": "proposal", "episode_id": "1da75a0acadd", "iter": 30, "params": {"learning_rate": 5e-05, "max_steps": 50, "num_generations": 3, "temperature": 0.9, "lora_rank": 8, "_type": "param"}}
{"schema": "v1", "run_id": "1da75a0acadd", "event_id": "d94d095b964c", "ts": 1774437099, "type": "iteration", "episode_id": "1da75a0acadd", "iter": 30, "status": "ok", "decision": "discard", "metrics": {"rank": 8.0, "eval_score": 0.522727, "decision_accuracy": 0.2, "json_compliance": 0.963636, "loss": 0.002651, "training_seconds": 107.8}, "params": {"learning_rate": 5e-05, "max_steps": 50, "num_generations": 3, "temperature": 0.9, "lora_rank": 8, "_type": "param"}, "elapsed_s": 475.7661043293774}
{"schema": "v1", "run_id": "1da75a0acadd", "event_id": "ffb55fd7e356", "ts": 1774437366, "type": "proposal", "episode_id": "1da75a0acadd", "iter": 31, "params": {"learning_rate": 0.0003, "max_steps": 50, "num_generations": 3, "temperature": 0.9, "lora_rank": 4, "_type": "param"}}
{"schema": "v1", "run_id": "1da75a0acadd", "event_id": "dcb2b3de9298", "ts": 1774437611, "type": "iteration", "episode_id": "1da75a0acadd", "iter": 31, "status": "ok", "decision": "discard", "metrics": {"rank": 4.0, "eval_score": 0.409091, "decision_accuracy": 0.2, "json_compliance": 0.963636, "loss": -0.000944, "training_seconds": 96.6}, "params": {"learning_rate": 0.0003, "max_steps": 50, "num_generations": 3, "temperature": 0.9, "lora_rank": 4, "_type": "param"}, "elapsed_s": 240.78690929990262}
{"schema": "v1", "run_id": "1da75a0acadd", "event_id": "ceeadad4180f", "ts": 1774437888, "type": "proposal", "episode_id": "1da75a0acadd", "iter": 32, "params": {"learning_rate": 5e-05, "max_steps": 80, "num_generations": 2, "temperature": 0.7, "lora_rank": 16, "_type": "param"}}
{"schema": "v1", "run_id": "1da75a0acadd", "event_id": "fcec46691db4", "ts": 1774438109, "type": "iteration", "episode_id": "1da75a0acadd", "iter": 32, "status": "ok", "decision": "discard", "metrics": {"rank": 16.0, "eval_score": 0.517273, "decision_accuracy": 0.209091, "json_compliance": 0.963636, "loss": 0.000448, "training_seconds": 113.5}, "params": {"learning_rate": 5e-05, "max_steps": 80, "num_generations": 2, "temperature": 0.7, "lora_rank": 16, "_type": "param"}, "elapsed_s": 220.31695611868054}
{"schema": "v1", "run_id": "1da75a0acadd", "event_id": "8e7c7e65ffeb", "ts": 1774438369, "type": "proposal", "episode_id": "1da75a0acadd", "iter": 33, "params": {"learning_rate": 0.0001, "max_steps": 80, "num_generations": 3, "temperature": 0.9, "lora_rank": 16, "_type": "param"}}
{"schema": "v1", "run_id": "1da75a0acadd", "event_id": "1d36812e27b0", "ts": 1774438626, "type": "iteration", "episode_id": "1da75a0acadd", "iter": 33, "status": "ok", "decision": "discard", "metrics": {"rank": 16.0, "eval_score": 0.409091, "decision_accuracy": 0.2, "json_compliance": 0.963636, "loss": 0.004408, "training_seconds": 164.0}, "params": {"learning_rate": 0.0001, "max_steps": 80, "num_generations": 3, "temperature": 0.9, "lora_rank": 16, "_type": "param"}, "elapsed_s": 255.85851802583784}
{"schema": "v1", "run_id": "1da75a0acadd", "event_id": "88728b888e1c", "ts": 1774438912, "type": "proposal", "episode_id": "1da75a0acadd", "iter": 34, "params": {"learning_rate": 0.0001, "max_steps": 50, "num_generations": 2, "temperature": 0.7, "lora_rank": 16, "_type": "param"}}
{"schema": "v1", "run_id": "1da75a0acadd", "event_id": "4c5b8c2c85bd", "ts": 1774439086, "type": "iteration", "episode_id": "1da75a0acadd", "iter": 34, "status": "ok", "decision": "discard", "metrics": {"rank": 16.0, "eval_score": 0.443636, "decision_accuracy": 0.2, "json_compliance": 0.954545, "loss": 0.001992, "training_seconds": 82.3}, "params": {"learning_rate": 0.0001, "max_steps": 50, "num_generations": 2, "temperature": 0.7, "lora_rank": 16, "_type": "param"}, "elapsed_s": 173.94823300652206}
{"schema": "v1", "run_id": "1da75a0acadd", "event_id": "a43c65e46aa4", "ts": 1774439358, "type": "proposal", "episode_id": "1da75a0acadd", "iter": 35, "params": {"learning_rate": 0.0001, "max_steps": 30, "num_generations": 3, "temperature": 0.7, "lora_rank": 8, "_type": "param"}}
{"schema": "v1", "run_id": "1da75a0acadd", "event_id": "e57a29f79b6b", "ts": 1774439533, "type": "iteration", "episode_id": "1da75a0acadd", "iter": 35, "status": "ok", "decision": "keep", "metrics": {"rank": 8.0, "eval_score": 0.634545, "decision_accuracy": 0.763636, "json_compliance": 0.963636, "loss": 0.000467, "training_seconds": 78.7}, "params": {"learning_rate": 0.0001, "max_steps": 30, "num_generations": 3, "temperature": 0.7, "lora_rank": 8, "_type": "param"}, "elapsed_s": 174.7117265034467}
{"schema": "v1", "run_id": "1da75a0acadd", "event_id": "f5f9368c60dc", "ts": 1774439831, "type": "proposal", "episode_id": "1da75a0acadd", "iter": 36, "params": {"learning_rate": 0.0001, "max_steps": 30, "num_generations": 2, "temperature": 0.9, "lora_rank": 8, "_type": "param"}}
{"schema": "v1", "run_id": "1da75a0acadd", "event_id": "e4ca8601d8bd", "ts": 1774439991, "type": "iteration", "episode_id": "1da75a0acadd", "iter": 36, "status": "ok", "decision": "discard", "metrics": {"rank": 8.0, "eval_score": 0.57, "decision_accuracy": 0.209091, "json_compliance": 0.954545, "loss": 0.002258, "training_seconds": 63.5}, "params": {"learning_rate": 0.0001, "max_steps": 30, "num_generations": 2, "temperature": 0.9, "lora_rank": 8, "_type": "param"}, "elapsed_s": 159.12145652715117}
{"schema": "v1", "run_id": "1da75a0acadd", "event_id": "c52e6214c2c1", "ts": 1774440295, "type": "proposal", "episode_id": "1da75a0acadd", "iter": 37, "params": {"learning_rate": 0.0003, "max_steps": 50, "num_generations": 3, "temperature": 0.9, "lora_rank": 4, "_type": "param"}}
{"schema": "v1", "run_id": "1da75a0acadd", "event_id": "3b9ecb331352", "ts": 1774440551, "type": "iteration", "episode_id": "1da75a0acadd", "iter": 37, "status": "ok", "decision": "discard", "metrics": {"rank": 4.0, "eval_score": 0.603636, "decision_accuracy": 0.2, "json_compliance": 0.972727, "loss": 0.017828, "training_seconds": 174.1}, "params": {"learning_rate": 0.0003, "max_steps": 50, "num_generations": 3, "temperature": 0.9, "lora_rank": 4, "_type": "param"}, "elapsed_s": 255.89624125044793}
{"schema": "v1", "run_id": "1da75a0acadd", "event_id": "67bed106be22", "ts": 1774440835, "type": "proposal", "episode_id": "1da75a0acadd", "iter": 38, "params": {"learning_rate": 5e-05, "max_steps": 50, "num_generations": 3, "temperature": 0.7, "lora_rank": 4, "_type": "param"}}
{"schema": "v1", "run_id": "1da75a0acadd", "event_id": "842ee56b7a8f", "ts": 1774441031, "type": "iteration", "episode_id": "1da75a0acadd", "iter": 38, "status": "ok", "decision": "discard", "metrics": {"rank": 4.0, "eval_score": 0.523182, "decision_accuracy": 0.209091, "json_compliance": 0.963636, "loss": 0.005632, "training_seconds": 111.8}, "params": {"learning_rate": 5e-05, "max_steps": 50, "num_generations": 3, "temperature": 0.7, "lora_rank": 4, "_type": "param"}, "elapsed_s": 195.0631871689111}
{"schema": "v1", "run_id": "1da75a0acadd", "event_id": "d539a875ff6a", "ts": 1774441301, "type": "proposal", "episode_id": "1da75a0acadd", "iter": 39, "params": {"learning_rate": 0.0003, "max_steps": 80, "num_generations": 3, "temperature": 0.9, "lora_rank": 8, "_type": "param"}}
{"schema": "v1", "run_id": "1da75a0acadd", "event_id": "c5bce32b9c87", "ts": 1774441585, "type": "iteration", "episode_id": "1da75a0acadd", "iter": 39, "status": "ok", "decision": "discard", "metrics": {"rank": 8.0, "eval_score": 0.523636, "decision_accuracy": 0.209091, "json_compliance": 0.963636, "loss": 0.007537, "training_seconds": 185.1}, "params": {"learning_rate": 0.0003, "max_steps": 80, "num_generations": 3, "temperature": 0.9, "lora_rank": 8, "_type": "param"}, "elapsed_s": 282.6443424541503}
{"schema": "v1", "run_id": "1da75a0acadd", "event_id": "d64eaf987122", "ts": 1774441880, "type": "proposal", "episode_id": "1da75a0acadd", "iter": 40, "params": {"learning_rate": 0.0003, "max_steps": 50, "num_generations": 3, "temperature": 0.7, "lora_rank": 8, "_type": "param"}}
{"schema": "v1", "run_id": "1da75a0acadd", "event_id": "fe9537226a6d", "ts": 1774442061, "type": "iteration", "episode_id": "1da75a0acadd", "iter": 40, "status": "ok", "decision": "discard", "metrics": {"rank": 8.0, "eval_score": 0.521818, "decision_accuracy": 0.2, "json_compliance": 0.963636, "loss": 0.003117, "training_seconds": 100.3}, "params": {"learning_rate": 0.0003, "max_steps": 50, "num_generations": 3, "temperature": 0.7, "lora_rank": 8, "_type": "param"}, "elapsed_s": 180.01692003197968}
{"schema": "v1", "run_id": "1da75a0acadd", "event_id": "e3bcbf3fb178", "ts": 1774442349, "type": "proposal", "episode_id": "1da75a0acadd", "iter": 41, "params": {"learning_rate": 0.0001, "max_steps": 30, "num_generations": 2, "temperature": 0.9, "lora_rank": 4, "_type": "param"}}
{"schema": "v1", "run_id": "1da75a0acadd", "event_id": "d2599bd63764", "ts": 1774442509, "type": "iteration", "episode_id": "1da75a0acadd", "iter": 41, "status": "ok", "decision": "discard", "metrics": {"rank": 4.0, "eval_score": 0.516364, "decision_accuracy": 0.209091, "json_compliance": 0.954545, "loss": 0.00162, "training_seconds": 66.9}, "params": {"learning_rate": 0.0001, "max_steps": 30, "num_generations": 2, "temperature": 0.9, "lora_rank": 4, "_type": "param"}, "elapsed_s": 159.44940016698092}
{"schema": "v1", "run_id": "1da75a0acadd", "event_id": "98959d27f124", "ts": 1774442785, "type": "proposal", "episode_id": "1da75a0acadd", "iter": 42, "params": {"learning_rate": 5e-05, "max_steps": 50, "num_generations": 2, "temperature": 0.7, "lora_rank": 8, "_type": "param"}}
{"schema": "v1", "run_id": "1da75a0acadd", "event_id": "6f42b2e23968", "ts": 1774442961, "type": "iteration", "episode_id": "1da75a0acadd", "iter": 42, "status": "ok", "decision": "discard", "metrics": {"rank": 8.0, "eval_score": 0.506364, "decision_accuracy": 0.209091, "json_compliance": 0.963636, "loss": 0.001833, "training_seconds": 85.5}, "params": {"learning_rate": 5e-05, "max_steps": 50, "num_generations": 2, "temperature": 0.7, "lora_rank": 8, "_type": "param"}, "elapsed_s": 174.53572520799935}
{"schema": "v1", "run_id": "1da75a0acadd", "event_id": "e990a2169d66", "ts": 1774443243, "type": "proposal", "episode_id": "1da75a0acadd", "iter": 43, "params": {"learning_rate": 0.0001, "max_steps": 50, "num_generations": 2, "temperature": 0.7, "lora_rank": 8, "_type": "param"}}
{"schema": "v1", "run_id": "1da75a0acadd", "event_id": "5665fa5e7892", "ts": 1774443419, "type": "iteration", "episode_id": "1da75a0acadd", "iter": 43, "status": "ok", "decision": "discard", "metrics": {"rank": 8.0, "eval_score": 0.517727, "decision_accuracy": 0.2, "json_compliance": 0.963636, "loss": 0.00149, "training_seconds": 84.0}, "params": {"learning_rate": 0.0001, "max_steps": 50, "num_generations": 2, "temperature": 0.7, "lora_rank": 8, "_type": "param"}, "elapsed_s": 175.32370460033417}
{"schema": "v1", "run_id": "1da75a0acadd", "event_id": "e970e5aea9b5", "ts": 1774443710, "type": "proposal", "episode_id": "1da75a0acadd", "iter": 44, "params": {"learning_rate": 0.0001, "max_steps": 80, "num_generations": 3, "temperature": 0.7, "lora_rank": 8, "_type": "param"}}
{"schema": "v1", "run_id": "1da75a0acadd", "event_id": "5b7483b186c4", "ts": 1774444042, "type": "iteration", "episode_id": "1da75a0acadd", "iter": 44, "status": "ok", "decision": "discard", "metrics": {"rank": 8.0, "eval_score": 0.406364, "decision_accuracy": 0.2, "json_compliance": 0.954545, "loss": 0.006535, "training_seconds": 153.3}, "params": {"learning_rate": 0.0001, "max_steps": 80, "num_generations": 3, "temperature": 0.7, "lora_rank": 8, "_type": "param"}, "elapsed_s": 331.1558354254812}
{"schema": "v1", "run_id": "1da75a0acadd", "event_id": "ea1894dc586a", "ts": 1774444314, "type": "proposal", "episode_id": "1da75a0acadd", "iter": 45, "params": {"learning_rate": 0.0003, "max_steps": 50, "num_generations": 3, "temperature": 0.9, "lora_rank": 16, "_type": "param"}}
{"schema": "v1", "run_id": "1da75a0acadd", "event_id": "bab9d785ec44", "ts": 1774444625, "type": "iteration", "episode_id": "1da75a0acadd", "iter": 45, "status": "ok", "decision": "discard", "metrics": {"rank": 16.0, "eval_score": 0.466364, "decision_accuracy": 0.209091, "json_compliance": 0.990909, "loss": 0.009075, "training_seconds": 118.5}, "params": {"learning_rate": 0.0003, "max_steps": 50, "num_generations": 3, "temperature": 0.9, "lora_rank": 16, "_type": "param"}, "elapsed_s": 309.7569393739104}
{"schema": "v1", "run_id": "1da75a0acadd", "event_id": "ccd027fdfd3c", "ts": 1774444918, "type": "proposal", "episode_id": "1da75a0acadd", "iter": 46, "params": {"learning_rate": 0.0001, "max_steps": 30, "num_generations": 2, "temperature": 0.7, "lora_rank": 4, "_type": "param"}}
{"schema": "v1", "run_id": "1da75a0acadd", "event_id": "04beb7bf316a", "ts": 1774445074, "type": "iteration", "episode_id": "1da75a0acadd", "iter": 46, "status": "ok", "decision": "discard", "metrics": {"rank": 4.0, "eval_score": 0.505455, "decision_accuracy": 0.218182, "json_compliance": 0.963636, "loss": 0.002261, "training_seconds": 65.9}, "params": {"learning_rate": 0.0001, "max_steps": 30, "num_generations": 2, "temperature": 0.7, "lora_rank": 4, "_type": "param"}, "elapsed_s": 154.65352286957204}
{"schema": "v1", "run_id": "1da75a0acadd", "event_id": "fbef15a84381", "ts": 1774445300, "type": "proposal", "episode_id": "1da75a0acadd", "iter": 47, "params": {"learning_rate": 5e-05, "max_steps": 50, "num_generations": 3, "temperature": 0.7, "lora_rank": 8, "_type": "param"}}
{"schema": "v1", "run_id": "1da75a0acadd", "event_id": "5590f5b0e2ba", "ts": 1774445810, "type": "iteration", "episode_id": "1da75a0acadd", "iter": 47, "status": "ok", "decision": "discard", "metrics": {"rank": 8.0, "eval_score": 0.441818, "decision_accuracy": 0.209091, "json_compliance": 0.963636, "loss": 0.00428, "training_seconds": 115.5}, "params": {"learning_rate": 5e-05, "max_steps": 50, "num_generations": 3, "temperature": 0.7, "lora_rank": 8, "_type": "param"}, "elapsed_s": 509.2605629535392}
{"schema": "v1", "run_id": "1da75a0acadd", "event_id": "acde585c9e76", "ts": 1774446081, "type": "proposal", "episode_id": "1da75a0acadd", "iter": 48, "params": {"learning_rate": 5e-05, "max_steps": 30, "num_generations": 2, "temperature": 0.7, "lora_rank": 8, "_type": "param"}}
{"schema": "v1", "run_id": "1da75a0acadd", "event_id": "d82f84f7d081", "ts": 1774446221, "type": "iteration", "episode_id": "1da75a0acadd", "iter": 48, "status": "ok", "decision": "discard", "metrics": {"rank": 8.0, "eval_score": 0.520909, "decision_accuracy": 0.236364, "json_compliance": 0.963636, "loss": 0.000672, "training_seconds": 62.2}, "params": {"learning_rate": 5e-05, "max_steps": 30, "num_generations": 2, "temperature": 0.7, "lora_rank": 8, "_type": "param"}, "elapsed_s": 139.56274609826505}
{"schema": "v1", "run_id": "1da75a0acadd", "event_id": "9be4fe492088", "ts": 1774446431, "type": "proposal", "episode_id": "1da75a0acadd", "iter": 49, "params": {"learning_rate": 5e-05, "max_steps": 30, "num_generations": 2, "temperature": 0.7, "lora_rank": 8, "_type": "param"}}
{"schema": "v1", "run_id": "1da75a0acadd", "event_id": "5d7b994027e2", "ts": 1774446587, "type": "iteration", "episode_id": "1da75a0acadd", "iter": 49, "status": "ok", "decision": "discard", "metrics": {"rank": 8.0, "eval_score": 0.562727, "decision_accuracy": 0.309091, "json_compliance": 0.963636, "loss": 0.00098, "training_seconds": 65.4}, "params": {"learning_rate": 5e-05, "max_steps": 30, "num_generations": 2, "temperature": 0.7, "lora_rank": 8, "_type": "param"}, "elapsed_s": 154.8110552476719}
{"schema": "v1", "run_id": "1da75a0acadd", "event_id": "f900da7b44b0", "ts": 1774446850, "type": "proposal", "episode_id": "1da75a0acadd", "iter": 50, "params": {"learning_rate": 0.0003, "max_steps": 30, "num_generations": 3, "temperature": 0.9, "lora_rank": 4, "_type": "param"}}
{"schema": "v1", "run_id": "1da75a0acadd", "event_id": "af81e14bf1a4", "ts": 1774447032, "type": "iteration", "episode_id": "1da75a0acadd", "iter": 50, "status": "ok", "decision": "discard", "metrics": {"rank": 4.0, "eval_score": 0.510909, "decision_accuracy": 0.190909, "json_compliance": 0.945455, "loss": 0.006965, "training_seconds": 88.1}, "params": {"learning_rate": 0.0003, "max_steps": 30, "num_generations": 3, "temperature": 0.9, "lora_rank": 4, "_type": "param"}, "elapsed_s": 180.33435844723135}
{"schema": "v1", "run_id": "1da75a0acadd", "event_id": "e8c930ab9958", "ts": 1774447032, "type": "episode_summary", "episode_id": "1da75a0acadd", "mean": 0.501420525, "median": 0.517273, "min": 0.308182, "max": 0.634545, "stdev": 0.06327652770830486, "count": 40, "trend_slope": 0.0003847391181988797}
