{"schema": "v1", "run_id": "4a96c9cf159f", "event_id": "5112783508c9", "ts": 1777580209, "type": "proposal", "episode_id": "4a96c9cf159f", "iter": 0, "params": {"learning_rate": 5e-05, "max_steps": 30, "num_generations": 2, "temperature": 0.9, "lora_rank": 4, "AR_MODEL_DIR": "/data/models/ablation-v2-2026-04/A_seed2/v0000"}, "concurrency": 4}
{"schema": "v1", "run_id": "4a96c9cf159f", "event_id": "750da3745d90", "ts": 1777580209, "type": "proposal", "episode_id": "4a96c9cf159f", "iter": 1, "params": {"learning_rate": 0.0003, "max_steps": 80, "num_generations": 3, "temperature": 0.9, "lora_rank": 16, "AR_MODEL_DIR": "/data/models/ablation-v2-2026-04/A_seed2/v0001"}, "concurrency": 4}
{"schema": "v1", "run_id": "4a96c9cf159f", "event_id": "c24f914f296b", "ts": 1777580209, "type": "proposal", "episode_id": "4a96c9cf159f", "iter": 2, "params": {"learning_rate": 5e-05, "max_steps": 80, "num_generations": 2, "temperature": 0.7, "lora_rank": 8, "AR_MODEL_DIR": "/data/models/ablation-v2-2026-04/A_seed2/v0002"}, "concurrency": 4}
{"schema": "v1", "run_id": "4a96c9cf159f", "event_id": "b0808a015369", "ts": 1777580209, "type": "proposal", "episode_id": "4a96c9cf159f", "iter": 3, "params": {"learning_rate": 0.0003, "max_steps": 50, "num_generations": 3, "temperature": 0.9, "lora_rank": 16, "AR_MODEL_DIR": "/data/models/ablation-v2-2026-04/A_seed2/v0003"}, "concurrency": 4}
{"schema": "v1", "run_id": "4a96c9cf159f", "event_id": "c54225f5e13e", "ts": 1777580847, "type": "proposal", "episode_id": "4a96c9cf159f", "iter": 4, "params": {"learning_rate": 0.0001, "max_steps": 30, "num_generations": 2, "temperature": 0.9, "lora_rank": 8, "AR_MODEL_DIR": "/data/models/ablation-v2-2026-04/A_seed2/v0004"}, "concurrency": 4}
{"schema": "v1", "run_id": "4a96c9cf159f", "event_id": "3a8bcf90cccd", "ts": 1777580847, "type": "iteration", "episode_id": "4a96c9cf159f", "iter": 0, "status": "ok", "decision": "keep", "metrics": {"rank": 4.0, "eval_score": 0.515455, "decision_accuracy": 0.218182, "json_compliance": 0.963636, "loss": 0.000859, "training_seconds": 92.9}, "params": {"learning_rate": 5e-05, "max_steps": 30, "num_generations": 2, "temperature": 0.9, "lora_rank": 4, "AR_MODEL_DIR": "/data/models/ablation-v2-2026-04/A_seed2/v0000"}, "elapsed_s": 294.80666744103655, "concurrency": 4}
{"schema": "v1", "run_id": "4a96c9cf159f", "event_id": "cb46b59cec6d", "ts": 1777581127, "type": "proposal", "episode_id": "4a96c9cf159f", "iter": 5, "params": {"learning_rate": 0.0001, "max_steps": 50, "num_generations": 3, "temperature": 0.7, "lora_rank": 16, "AR_MODEL_DIR": "/data/models/ablation-v2-2026-04/A_seed2/v0005"}, "concurrency": 4}
{"schema": "v1", "run_id": "4a96c9cf159f", "event_id": "091268787656", "ts": 1777581127, "type": "proposal", "episode_id": "4a96c9cf159f", "iter": 6, "params": {"learning_rate": 5e-05, "max_steps": 30, "num_generations": 2, "temperature": 0.7, "lora_rank": 4, "AR_MODEL_DIR": "/data/models/ablation-v2-2026-04/A_seed2/v0006"}, "concurrency": 4}
{"schema": "v1", "run_id": "4a96c9cf159f", "event_id": "2fb2c411f40d", "ts": 1777581127, "type": "proposal", "episode_id": "4a96c9cf159f", "iter": 7, "params": {"learning_rate": 0.0001, "max_steps": 30, "num_generations": 2, "temperature": 0.9, "lora_rank": 16, "AR_MODEL_DIR": "/data/models/ablation-v2-2026-04/A_seed2/v0007"}, "concurrency": 4}
{"schema": "v1", "run_id": "4a96c9cf159f", "event_id": "3fd0f0afb7a6", "ts": 1777581127, "type": "iteration", "episode_id": "4a96c9cf159f", "iter": 1, "status": "ok", "decision": "discard", "metrics": {"rank": 16.0, "eval_score": 0.482636, "decision_accuracy": 0.209091, "json_compliance": 0.972727, "loss": 0.011685, "training_seconds": 240.8}, "params": {"learning_rate": 0.0003, "max_steps": 80, "num_generations": 3, "temperature": 0.9, "lora_rank": 16, "AR_MODEL_DIR": "/data/models/ablation-v2-2026-04/A_seed2/v0001"}, "elapsed_s": 355.07364442106336, "concurrency": 4}
{"schema": "v1", "run_id": "4a96c9cf159f", "event_id": "6be410084c52", "ts": 1777581127, "type": "iteration", "episode_id": "4a96c9cf159f", "iter": 2, "status": "ok", "decision": "discard", "metrics": {"rank": 8.0, "eval_score": 0.513636, "decision_accuracy": 0.209091, "json_compliance": 0.963636, "loss": 0.001256, "training_seconds": 165.4}, "params": {"learning_rate": 5e-05, "max_steps": 80, "num_generations": 2, "temperature": 0.7, "lora_rank": 8, "AR_MODEL_DIR": "/data/models/ablation-v2-2026-04/A_seed2/v0002"}, "elapsed_s": 291.1814828659408, "concurrency": 4}
{"schema": "v1", "run_id": "4a96c9cf159f", "event_id": "6928a6002cc5", "ts": 1777581127, "type": "iteration", "episode_id": "4a96c9cf159f", "iter": 3, "status": "ok", "decision": "discard", "metrics": {"rank": 16.0, "eval_score": 0.424545, "decision_accuracy": 0.209091, "json_compliance": 0.990909, "loss": 0.003628, "training_seconds": 172.0}, "params": {"learning_rate": 0.0003, "max_steps": 50, "num_generations": 3, "temperature": 0.9, "lora_rank": 16, "AR_MODEL_DIR": "/data/models/ablation-v2-2026-04/A_seed2/v0003"}, "elapsed_s": 389.26984706614166, "concurrency": 4}
{"schema": "v1", "run_id": "4a96c9cf159f", "event_id": "3768cb4e5444", "ts": 1777581127, "type": "iteration", "episode_id": "4a96c9cf159f", "iter": 4, "status": "ok", "decision": "keep", "metrics": {"rank": 8.0, "eval_score": 0.538182, "decision_accuracy": 0.209091, "json_compliance": 0.963636, "loss": 0.001598, "training_seconds": 95.9}, "params": {"learning_rate": 0.0001, "max_steps": 30, "num_generations": 2, "temperature": 0.9, "lora_rank": 8, "AR_MODEL_DIR": "/data/models/ablation-v2-2026-04/A_seed2/v0004"}, "elapsed_s": 227.20744250202551, "concurrency": 4}
{"schema": "v1", "run_id": "4a96c9cf159f", "event_id": "d860f311441d", "ts": 1777581504, "type": "iteration", "episode_id": "4a96c9cf159f", "iter": 5, "status": "ok", "decision": "discard", "metrics": {"rank": 16.0, "eval_score": 0.500909, "decision_accuracy": 0.2, "json_compliance": 0.936364, "loss": 0.007072, "training_seconds": 174.3}, "params": {"learning_rate": 0.0001, "max_steps": 50, "num_generations": 3, "temperature": 0.7, "lora_rank": 16, "AR_MODEL_DIR": "/data/models/ablation-v2-2026-04/A_seed2/v0005"}, "elapsed_s": 362.70624453481287, "concurrency": 4}
{"schema": "v1", "run_id": "4a96c9cf159f", "event_id": "474b78ed9aba", "ts": 1777581504, "type": "iteration", "episode_id": "4a96c9cf159f", "iter": 6, "status": "ok", "decision": "keep", "metrics": {"rank": 4.0, "eval_score": 0.545455, "decision_accuracy": 0.345455, "json_compliance": 0.963636, "loss": 0.000489, "training_seconds": 93.5}, "params": {"learning_rate": 5e-05, "max_steps": 30, "num_generations": 2, "temperature": 0.7, "lora_rank": 4, "AR_MODEL_DIR": "/data/models/ablation-v2-2026-04/A_seed2/v0006"}, "elapsed_s": 203.60653753764927, "concurrency": 4}
{"schema": "v1", "run_id": "4a96c9cf159f", "event_id": "93bf04ffb920", "ts": 1777581504, "type": "iteration", "episode_id": "4a96c9cf159f", "iter": 7, "status": "ok", "decision": "discard", "metrics": {"rank": 16.0, "eval_score": 0.408182, "decision_accuracy": 0.2, "json_compliance": 0.954545, "loss": 0.002099, "training_seconds": 99.5}, "params": {"learning_rate": 0.0001, "max_steps": 30, "num_generations": 2, "temperature": 0.9, "lora_rank": 16, "AR_MODEL_DIR": "/data/models/ablation-v2-2026-04/A_seed2/v0007"}, "elapsed_s": 330.66702202381566, "concurrency": 4}
{"schema": "v1", "run_id": "4a96c9cf159f", "event_id": "be4f07c8373c", "ts": 1777581504, "type": "episode_summary", "episode_id": "4a96c9cf159f", "mean": 0.49112500000000003, "median": 0.5072725, "min": 0.408182, "max": 0.545455, "stdev": 0.05034882832513868, "count": 8, "trend_slope": -0.004301904761904734}
