{"schema": "v1", "run_id": "a99f70738443", "event_id": "fa321c4d7d80", "ts": 1774263120, "type": "proposal", "episode_id": "a99f70738443", "iter": 2, "params": {"learning_rate": 5e-06, "batch_size": 2, "max_steps": 50, "num_generations": 3, "temperature": 0.8, "_type": "param"}}
{"schema": "v1", "run_id": "db4b44d5f239", "event_id": "e972123160a6", "ts": 1774278772, "type": "proposal", "episode_id": "db4b44d5f239", "iter": 0, "params": {"learning_rate": 5e-06, "batch_size": 2, "max_steps": 50, "num_generations": 3, "temperature": 1.0, "_type": "param"}}
{"schema": "v1", "run_id": "db4b44d5f239", "event_id": "a88988f8a819", "ts": 1774280707, "type": "iteration", "episode_id": "db4b44d5f239", "iter": 0, "status": "ok", "decision": "keep", "metrics": {"eval_score": 0.36, "loss": 0.015733, "training_seconds": 1253.1}, "params": {"learning_rate": 5e-06, "batch_size": 2, "max_steps": 50, "num_generations": 3, "temperature": 1.0, "_type": "param"}, "elapsed_s": 1930.626443123445}
{"schema": "v1", "run_id": "db4b44d5f239", "event_id": "c2627475466b", "ts": 1774280715, "type": "proposal", "episode_id": "db4b44d5f239", "iter": 1, "params": {"learning_rate": 3e-06, "batch_size": 2, "max_steps": 80, "num_generations": 3, "temperature": 0.8, "_type": "param"}}
{"schema": "v1", "run_id": "db4b44d5f239", "event_id": "6f31074aae26", "ts": 1774283264, "type": "iteration", "episode_id": "db4b44d5f239", "iter": 1, "status": "ok", "decision": "discard", "metrics": {"eval_score": 0.33, "loss": 0.014122, "training_seconds": 1805.3}, "params": {"learning_rate": 3e-06, "batch_size": 2, "max_steps": 80, "num_generations": 3, "temperature": 0.8, "_type": "param"}, "elapsed_s": 2548.0102638453245}
{"schema": "v1", "run_id": "db4b44d5f239", "event_id": "d7e306f4d41b", "ts": 1774283269, "type": "proposal", "episode_id": "db4b44d5f239", "iter": 2, "params": {"learning_rate": 1e-05, "batch_size": 2, "max_steps": 50, "num_generations": 3, "temperature": 1.0, "_type": "param"}}
{"schema": "v1", "run_id": "db4b44d5f239", "event_id": "ad58a923ff6e", "ts": 1774286992, "type": "iteration", "episode_id": "db4b44d5f239", "iter": 2, "status": "failed", "decision": "discard", "metrics": {}, "params": {"learning_rate": 1e-05, "batch_size": 2, "max_steps": 50, "num_generations": 3, "temperature": 1.0, "_type": "param"}, "elapsed_s": 3722.9478211645037}
{"schema": "v1", "run_id": "db4b44d5f239", "event_id": "699161f2aa09", "ts": 1774287002, "type": "proposal", "episode_id": "db4b44d5f239", "iter": 3, "params": {"learning_rate": 5e-06, "batch_size": 1, "max_steps": 50, "num_generations": 2, "temperature": 0.8, "_type": "param"}}
{"schema": "v1", "run_id": "db4b44d5f239", "event_id": "a16e37e04ee5", "ts": 1774288933, "type": "iteration", "episode_id": "db4b44d5f239", "iter": 3, "status": "ok", "decision": "discard", "metrics": {"eval_score": 0.28, "loss": 0.012035, "training_seconds": 992.3}, "params": {"learning_rate": 5e-06, "batch_size": 1, "max_steps": 50, "num_generations": 2, "temperature": 0.8, "_type": "param"}, "elapsed_s": 1929.920471727848}
{"schema": "v1", "run_id": "db4b44d5f239", "event_id": "589fbb26e87b", "ts": 1774288946, "type": "proposal", "episode_id": "db4b44d5f239", "iter": 4, "params": {"learning_rate": 1e-05, "batch_size": 1, "max_steps": 50, "num_generations": 2, "temperature": 0.8, "_type": "param"}}
{"schema": "v1", "run_id": "db4b44d5f239", "event_id": "2eba75465169", "ts": 1774290478, "type": "iteration", "episode_id": "db4b44d5f239", "iter": 4, "status": "ok", "decision": "discard", "metrics": {"eval_score": 0.27, "loss": 0.0098, "training_seconds": 933.4}, "params": {"learning_rate": 1e-05, "batch_size": 1, "max_steps": 50, "num_generations": 2, "temperature": 0.8, "_type": "param"}, "elapsed_s": 1530.6541302204132}
{"schema": "v1", "run_id": "db4b44d5f239", "event_id": "117e4b3bcb10", "ts": 1774290503, "type": "proposal", "episode_id": "db4b44d5f239", "iter": 5, "params": {"learning_rate": 5e-06, "batch_size": 2, "max_steps": 80, "num_generations": 3, "temperature": 1.0, "_type": "param"}}
{"schema": "v1", "run_id": "4ab662d4eedf", "event_id": "993b99fd942c", "ts": 1774310662, "type": "proposal", "episode_id": "4ab662d4eedf", "iter": 0, "params": {"learning_rate": 5e-06, "batch_size": 2, "max_steps": 50, "num_generations": 2, "temperature": 0.8, "_type": "param"}}
{"schema": "v1", "run_id": "4ab662d4eedf", "event_id": "656ed00a4849", "ts": 1774312498, "type": "iteration", "episode_id": "4ab662d4eedf", "iter": 0, "status": "ok", "decision": "keep", "metrics": {"eval_score": 0.3, "loss": 0.007027, "training_seconds": 965.4}, "params": {"learning_rate": 5e-06, "batch_size": 2, "max_steps": 50, "num_generations": 2, "temperature": 0.8, "_type": "param"}, "elapsed_s": 1835.18330901023}
{"schema": "v1", "run_id": "4ab662d4eedf", "event_id": "587888841cd0", "ts": 1774312527, "type": "proposal", "episode_id": "4ab662d4eedf", "iter": 1, "params": {"learning_rate": 1e-05, "batch_size": 2, "max_steps": 80, "num_generations": 3, "temperature": 1.0, "_type": "param"}}
{"schema": "v1", "run_id": "4ab662d4eedf", "event_id": "914a7afde109", "ts": 1774315311, "type": "iteration", "episode_id": "4ab662d4eedf", "iter": 1, "status": "ok", "decision": "discard", "metrics": {"eval_score": 0.12, "loss": 0.016703, "training_seconds": 1848.4}, "params": {"learning_rate": 1e-05, "batch_size": 2, "max_steps": 80, "num_generations": 3, "temperature": 1.0, "_type": "param"}, "elapsed_s": 2782.6712121115997}
{"schema": "v1", "run_id": "4ab662d4eedf", "event_id": "2dbd58f09774", "ts": 1774315316, "type": "proposal", "episode_id": "4ab662d4eedf", "iter": 2, "params": {"learning_rate": 3e-06, "batch_size": 2, "max_steps": 50, "num_generations": 3, "temperature": 0.8, "_type": "param"}}
{"schema": "v1", "run_id": "4ab662d4eedf", "event_id": "68da019a80a2", "ts": 1774318127, "type": "iteration", "episode_id": "4ab662d4eedf", "iter": 2, "status": "ok", "decision": "discard", "metrics": {"eval_score": 0.3, "loss": 0.020061, "training_seconds": 856.8}, "params": {"learning_rate": 3e-06, "batch_size": 2, "max_steps": 50, "num_generations": 3, "temperature": 0.8, "_type": "param"}, "elapsed_s": 2809.7421430479735}
{"schema": "v1", "run_id": "4ab662d4eedf", "event_id": "1b86cea2fe0d", "ts": 1774318142, "type": "proposal", "episode_id": "4ab662d4eedf", "iter": 3, "params": {"learning_rate": 5e-06, "batch_size": 2, "max_steps": 80, "num_generations": 3, "temperature": 0.8, "_type": "param"}}
{"schema": "v1", "run_id": "4ab662d4eedf", "event_id": "cd340a0c591e", "ts": 1774319722, "type": "iteration", "episode_id": "4ab662d4eedf", "iter": 3, "status": "ok", "decision": "discard", "metrics": {"eval_score": 0.29, "loss": 0.017578, "training_seconds": 1153.9}, "params": {"learning_rate": 5e-06, "batch_size": 2, "max_steps": 80, "num_generations": 3, "temperature": 0.8, "_type": "param"}, "elapsed_s": 1579.1069627087563}
{"schema": "v1", "run_id": "4ab662d4eedf", "event_id": "accc2a73d116", "ts": 1774319987, "type": "proposal", "episode_id": "4ab662d4eedf", "iter": 4, "params": {"learning_rate": 5e-06, "batch_size": 1, "max_steps": 50, "num_generations": 2, "temperature": 0.8, "_type": "param"}}
{"schema": "v1", "run_id": "4ab662d4eedf", "event_id": "e6587bd58a65", "ts": 1774321113, "type": "iteration", "episode_id": "4ab662d4eedf", "iter": 4, "status": "ok", "decision": "discard", "metrics": {"eval_score": 0.24, "loss": 0.005893, "training_seconds": 611.0}, "params": {"learning_rate": 5e-06, "batch_size": 1, "max_steps": 50, "num_generations": 2, "temperature": 0.8, "_type": "param"}, "elapsed_s": 1125.5570283997804}
{"schema": "v1", "run_id": "4ab662d4eedf", "event_id": "e7236b682904", "ts": 1774321396, "type": "proposal", "episode_id": "4ab662d4eedf", "iter": 5, "params": {"learning_rate": 1e-05, "batch_size": 1, "max_steps": 50, "num_generations": 2, "temperature": 0.8, "_type": "param"}}
{"schema": "v1", "run_id": "4ab662d4eedf", "event_id": "d859982c570b", "ts": 1774322618, "type": "iteration", "episode_id": "4ab662d4eedf", "iter": 5, "status": "ok", "decision": "keep", "metrics": {"eval_score": 0.34, "loss": 0.005179, "training_seconds": 621.1}, "params": {"learning_rate": 1e-05, "batch_size": 1, "max_steps": 50, "num_generations": 2, "temperature": 0.8, "_type": "param"}, "elapsed_s": 1221.4393948055804}
{"schema": "v1", "run_id": "4ab662d4eedf", "event_id": "3b2606fa2522", "ts": 1774322648, "type": "proposal", "episode_id": "4ab662d4eedf", "iter": 6, "params": {"learning_rate": 3e-06, "batch_size": 1, "max_steps": 80, "num_generations": 3, "temperature": 0.8, "_type": "param"}}
{"schema": "v1", "run_id": "4ab662d4eedf", "event_id": "f99e7b5cd0f0", "ts": 1774324415, "type": "iteration", "episode_id": "4ab662d4eedf", "iter": 6, "status": "ok", "decision": "discard", "metrics": {"eval_score": 0.25, "loss": 0.015785, "training_seconds": 1188.2}, "params": {"learning_rate": 3e-06, "batch_size": 1, "max_steps": 80, "num_generations": 3, "temperature": 0.8, "_type": "param"}, "elapsed_s": 1765.8586028609425}
{"schema": "v1", "run_id": "4ab662d4eedf", "event_id": "26484f22205b", "ts": 1774324751, "type": "proposal", "episode_id": "4ab662d4eedf", "iter": 7, "params": {"learning_rate": 3e-06, "batch_size": 1, "max_steps": 50, "num_generations": 3, "temperature": 0.8, "_type": "param"}}
{"schema": "v1", "run_id": "4ab662d4eedf", "event_id": "c97a38ab3321", "ts": 1774327455, "type": "iteration", "episode_id": "4ab662d4eedf", "iter": 7, "status": "ok", "decision": "discard", "metrics": {"eval_score": 0.32, "loss": 0.018304, "training_seconds": 850.9}, "params": {"learning_rate": 3e-06, "batch_size": 1, "max_steps": 50, "num_generations": 3, "temperature": 0.8, "_type": "param"}, "elapsed_s": 2702.5044283671305}
{"schema": "v1", "run_id": "4ab662d4eedf", "event_id": "2a7a3288d02c", "ts": 1774327673, "type": "proposal", "episode_id": "4ab662d4eedf", "iter": 8, "params": {"learning_rate": 5e-06, "batch_size": 1, "max_steps": 50, "num_generations": 3, "temperature": 0.8, "_type": "param"}}
{"schema": "v1", "run_id": "4ab662d4eedf", "event_id": "cdeb2681a890", "ts": 1774330473, "type": "iteration", "episode_id": "4ab662d4eedf", "iter": 8, "status": "ok", "decision": "discard", "metrics": {"eval_score": 0.33, "loss": 0.011156, "training_seconds": 810.2}, "params": {"learning_rate": 5e-06, "batch_size": 1, "max_steps": 50, "num_generations": 3, "temperature": 0.8, "_type": "param"}, "elapsed_s": 2799.217072407715}
{"schema": "v1", "run_id": "4ab662d4eedf", "event_id": "0b0b3a27d6c5", "ts": 1774330680, "type": "proposal", "episode_id": "4ab662d4eedf", "iter": 9, "params": {"learning_rate": 1e-05, "batch_size": 1, "max_steps": 80, "num_generations": 3, "temperature": 0.8, "_type": "param"}}
{"schema": "v1", "run_id": "4ab662d4eedf", "event_id": "ece8f9a8575b", "ts": 1774332615, "type": "iteration", "episode_id": "4ab662d4eedf", "iter": 9, "status": "ok", "decision": "discard", "metrics": {"eval_score": 0.13, "loss": 0.01271, "training_seconds": 1222.4}, "params": {"learning_rate": 1e-05, "batch_size": 1, "max_steps": 80, "num_generations": 3, "temperature": 0.8, "_type": "param"}, "elapsed_s": 1930.6415606280789}
{"schema": "v1", "run_id": "4ab662d4eedf", "event_id": "c5660cb8a24e", "ts": 1774333286, "type": "proposal", "episode_id": "4ab662d4eedf", "iter": 10, "params": {"diff": "--- a/train.py\n+++ b/train.py\n@@ -277,3 +277,5 @@\n         traceback.print_exc()\n         print(f\"FATAL: {exc}\", flush=True)\n         raise SystemExit(1)\n+\n+use_qk_norm = True\n", "_type": "diff"}}
{"schema": "v1", "run_id": "4ab662d4eedf", "event_id": "a754d5dca323", "ts": 1774333286, "type": "iteration", "episode_id": "4ab662d4eedf", "iter": 10, "status": "failed", "decision": "discard", "metrics": {}, "params": {"diff": "--- a/train.py\n+++ b/train.py\n@@ -277,3 +277,5 @@\n         traceback.print_exc()\n         print(f\"FATAL: {exc}\", flush=True)\n         raise SystemExit(1)\n+\n+use_qk_norm = True\n", "_type": "diff"}, "elapsed_s": 0.0}
{"schema": "v1", "run_id": "4ab662d4eedf", "event_id": "fb59b17b6017", "ts": 1774333753, "type": "proposal", "episode_id": "4ab662d4eedf", "iter": 11, "params": {"diff": "--- a/train.py\n+++ b/train.py\n@@ -277,3 +277,5 @@\n         traceback.print_exc()\n         print(f\"FATAL: {exc}\", flush=True)\n         raise SystemExit(1)\n+\n+use_qk_norm = True\n", "_type": "diff"}}
{"schema": "v1", "run_id": "4ab662d4eedf", "event_id": "0b72fc1c5e93", "ts": 1774333753, "type": "iteration", "episode_id": "4ab662d4eedf", "iter": 11, "status": "failed", "decision": "discard", "metrics": {}, "params": {"diff": "--- a/train.py\n+++ b/train.py\n@@ -277,3 +277,5 @@\n         traceback.print_exc()\n         print(f\"FATAL: {exc}\", flush=True)\n         raise SystemExit(1)\n+\n+use_qk_norm = True\n", "_type": "diff"}, "elapsed_s": 0.0}
{"schema": "v1", "run_id": "4ab662d4eedf", "event_id": "0c7990bd00c9", "ts": 1774334724, "type": "proposal", "episode_id": "4ab662d4eedf", "iter": 12, "params": {"diff": "--- a/train.py\n+++ b/train.py\n@@ -277,3 +277,5 @@\n         traceback.print_exc()\n         print(f\"FATAL: {exc}\", flush=True)\n         raise SystemExit(1)\n+\n+use_qk_norm = True\n", "_type": "diff"}}
{"schema": "v1", "run_id": "4ab662d4eedf", "event_id": "ee1e982e899a", "ts": 1774334724, "type": "iteration", "episode_id": "4ab662d4eedf", "iter": 12, "status": "failed", "decision": "discard", "metrics": {}, "params": {"diff": "--- a/train.py\n+++ b/train.py\n@@ -277,3 +277,5 @@\n         traceback.print_exc()\n         print(f\"FATAL: {exc}\", flush=True)\n         raise SystemExit(1)\n+\n+use_qk_norm = True\n", "_type": "diff"}, "elapsed_s": 0.0}
{"schema": "v1", "run_id": "4ab662d4eedf", "event_id": "3a972dd06734", "ts": 1774335004, "type": "proposal", "episode_id": "4ab662d4eedf", "iter": 13, "params": {"learning_rate": 3e-06, "batch_size": 1, "max_steps": 50, "num_generations": 3, "temperature": 0.8, "_type": "param"}}
{"schema": "v1", "run_id": "4ab662d4eedf", "event_id": "ff0e8b90e779", "ts": 1774337136, "type": "iteration", "episode_id": "4ab662d4eedf", "iter": 13, "status": "ok", "decision": "keep", "metrics": {"eval_score": 0.35, "loss": 0.01931, "training_seconds": 1245.9}, "params": {"learning_rate": 3e-06, "batch_size": 1, "max_steps": 50, "num_generations": 3, "temperature": 0.8, "_type": "param"}, "elapsed_s": 2130.508281348273}
{"schema": "v1", "run_id": "4ab662d4eedf", "event_id": "4bfbc1e5e954", "ts": 1774337162, "type": "proposal", "episode_id": "4ab662d4eedf", "iter": 14, "params": {"learning_rate": 5e-06, "batch_size": 1, "max_steps": 80, "num_generations": 3, "temperature": 0.8, "_type": "param"}}
{"schema": "v1", "run_id": "4ab662d4eedf", "event_id": "710dd5c70654", "ts": 1774339822, "type": "iteration", "episode_id": "4ab662d4eedf", "iter": 14, "status": "ok", "decision": "discard", "metrics": {"eval_score": 0.22, "loss": 0.019246, "training_seconds": 1853.5}, "params": {"learning_rate": 5e-06, "batch_size": 1, "max_steps": 80, "num_generations": 3, "temperature": 0.8, "_type": "param"}, "elapsed_s": 2658.9524475792423}
{"schema": "v1", "run_id": "4ab662d4eedf", "event_id": "d1792fd57321", "ts": 1774339822, "type": "episode_summary", "episode_id": "4ab662d4eedf", "mean": 0.2658333333333333, "median": 0.295, "min": 0.12, "max": 0.35, "stdev": 0.07704288455533101, "count": 12, "trend_slope": 0.001223776223776204}
