{"schema": "v1", "run_id": "b7fa42978300", "event_id": "4480c6841a80", "ts": 1774108788, "type": "proposal", "episode_id": "b7fa42978300", "iter": 0, "params": {"learning_rate": 5e-06, "batch_size": 2, "max_steps": 50, "num_generations": 3, "temperature": 1.0}}
{"schema": "v1", "run_id": "3520d1a41e25", "event_id": "38772b1c945b", "ts": 1774110090, "type": "iteration", "episode_id": "3520d1a41e25", "iter": 1, "status": "failed", "decision": "discard", "metrics": {}, "params": {"learning_rate": 5e-06, "batch_size": 1, "max_steps": 100, "num_generations": 3, "temperature": 0.8}, "elapsed_s": 2455.34414137993}
{"schema": "v1", "run_id": "b7fa42978300", "event_id": "ae733b600f07", "ts": 1774110195, "type": "iteration", "episode_id": "b7fa42978300", "iter": 0, "status": "ok", "decision": "keep", "metrics": {"eval_score": 0.34, "loss": 0.020809, "training_seconds": 760.6}, "params": {"learning_rate": 5e-06, "batch_size": 2, "max_steps": 50, "num_generations": 3, "temperature": 1.0}, "elapsed_s": 1406.0408554915339}
{"schema": "v1", "run_id": "b7fa42978300", "event_id": "ca0b26bb3e62", "ts": 1774110201, "type": "proposal", "episode_id": "b7fa42978300", "iter": 1, "params": {"learning_rate": 5e-06, "batch_size": 1, "max_steps": 80, "num_generations": 3, "temperature": 0.8}}
{"schema": "v1", "run_id": "b7fa42978300", "event_id": "fdaf72b08a7a", "ts": 1774112675, "type": "iteration", "episode_id": "b7fa42978300", "iter": 1, "status": "ok", "decision": "keep", "metrics": {"eval_score": 0.36, "loss": 0.015119, "training_seconds": 1741.1}, "params": {"learning_rate": 5e-06, "batch_size": 1, "max_steps": 80, "num_generations": 3, "temperature": 0.8}, "elapsed_s": 2473.0775810442865}
{"schema": "v1", "run_id": "b7fa42978300", "event_id": "9a4abbb9a9a3", "ts": 1774112681, "type": "proposal", "episode_id": "b7fa42978300", "iter": 2, "params": {"learning_rate": 1e-05, "batch_size": 2, "max_steps": 80, "num_generations": 3, "temperature": 1.0}}
{"schema": "v1", "run_id": "b7fa42978300", "event_id": "404f86907b55", "ts": 1774115548, "type": "iteration", "episode_id": "b7fa42978300", "iter": 2, "status": "ok", "decision": "discard", "metrics": {"eval_score": 0.03, "loss": 0.013155, "training_seconds": 1904.4}, "params": {"learning_rate": 1e-05, "batch_size": 2, "max_steps": 80, "num_generations": 3, "temperature": 1.0}, "elapsed_s": 2866.6166524142027}
{"schema": "v1", "run_id": "b7fa42978300", "event_id": "9dfc616b9e3a", "ts": 1774115554, "type": "proposal", "episode_id": "b7fa42978300", "iter": 3, "params": {"learning_rate": 3e-06, "batch_size": 2, "max_steps": 80, "num_generations": 3, "temperature": 0.8}}
{"schema": "v1", "run_id": "b7fa42978300", "event_id": "aa80541f61ed", "ts": 1774117070, "type": "iteration", "episode_id": "b7fa42978300", "iter": 3, "status": "ok", "decision": "discard", "metrics": {"eval_score": 0.3, "loss": 0.018518, "training_seconds": 1031.3}, "params": {"learning_rate": 3e-06, "batch_size": 2, "max_steps": 80, "num_generations": 3, "temperature": 0.8}, "elapsed_s": 1514.9309304114431}
{"schema": "v1", "run_id": "b7fa42978300", "event_id": "233fd07716c4", "ts": 1774117081, "type": "proposal", "episode_id": "b7fa42978300", "iter": 4, "params": {"learning_rate": 5e-06, "batch_size": 1, "max_steps": 50, "num_generations": 3, "temperature": 1.0}}
{"schema": "v1", "run_id": "b7fa42978300", "event_id": "b28ce0c182ce", "ts": 1774118514, "type": "iteration", "episode_id": "b7fa42978300", "iter": 4, "status": "ok", "decision": "discard", "metrics": {"eval_score": 0.36, "loss": 0.016063, "training_seconds": 800.3}, "params": {"learning_rate": 5e-06, "batch_size": 1, "max_steps": 50, "num_generations": 3, "temperature": 1.0}, "elapsed_s": 1432.7295285677537}
{"schema": "v1", "run_id": "b7fa42978300", "event_id": "34abf0cc24e6", "ts": 1774118528, "type": "proposal", "episode_id": "b7fa42978300", "iter": 5, "params": {"learning_rate": 5e-06, "batch_size": 1, "max_steps": 80, "num_generations": 3, "temperature": 0.8}}
{"schema": "v1", "run_id": "b7fa42978300", "event_id": "0b11e030216f", "ts": 1774121442, "type": "iteration", "episode_id": "b7fa42978300", "iter": 5, "status": "ok", "decision": "discard", "metrics": {"eval_score": 0.27, "loss": 0.00668, "training_seconds": 1852.5}, "params": {"learning_rate": 5e-06, "batch_size": 1, "max_steps": 80, "num_generations": 3, "temperature": 0.8}, "elapsed_s": 2913.887015329674}
{"schema": "v1", "run_id": "b7fa42978300", "event_id": "7b8aee401261", "ts": 1774121450, "type": "proposal", "episode_id": "b7fa42978300", "iter": 6, "params": {"learning_rate": 5e-06, "batch_size": 1, "max_steps": 50, "num_generations": 2, "temperature": 0.8}}
{"schema": "v1", "run_id": "b7fa42978300", "event_id": "bde4b4f73389", "ts": 1774123090, "type": "iteration", "episode_id": "b7fa42978300", "iter": 6, "status": "ok", "decision": "discard", "metrics": {"eval_score": 0.23, "loss": 0.010549, "training_seconds": 930.5}, "params": {"learning_rate": 5e-06, "batch_size": 1, "max_steps": 50, "num_generations": 2, "temperature": 0.8}, "elapsed_s": 1639.0260794619098}
{"schema": "v1", "run_id": "b7fa42978300", "event_id": "927f7164834e", "ts": 1774123111, "type": "proposal", "episode_id": "b7fa42978300", "iter": 7, "params": {"learning_rate": 3e-06, "batch_size": 1, "max_steps": 50, "num_generations": 3, "temperature": 1.0}}
{"schema": "v1", "run_id": "b7fa42978300", "event_id": "27a919379fcf", "ts": 1774125224, "type": "iteration", "episode_id": "b7fa42978300", "iter": 7, "status": "ok", "decision": "discard", "metrics": {"eval_score": 0.27, "loss": 0.01857, "training_seconds": 1294.8}, "params": {"learning_rate": 3e-06, "batch_size": 1, "max_steps": 50, "num_generations": 3, "temperature": 1.0}, "elapsed_s": 2111.6007826691493}
{"schema": "v1", "run_id": "b7fa42978300", "event_id": "6908bf1c652b", "ts": 1774125232, "type": "proposal", "episode_id": "b7fa42978300", "iter": 8, "params": {"learning_rate": 5e-06, "batch_size": 1, "max_steps": 30, "num_generations": 3, "temperature": 0.8}}
{"schema": "v1", "run_id": "b7fa42978300", "event_id": "50b946719f53", "ts": 1774126855, "type": "iteration", "episode_id": "b7fa42978300", "iter": 8, "status": "ok", "decision": "discard", "metrics": {"eval_score": 0.34, "loss": 0.014198, "training_seconds": 919.7}, "params": {"learning_rate": 5e-06, "batch_size": 1, "max_steps": 30, "num_generations": 3, "temperature": 0.8}, "elapsed_s": 1622.6544333901256}
{"schema": "v1", "run_id": "b7fa42978300", "event_id": "861b1f5777cd", "ts": 1774126945, "type": "proposal", "episode_id": "b7fa42978300", "iter": 9, "params": {"learning_rate": 5e-06, "batch_size": 2, "max_steps": 30, "num_generations": 3, "temperature": 0.8}}
{"schema": "v1", "run_id": "b7fa42978300", "event_id": "55e668fb27be", "ts": 1774130504, "type": "iteration", "episode_id": "b7fa42978300", "iter": 9, "status": "ok", "decision": "discard", "metrics": {"eval_score": 0.34, "loss": 0.011867, "training_seconds": 945.8}, "params": {"learning_rate": 5e-06, "batch_size": 2, "max_steps": 30, "num_generations": 3, "temperature": 0.8}, "elapsed_s": 3557.97400566563}
{"schema": "v1", "run_id": "b7fa42978300", "event_id": "9a112343a499", "ts": 1774130509, "type": "proposal", "episode_id": "b7fa42978300", "iter": 10, "params": {"learning_rate": 5e-06, "batch_size": 1, "max_steps": 50, "num_generations": 3, "temperature": 1.0}}
{"schema": "v1", "run_id": "b7fa42978300", "event_id": "3789e240b1b5", "ts": 1774131801, "type": "iteration", "episode_id": "b7fa42978300", "iter": 10, "status": "ok", "decision": "discard", "metrics": {"eval_score": 0.28, "loss": 0.015908, "training_seconds": 785.9}, "params": {"learning_rate": 5e-06, "batch_size": 1, "max_steps": 50, "num_generations": 3, "temperature": 1.0}, "elapsed_s": 1291.5514905564487}
{"schema": "v1", "run_id": "b7fa42978300", "event_id": "0823b12afee9", "ts": 1774131821, "type": "proposal", "episode_id": "b7fa42978300", "iter": 11, "params": {"learning_rate": 5e-06, "batch_size": 2, "max_steps": 50, "num_generations": 3, "temperature": 0.8}}
{"schema": "v1", "run_id": "b7fa42978300", "event_id": "455cd91e912f", "ts": 1774133077, "type": "iteration", "episode_id": "b7fa42978300", "iter": 11, "status": "ok", "decision": "discard", "metrics": {"eval_score": 0.36, "loss": 0.014855, "training_seconds": 814.4}, "params": {"learning_rate": 5e-06, "batch_size": 2, "max_steps": 50, "num_generations": 3, "temperature": 0.8}, "elapsed_s": 1255.3180573666468}
{"schema": "v1", "run_id": "b7fa42978300", "event_id": "e4eaf99b347b", "ts": 1774133097, "type": "proposal", "episode_id": "b7fa42978300", "iter": 12, "params": {"learning_rate": 5e-06, "batch_size": 2, "max_steps": 30, "num_generations": 3, "temperature": 1.0}}
{"schema": "v1", "run_id": "b7fa42978300", "event_id": "2bd6b2ddf92b", "ts": 1774134330, "type": "iteration", "episode_id": "b7fa42978300", "iter": 12, "status": "ok", "decision": "discard", "metrics": {"eval_score": 0.35, "loss": 0.012303, "training_seconds": 566.1}, "params": {"learning_rate": 5e-06, "batch_size": 2, "max_steps": 30, "num_generations": 3, "temperature": 1.0}, "elapsed_s": 1231.9615139728412}
{"schema": "v1", "run_id": "b7fa42978300", "event_id": "04a11e82305a", "ts": 1774134338, "type": "proposal", "episode_id": "b7fa42978300", "iter": 13, "params": {"learning_rate": 5e-06, "batch_size": 2, "max_steps": 50, "num_generations": 3, "temperature": 0.8}}
{"schema": "v1", "run_id": "b7fa42978300", "event_id": "f0053b3606ba", "ts": 1774136271, "type": "iteration", "episode_id": "b7fa42978300", "iter": 13, "status": "ok", "decision": "discard", "metrics": {"eval_score": 0.26, "loss": 0.015519, "training_seconds": 1210.7}, "params": {"learning_rate": 5e-06, "batch_size": 2, "max_steps": 50, "num_generations": 3, "temperature": 0.8}, "elapsed_s": 1932.7362501323223}
{"schema": "v1", "run_id": "b7fa42978300", "event_id": "b25458889cb9", "ts": 1774136276, "type": "proposal", "episode_id": "b7fa42978300", "iter": 14, "params": {"learning_rate": 5e-06, "batch_size": 1, "max_steps": 50, "num_generations": 3, "temperature": 1.0}}
{"schema": "v1", "run_id": "b7fa42978300", "event_id": "26a5ba69d591", "ts": 1774137964, "type": "iteration", "episode_id": "b7fa42978300", "iter": 14, "status": "ok", "decision": "discard", "metrics": {"eval_score": 0.27, "loss": 0.017942, "training_seconds": 882.2}, "params": {"learning_rate": 5e-06, "batch_size": 1, "max_steps": 50, "num_generations": 3, "temperature": 1.0}, "elapsed_s": 1688.089889534749}
{"schema": "v1", "run_id": "b7fa42978300", "event_id": "5ee817d4bbf1", "ts": 1774137964, "type": "episode_summary", "episode_id": "b7fa42978300", "mean": 0.2906666666666667, "median": 0.3, "min": 0.03, "max": 0.36, "stdev": 0.08421627486644699, "count": 15, "trend_slope": 0.002714285714285736}
{"schema": "v1", "run_id": "01816cafc510", "event_id": "3133ecab59be", "ts": 1774221027, "type": "proposal", "episode_id": "01816cafc510", "iter": 0, "params": {"learning_rate": 3e-06, "batch_size": 1, "max_steps": 30, "num_generations": 2, "temperature": 0.8}}
{"schema": "v1", "run_id": "01816cafc510", "event_id": "1a81d125ca8b", "ts": 1774222600, "type": "iteration", "episode_id": "01816cafc510", "iter": 0, "status": "ok", "decision": "keep", "metrics": {"eval_score": 0.28, "loss": 0.008512, "training_seconds": 733.8}, "params": {"learning_rate": 3e-06, "batch_size": 1, "max_steps": 30, "num_generations": 2, "temperature": 0.8}, "elapsed_s": 1572.1960370009765}
{"schema": "v1", "run_id": "01816cafc510", "event_id": "6abb671a2b5d", "ts": 1774222600, "type": "proposal", "episode_id": "01816cafc510", "iter": 1, "params": {"learning_rate": 3e-06, "batch_size": 1, "max_steps": 30, "num_generations": 2, "temperature": 1.0}}
{"schema": "v1", "run_id": "01816cafc510", "event_id": "11a21931171a", "ts": 1774224159, "type": "iteration", "episode_id": "01816cafc510", "iter": 1, "status": "ok", "decision": "keep", "metrics": {"eval_score": 0.31, "loss": 0.005707, "training_seconds": 732.3}, "params": {"learning_rate": 3e-06, "batch_size": 1, "max_steps": 30, "num_generations": 2, "temperature": 1.0}, "elapsed_s": 1558.6475667608902}
{"schema": "v1", "run_id": "01816cafc510", "event_id": "ab1d9a570db9", "ts": 1774224159, "type": "proposal", "episode_id": "01816cafc510", "iter": 2, "params": {"learning_rate": 3e-06, "batch_size": 1, "max_steps": 30, "num_generations": 3, "temperature": 0.8}}
{"schema": "v1", "run_id": "01816cafc510", "event_id": "a0f0daf71a75", "ts": 1774225820, "type": "iteration", "episode_id": "01816cafc510", "iter": 2, "status": "ok", "decision": "discard", "metrics": {"eval_score": 0.28, "loss": 0.015083, "training_seconds": 911.5}, "params": {"learning_rate": 3e-06, "batch_size": 1, "max_steps": 30, "num_generations": 3, "temperature": 0.8}, "elapsed_s": 1660.0944142406806}
{"schema": "v1", "run_id": "01816cafc510", "event_id": "19a7d9de0cc0", "ts": 1774225820, "type": "proposal", "episode_id": "01816cafc510", "iter": 3, "params": {"learning_rate": 3e-06, "batch_size": 1, "max_steps": 30, "num_generations": 3, "temperature": 1.0}}
{"schema": "v1", "run_id": "01816cafc510", "event_id": "fd88f9e5cd87", "ts": 1774227611, "type": "iteration", "episode_id": "01816cafc510", "iter": 3, "status": "ok", "decision": "discard", "metrics": {"eval_score": 0.3, "loss": 0.016107, "training_seconds": 940.0}, "params": {"learning_rate": 3e-06, "batch_size": 1, "max_steps": 30, "num_generations": 3, "temperature": 1.0}, "elapsed_s": 1787.284456689842}
{"schema": "v1", "run_id": "01816cafc510", "event_id": "faefe8a83350", "ts": 1774227611, "type": "proposal", "episode_id": "01816cafc510", "iter": 4, "params": {"learning_rate": 3e-06, "batch_size": 1, "max_steps": 50, "num_generations": 2, "temperature": 0.8}}
{"schema": "v1", "run_id": "01816cafc510", "event_id": "5840c0c1b27f", "ts": 1774231209, "type": "iteration", "episode_id": "01816cafc510", "iter": 4, "status": "ok", "decision": "keep", "metrics": {"eval_score": 0.32, "loss": 0.005867, "training_seconds": 975.9}, "params": {"learning_rate": 3e-06, "batch_size": 1, "max_steps": 50, "num_generations": 2, "temperature": 0.8}, "elapsed_s": 3593.32896133326}
{"schema": "v1", "run_id": "01816cafc510", "event_id": "485a8a3847c5", "ts": 1774231209, "type": "proposal", "episode_id": "01816cafc510", "iter": 5, "params": {"learning_rate": 3e-06, "batch_size": 1, "max_steps": 50, "num_generations": 2, "temperature": 1.0}}
{"schema": "v1", "run_id": "01816cafc510", "event_id": "eaea136b4a8c", "ts": 1774233269, "type": "iteration", "episode_id": "01816cafc510", "iter": 5, "status": "ok", "decision": "discard", "metrics": {"eval_score": 0.24, "loss": 0.012972, "training_seconds": 971.4}, "params": {"learning_rate": 3e-06, "batch_size": 1, "max_steps": 50, "num_generations": 2, "temperature": 1.0}, "elapsed_s": 2060.0378320375457}
{"schema": "v1", "run_id": "01816cafc510", "event_id": "d24bb51fb335", "ts": 1774233269, "type": "proposal", "episode_id": "01816cafc510", "iter": 6, "params": {"learning_rate": 3e-06, "batch_size": 1, "max_steps": 50, "num_generations": 3, "temperature": 0.8}}
{"schema": "v1", "run_id": "01816cafc510", "event_id": "cdfaad2bf9ac", "ts": 1774235398, "type": "iteration", "episode_id": "01816cafc510", "iter": 6, "status": "ok", "decision": "discard", "metrics": {"eval_score": 0.27, "loss": 0.015259, "training_seconds": 1283.0}, "params": {"learning_rate": 3e-06, "batch_size": 1, "max_steps": 50, "num_generations": 3, "temperature": 0.8}, "elapsed_s": 2127.0793449105695}
{"schema": "v1", "run_id": "01816cafc510", "event_id": "e10438c732c2", "ts": 1774235398, "type": "proposal", "episode_id": "01816cafc510", "iter": 7, "params": {"learning_rate": 3e-06, "batch_size": 1, "max_steps": 50, "num_generations": 3, "temperature": 1.0}}
{"schema": "v1", "run_id": "01816cafc510", "event_id": "6c6789502d3b", "ts": 1774237513, "type": "iteration", "episode_id": "01816cafc510", "iter": 7, "status": "ok", "decision": "keep", "metrics": {"eval_score": 0.35, "loss": 0.015278, "training_seconds": 1290.7}, "params": {"learning_rate": 3e-06, "batch_size": 1, "max_steps": 50, "num_generations": 3, "temperature": 1.0}, "elapsed_s": 2114.561694755219}
{"schema": "v1", "run_id": "01816cafc510", "event_id": "eac261227dd1", "ts": 1774237513, "type": "proposal", "episode_id": "01816cafc510", "iter": 8, "params": {"learning_rate": 3e-06, "batch_size": 1, "max_steps": 80, "num_generations": 2, "temperature": 0.8}}
{"schema": "v1", "run_id": "01816cafc510", "event_id": "6a01ecd3d7a7", "ts": 1774239736, "type": "iteration", "episode_id": "01816cafc510", "iter": 8, "status": "ok", "decision": "discard", "metrics": {"eval_score": 0.24, "loss": 0.010242, "training_seconds": 1327.1}, "params": {"learning_rate": 3e-06, "batch_size": 1, "max_steps": 80, "num_generations": 2, "temperature": 0.8}, "elapsed_s": 2223.1861196737736}
{"schema": "v1", "run_id": "01816cafc510", "event_id": "2bc721703a46", "ts": 1774239736, "type": "proposal", "episode_id": "01816cafc510", "iter": 9, "params": {"learning_rate": 3e-06, "batch_size": 1, "max_steps": 80, "num_generations": 2, "temperature": 1.0}}
{"schema": "v1", "run_id": "01816cafc510", "event_id": "b4b2c299a81f", "ts": 1774243403, "type": "iteration", "episode_id": "01816cafc510", "iter": 9, "status": "failed", "decision": "discard", "metrics": {}, "params": {"learning_rate": 3e-06, "batch_size": 1, "max_steps": 80, "num_generations": 2, "temperature": 1.0}, "elapsed_s": 3666.207996858284}
{"schema": "v1", "run_id": "01816cafc510", "event_id": "f8ead0285351", "ts": 1774243403, "type": "proposal", "episode_id": "01816cafc510", "iter": 10, "params": {"learning_rate": 3e-06, "batch_size": 1, "max_steps": 80, "num_generations": 3, "temperature": 0.8}}
{"schema": "v1", "run_id": "01816cafc510", "event_id": "4fdec05028a6", "ts": 1774245679, "type": "iteration", "episode_id": "01816cafc510", "iter": 10, "status": "ok", "decision": "discard", "metrics": {"eval_score": 0.27, "loss": 0.015336, "training_seconds": 1566.1}, "params": {"learning_rate": 3e-06, "batch_size": 1, "max_steps": 80, "num_generations": 3, "temperature": 0.8}, "elapsed_s": 2274.959878101945}
{"schema": "v1", "run_id": "01816cafc510", "event_id": "820f26513297", "ts": 1774245679, "type": "proposal", "episode_id": "01816cafc510", "iter": 11, "params": {"learning_rate": 3e-06, "batch_size": 1, "max_steps": 80, "num_generations": 3, "temperature": 1.0}}
{"schema": "v1", "run_id": "01816cafc510", "event_id": "5a76041be642", "ts": 1774247894, "type": "iteration", "episode_id": "01816cafc510", "iter": 11, "status": "ok", "decision": "discard", "metrics": {"eval_score": 0.2, "loss": 0.021835, "training_seconds": 1549.4}, "params": {"learning_rate": 3e-06, "batch_size": 1, "max_steps": 80, "num_generations": 3, "temperature": 1.0}, "elapsed_s": 2214.1027884846553}
{"schema": "v1", "run_id": "01816cafc510", "event_id": "6d3e990c36e9", "ts": 1774247894, "type": "proposal", "episode_id": "01816cafc510", "iter": 12, "params": {"learning_rate": 3e-06, "batch_size": 2, "max_steps": 30, "num_generations": 2, "temperature": 0.8}}
{"schema": "v1", "run_id": "01816cafc510", "event_id": "e3c3e9364e61", "ts": 1774249248, "type": "iteration", "episode_id": "01816cafc510", "iter": 12, "status": "ok", "decision": "discard", "metrics": {"eval_score": 0.24, "loss": 0.006575, "training_seconds": 618.5}, "params": {"learning_rate": 3e-06, "batch_size": 2, "max_steps": 30, "num_generations": 2, "temperature": 0.8}, "elapsed_s": 1353.2513888245448}
{"schema": "v1", "run_id": "01816cafc510", "event_id": "98955f8d1187", "ts": 1774249248, "type": "proposal", "episode_id": "01816cafc510", "iter": 13, "params": {"learning_rate": 3e-06, "batch_size": 2, "max_steps": 30, "num_generations": 2, "temperature": 1.0}}
{"schema": "v1", "run_id": "01816cafc510", "event_id": "3d39103312e2", "ts": 1774250590, "type": "iteration", "episode_id": "01816cafc510", "iter": 13, "status": "ok", "decision": "discard", "metrics": {"eval_score": 0.22, "loss": 0.008053, "training_seconds": 616.7}, "params": {"learning_rate": 3e-06, "batch_size": 2, "max_steps": 30, "num_generations": 2, "temperature": 1.0}, "elapsed_s": 1341.3763652527705}
{"schema": "v1", "run_id": "01816cafc510", "event_id": "2e56fe7540fb", "ts": 1774250590, "type": "episode_summary", "episode_id": "01816cafc510", "mean": 0.27076923076923076, "median": 0.27, "min": 0.2, "max": 0.35, "stdev": 0.04251696493980147, "count": 13, "trend_slope": -0.006428571428571444}
{"schema": "v1", "run_id": "a99f70738443", "event_id": "917a9004624f", "ts": 1774258792, "type": "proposal", "episode_id": "a99f70738443", "iter": 0, "params": {"learning_rate": 5e-06, "batch_size": 1, "max_steps": 50, "num_generations": 2, "temperature": 0.8, "_type": "param"}}
{"schema": "v1", "run_id": "a99f70738443", "event_id": "df9789c214b1", "ts": 1774260356, "type": "iteration", "episode_id": "a99f70738443", "iter": 0, "status": "ok", "decision": "keep", "metrics": {"eval_score": 0.38, "loss": 0.009058, "training_seconds": 911.7}, "params": {"learning_rate": 5e-06, "batch_size": 1, "max_steps": 50, "num_generations": 2, "temperature": 0.8, "_type": "param"}, "elapsed_s": 1563.1619869545102}
{"schema": "v1", "run_id": "a99f70738443", "event_id": "0db75cdf1fb5", "ts": 1774260364, "type": "proposal", "episode_id": "a99f70738443", "iter": 1, "params": {"learning_rate": 3e-06, "batch_size": 2, "max_steps": 80, "num_generations": 3, "temperature": 1.0, "_type": "param"}}
{"schema": "v1", "run_id": "a99f70738443", "event_id": "ffad2bc54617", "ts": 1774263109, "type": "iteration", "episode_id": "a99f70738443", "iter": 1, "status": "ok", "decision": "discard", "metrics": {"eval_score": 0.31, "loss": 0.013884, "training_seconds": 1903.7}, "params": {"learning_rate": 3e-06, "batch_size": 2, "max_steps": 80, "num_generations": 3, "temperature": 1.0, "_type": "param"}, "elapsed_s": 2744.6997470287606}
