{"schema": "v1", "run_id": "897e096800b8", "event_id": "5cd36dc369bf", "ts": 1773944263, "type": "proposal", "episode_id": "897e096800b8", "iter": 0, "params": {"learning_rate": 5e-06, "batch_size": 2, "max_steps": 30, "num_generations": 2, "temperature": 1.0, "_type": "param"}}
{"schema": "v1", "run_id": "897e096800b8", "event_id": "2cbe66d10662", "ts": 1773945462, "type": "iteration", "episode_id": "897e096800b8", "iter": 0, "status": "ok", "decision": "keep", "metrics": {"eval_score": 0.03, "loss": 0.001195, "training_seconds": 468.5, "baseline": 0.0, "improvement": 0.03}, "params": {"learning_rate": 5e-06, "batch_size": 2, "max_steps": 30, "num_generations": 2, "temperature": 1.0, "_type": "param"}, "elapsed_s": 1198.4656252320856}
{"schema": "v1", "run_id": "897e096800b8", "event_id": "4dc018bc12b1", "ts": 1773945496, "type": "proposal", "episode_id": "897e096800b8", "iter": 1, "params": {"learning_rate": 3e-06, "batch_size": 2, "max_steps": 50, "num_generations": 3, "temperature": 0.8, "_type": "param"}}
{"schema": "v1", "run_id": "897e096800b8", "event_id": "b5264c74d99f", "ts": 1773947957, "type": "iteration", "episode_id": "897e096800b8", "iter": 1, "status": "failed", "decision": "discard", "metrics": {}, "params": {"learning_rate": 3e-06, "batch_size": 2, "max_steps": 50, "num_generations": 3, "temperature": 0.8, "_type": "param"}, "elapsed_s": 2458.8997616283596}
{"schema": "v1", "run_id": "897e096800b8", "event_id": "31d3865cf10e", "ts": 1773947966, "type": "proposal", "episode_id": "897e096800b8", "iter": 2, "params": {"learning_rate": 5e-06, "batch_size": 1, "max_steps": 30, "num_generations": 2, "temperature": 0.8, "_type": "param"}}
{"schema": "v1", "run_id": "897e096800b8", "event_id": "47f640b2c81b", "ts": 1773948699, "type": "iteration", "episode_id": "897e096800b8", "iter": 2, "status": "ok", "decision": "discard", "metrics": {"eval_score": 0.02, "loss": 0.001371, "training_seconds": 285.6, "baseline": 0.0, "improvement": 0.02}, "params": {"learning_rate": 5e-06, "batch_size": 1, "max_steps": 30, "num_generations": 2, "temperature": 0.8, "_type": "param"}, "elapsed_s": 731.8200387638062}
{"schema": "v1", "run_id": "897e096800b8", "event_id": "80f022a8021e", "ts": 1773948759, "type": "proposal", "episode_id": "897e096800b8", "iter": 3, "params": {"learning_rate": 5e-06, "batch_size": 1, "max_steps": 30, "num_generations": 2, "temperature": 0.8, "_type": "param"}}
{"schema": "v1", "run_id": "897e096800b8", "event_id": "4f597ec6f111", "ts": 1773950070, "type": "iteration", "episode_id": "897e096800b8", "iter": 3, "status": "ok", "decision": "discard", "metrics": {"eval_score": 0.01, "loss": 0.0, "training_seconds": 292.2, "baseline": 0.0, "improvement": 0.01}, "params": {"learning_rate": 5e-06, "batch_size": 1, "max_steps": 30, "num_generations": 2, "temperature": 0.8, "_type": "param"}, "elapsed_s": 1309.1407976597548}
{"schema": "v1", "run_id": "897e096800b8", "event_id": "d2c6b3781db8", "ts": 1773950081, "type": "proposal", "episode_id": "897e096800b8", "iter": 4, "params": {"learning_rate": 1e-05, "batch_size": 2, "max_steps": 15, "num_generations": 3, "temperature": 1.0, "_type": "param"}}
{"schema": "v1", "run_id": "897e096800b8", "event_id": "1a6fba2d7ee5", "ts": 1773950721, "type": "iteration", "episode_id": "897e096800b8", "iter": 4, "status": "ok", "decision": "discard", "metrics": {"eval_score": 0.01, "loss": 0.0, "training_seconds": 262.1, "baseline": 0.0, "improvement": 0.01}, "params": {"learning_rate": 1e-05, "batch_size": 2, "max_steps": 15, "num_generations": 3, "temperature": 1.0, "_type": "param"}, "elapsed_s": 629.537071397528}
{"schema": "v1", "run_id": "897e096800b8", "event_id": "e563f0d65b43", "ts": 1773950735, "type": "proposal", "episode_id": "897e096800b8", "iter": 5, "params": {"learning_rate": 1e-05, "batch_size": 1, "max_steps": 30, "num_generations": 2, "temperature": 0.8, "_type": "param"}}
{"schema": "v1", "run_id": "897e096800b8", "event_id": "f17f9af5e804", "ts": 1773951378, "type": "iteration", "episode_id": "897e096800b8", "iter": 5, "status": "ok", "decision": "discard", "metrics": {"eval_score": 0.01, "loss": 0.001316, "training_seconds": 282.8, "baseline": 0.0, "improvement": 0.01}, "params": {"learning_rate": 1e-05, "batch_size": 1, "max_steps": 30, "num_generations": 2, "temperature": 0.8, "_type": "param"}, "elapsed_s": 642.540188013576}
{"schema": "v1", "run_id": "897e096800b8", "event_id": "3066a54ccdec", "ts": 1773951480, "type": "proposal", "episode_id": "897e096800b8", "iter": 6, "params": {"learning_rate": 3e-06, "batch_size": 1, "max_steps": 30, "num_generations": 3, "temperature": 0.8, "_type": "param"}}
{"schema": "v1", "run_id": "897e096800b8", "event_id": "173d2d7cb682", "ts": 1773952253, "type": "iteration", "episode_id": "897e096800b8", "iter": 6, "status": "ok", "decision": "discard", "metrics": {"eval_score": 0.03, "loss": 0.003868, "training_seconds": 379.1, "baseline": 0.0, "improvement": 0.03}, "params": {"learning_rate": 3e-06, "batch_size": 1, "max_steps": 30, "num_generations": 3, "temperature": 0.8, "_type": "param"}, "elapsed_s": 771.4397641327232}
{"schema": "v1", "run_id": "897e096800b8", "event_id": "06823a1a08da", "ts": 1773952308, "type": "proposal", "episode_id": "897e096800b8", "iter": 7, "params": {"learning_rate": 3e-06, "batch_size": 2, "max_steps": 50, "num_generations": 3, "temperature": 0.8, "_type": "param"}}
{"schema": "v1", "run_id": "897e096800b8", "event_id": "02bf8a14a5f7", "ts": 1773953141, "type": "iteration", "episode_id": "897e096800b8", "iter": 7, "status": "ok", "decision": "discard", "metrics": {"eval_score": 0.0, "loss": 0.001734, "training_seconds": 459.6, "baseline": 0.0, "improvement": 0.0}, "params": {"learning_rate": 3e-06, "batch_size": 2, "max_steps": 50, "num_generations": 3, "temperature": 0.8, "_type": "param"}, "elapsed_s": 831.8562356103212}
{"schema": "v1", "run_id": "897e096800b8", "event_id": "557618e4ce72", "ts": 1773953436, "type": "proposal", "episode_id": "897e096800b8", "iter": 8, "params": {"diff": "", "_type": "diff"}}
{"schema": "v1", "run_id": "897e096800b8", "event_id": "d519daa07db7", "ts": 1773953436, "type": "iteration", "episode_id": "897e096800b8", "iter": 8, "status": "failed", "decision": "discard", "metrics": {}, "params": {"diff": "", "_type": "diff"}, "elapsed_s": 0.0}
{"schema": "v1", "run_id": "897e096800b8", "event_id": "f941420c00c8", "ts": 1773953748, "type": "proposal", "episode_id": "897e096800b8", "iter": 9, "params": {"diff": "", "_type": "diff"}}
{"schema": "v1", "run_id": "897e096800b8", "event_id": "c6651b5eb34a", "ts": 1773953748, "type": "iteration", "episode_id": "897e096800b8", "iter": 9, "status": "failed", "decision": "discard", "metrics": {}, "params": {"diff": "", "_type": "diff"}, "elapsed_s": 0.0}
{"schema": "v1", "run_id": "897e096800b8", "event_id": "844ff4496acd", "ts": 1773954167, "type": "proposal", "episode_id": "897e096800b8", "iter": 10, "params": {"diff": "", "_type": "diff"}}
{"schema": "v1", "run_id": "897e096800b8", "event_id": "cb7070ab9f5b", "ts": 1773954167, "type": "iteration", "episode_id": "897e096800b8", "iter": 10, "status": "failed", "decision": "discard", "metrics": {}, "params": {"diff": "", "_type": "diff"}, "elapsed_s": 0.0}
{"schema": "v1", "run_id": "897e096800b8", "event_id": "69e28a40bbd8", "ts": 1773954167, "type": "episode_summary", "episode_id": "897e096800b8", "mean": 0.015714285714285715, "median": 0.01, "min": 0.0, "max": 0.03, "stdev": 0.011338934190276817, "count": 7, "trend_slope": -0.0025}
{"schema": "v1", "run_id": "897e096800b8", "event_id": "de69d305e73e", "ts": 1773956857, "type": "proposal", "episode_id": "897e096800b8", "iter": 11, "params": {"learning_rate": 3e-06, "batch_size": 1, "max_steps": 50, "num_generations": 2, "temperature": 1.0}}
{"schema": "v1", "run_id": "897e096800b8", "event_id": "1559d1177457", "ts": 1773958147, "type": "iteration", "episode_id": "897e096800b8", "iter": 11, "status": "ok", "decision": "keep", "metrics": {"eval_score": 0.04, "loss": 0.001053, "training_seconds": 604.2, "baseline": 0.0, "improvement": 0.04}, "params": {"learning_rate": 3e-06, "batch_size": 1, "max_steps": 50, "num_generations": 2, "temperature": 1.0}, "elapsed_s": 1289.6819314351305}
{"schema": "v1", "run_id": "897e096800b8", "event_id": "d689b88dedfb", "ts": 1773958147, "type": "episode_summary", "episode_id": "897e096800b8", "mean": 0.04, "median": 0.04, "min": 0.04, "max": 0.04, "stdev": 0.0, "count": 1, "trend_slope": 0.0}
{"schema": "v1", "run_id": "897e096800b8", "event_id": "323df6bf9604", "ts": 1774022121, "type": "proposal", "episode_id": "897e096800b8", "iter": 12, "params": {"learning_rate": 3e-06, "batch_size": 1, "max_steps": 50, "num_generations": 2, "temperature": 0.8}}
{"schema": "v1", "run_id": "897e096800b8", "event_id": "7c0dfa02d9b8", "ts": 1774022938, "type": "iteration", "episode_id": "897e096800b8", "iter": 12, "status": "ok", "decision": "discard", "metrics": {"eval_score": 0.04, "loss": 0.0019, "training_seconds": 359.5, "baseline": 0.0, "improvement": 0.04}, "params": {"learning_rate": 3e-06, "batch_size": 1, "max_steps": 50, "num_generations": 2, "temperature": 0.8}, "elapsed_s": 816.4612695472315}
{"schema": "v1", "run_id": "897e096800b8", "event_id": "49923eadd72d", "ts": 1774022947, "type": "proposal", "episode_id": "897e096800b8", "iter": 13, "params": {"learning_rate": 5e-06, "batch_size": 1, "max_steps": 50, "num_generations": 2, "temperature": 1.0}}
{"schema": "v1", "run_id": "897e096800b8", "event_id": "001d5ae59f56", "ts": 1774023718, "type": "iteration", "episode_id": "897e096800b8", "iter": 13, "status": "ok", "decision": "discard", "metrics": {"eval_score": 0.04, "loss": 0.003162, "training_seconds": 391.1, "baseline": 0.0, "improvement": 0.04}, "params": {"learning_rate": 5e-06, "batch_size": 1, "max_steps": 50, "num_generations": 2, "temperature": 1.0}, "elapsed_s": 769.3798361374065}
{"schema": "v1", "run_id": "897e096800b8", "event_id": "c65f37ada1fe", "ts": 1774023724, "type": "proposal", "episode_id": "897e096800b8", "iter": 14, "params": {"learning_rate": 3e-06, "batch_size": 2, "max_steps": 50, "num_generations": 2, "temperature": 1.0}}
{"schema": "v1", "run_id": "897e096800b8", "event_id": "7e868fddb0f8", "ts": 1774024448, "type": "iteration", "episode_id": "897e096800b8", "iter": 14, "status": "ok", "decision": "discard", "metrics": {"eval_score": 0.01, "loss": 0.000749, "training_seconds": 360.9, "baseline": 0.0, "improvement": 0.01}, "params": {"learning_rate": 3e-06, "batch_size": 2, "max_steps": 50, "num_generations": 2, "temperature": 1.0}, "elapsed_s": 723.1388238351792}
{"schema": "v1", "run_id": "897e096800b8", "event_id": "0c9d836c8cdb", "ts": 1774024455, "type": "proposal", "episode_id": "897e096800b8", "iter": 15, "params": {"learning_rate": 5e-06, "batch_size": 1, "max_steps": 50, "num_generations": 3, "temperature": 0.8}}
{"schema": "v1", "run_id": "897e096800b8", "event_id": "9035a663777c", "ts": 1774025290, "type": "iteration", "episode_id": "897e096800b8", "iter": 15, "status": "ok", "decision": "discard", "metrics": {"eval_score": 0.01, "loss": 0.0, "training_seconds": 469.9, "baseline": 0.0, "improvement": 0.01}, "params": {"learning_rate": 5e-06, "batch_size": 1, "max_steps": 50, "num_generations": 3, "temperature": 0.8}, "elapsed_s": 834.6145734768361}
{"schema": "v1", "run_id": "897e096800b8", "event_id": "18da80023d37", "ts": 1774025297, "type": "proposal", "episode_id": "897e096800b8", "iter": 16, "params": {"learning_rate": 5e-06, "batch_size": 1, "max_steps": 30, "num_generations": 2, "temperature": 0.8}}
{"schema": "v1", "run_id": "897e096800b8", "event_id": "428ab48586f5", "ts": 1774026434, "type": "iteration", "episode_id": "897e096800b8", "iter": 16, "status": "ok", "decision": "discard", "metrics": {"eval_score": 0.02, "loss": 0.000699, "training_seconds": 457.4, "baseline": 0.0, "improvement": 0.02}, "params": {"learning_rate": 5e-06, "batch_size": 1, "max_steps": 30, "num_generations": 2, "temperature": 0.8}, "elapsed_s": 1136.3404632359743}
{"schema": "v1", "run_id": "897e096800b8", "event_id": "085ace88f462", "ts": 1774026439, "type": "proposal", "episode_id": "897e096800b8", "iter": 17, "params": {"learning_rate": 3e-06, "batch_size": 1, "max_steps": 50, "num_generations": 3, "temperature": 1.0}}
{"schema": "v1", "run_id": "897e096800b8", "event_id": "e2059559077b", "ts": 1774028883, "type": "iteration", "episode_id": "897e096800b8", "iter": 17, "status": "failed", "decision": "discard", "metrics": {}, "params": {"learning_rate": 3e-06, "batch_size": 1, "max_steps": 50, "num_generations": 3, "temperature": 1.0}, "elapsed_s": 2443.3327918546274}
{"schema": "v1", "run_id": "897e096800b8", "event_id": "d29c59aa46c9", "ts": 1774028890, "type": "proposal", "episode_id": "897e096800b8", "iter": 18, "params": {"learning_rate": 3e-06, "batch_size": 1, "max_steps": 50, "num_generations": 2, "temperature": 1.0}}
{"schema": "v1", "run_id": "897e096800b8", "event_id": "f50ca5863eb3", "ts": 1774030148, "type": "iteration", "episode_id": "897e096800b8", "iter": 18, "status": "ok", "decision": "discard", "metrics": {"eval_score": 0.01, "loss": 0.0, "training_seconds": 588.4, "baseline": 0.0, "improvement": 0.01}, "params": {"learning_rate": 3e-06, "batch_size": 1, "max_steps": 50, "num_generations": 2, "temperature": 1.0}, "elapsed_s": 1256.9240808179602}
{"schema": "v1", "run_id": "897e096800b8", "event_id": "1788ee49688a", "ts": 1774030171, "type": "proposal", "episode_id": "897e096800b8", "iter": 19, "params": {"learning_rate": 5e-06, "batch_size": 1, "max_steps": 50, "num_generations": 2, "temperature": 0.8}}
{"schema": "v1", "run_id": "897e096800b8", "event_id": "8bb3dd78b4d7", "ts": 1774031435, "type": "iteration", "episode_id": "897e096800b8", "iter": 19, "status": "ok", "decision": "discard", "metrics": {"eval_score": 0.04, "loss": 0.000819, "training_seconds": 576.6, "baseline": 0.0, "improvement": 0.04}, "params": {"learning_rate": 5e-06, "batch_size": 1, "max_steps": 50, "num_generations": 2, "temperature": 0.8}, "elapsed_s": 1263.180524124764}
{"schema": "v1", "run_id": "897e096800b8", "event_id": "d7ba7db95b03", "ts": 1774031457, "type": "proposal", "episode_id": "897e096800b8", "iter": 20, "params": {"learning_rate": 5e-06, "batch_size": 1, "max_steps": 50, "num_generations": 3, "temperature": 1.0}}
{"schema": "v1", "run_id": "897e096800b8", "event_id": "cd22fc4bfa59", "ts": 1774032812, "type": "iteration", "episode_id": "897e096800b8", "iter": 20, "status": "ok", "decision": "discard", "metrics": {"eval_score": 0.01, "loss": 0.0, "training_seconds": 767.2, "baseline": 0.0, "improvement": 0.01}, "params": {"learning_rate": 5e-06, "batch_size": 1, "max_steps": 50, "num_generations": 3, "temperature": 1.0}, "elapsed_s": 1354.82829957176}
{"schema": "v1", "run_id": "897e096800b8", "event_id": "3ddb92759921", "ts": 1774032819, "type": "proposal", "episode_id": "897e096800b8", "iter": 21, "params": {"learning_rate": 1e-05, "batch_size": 1, "max_steps": 30, "num_generations": 2, "temperature": 0.8}}
{"schema": "v1", "run_id": "897e096800b8", "event_id": "1edb6f4c4173", "ts": 1774033891, "type": "iteration", "episode_id": "897e096800b8", "iter": 21, "status": "ok", "decision": "discard", "metrics": {"eval_score": 0.01, "loss": 0.0, "training_seconds": 481.0, "baseline": 0.0, "improvement": 0.01}, "params": {"learning_rate": 1e-05, "batch_size": 1, "max_steps": 30, "num_generations": 2, "temperature": 0.8}, "elapsed_s": 1070.2409067219123}
{"schema": "v1", "run_id": "897e096800b8", "event_id": "0e3ff2ff19d4", "ts": 1774033891, "type": "episode_summary", "episode_id": "897e096800b8", "mean": 0.021111111111111112, "median": 0.01, "min": 0.01, "max": 0.04, "stdev": 0.014529663145135579, "count": 9, "trend_slope": -0.002500000000000001}
{"schema": "v1", "run_id": "e9bde29ad39f", "event_id": "10ffe8b69739", "ts": 1774080248, "type": "proposal", "episode_id": "e9bde29ad39f", "iter": 0, "params": {"learning_rate": 5e-06, "batch_size": 2, "max_steps": 100, "num_generations": 3, "temperature": 1.0}}
{"schema": "v1", "run_id": "e9bde29ad39f", "event_id": "30b506dea01a", "ts": 1774080407, "type": "iteration", "episode_id": "e9bde29ad39f", "iter": 0, "status": "failed", "decision": "discard", "metrics": {"train": 500.0, "eval": 200.0}, "params": {"learning_rate": 5e-06, "batch_size": 2, "max_steps": 100, "num_generations": 3, "temperature": 1.0}, "elapsed_s": 158.2814315976575}
{"schema": "v1", "run_id": "e9bde29ad39f", "event_id": "3c0dbe99ee21", "ts": 1774080414, "type": "proposal", "episode_id": "e9bde29ad39f", "iter": 1, "params": {"learning_rate": 5e-06, "batch_size": 1, "max_steps": 100, "num_generations": 3, "temperature": 0.8}}
{"schema": "v1", "run_id": "e9bde29ad39f", "event_id": "e216d18c2ee3", "ts": 1774080451, "type": "iteration", "episode_id": "e9bde29ad39f", "iter": 1, "status": "failed", "decision": "discard", "metrics": {"train": 500.0, "eval": 200.0}, "params": {"learning_rate": 5e-06, "batch_size": 1, "max_steps": 100, "num_generations": 3, "temperature": 0.8}, "elapsed_s": 36.64666853193194}
{"schema": "v1", "run_id": "e9bde29ad39f", "event_id": "6b2f563d5ac7", "ts": 1774080459, "type": "proposal", "episode_id": "e9bde29ad39f", "iter": 2, "params": {"learning_rate": 3e-06, "batch_size": 1, "max_steps": 50, "num_generations": 2, "temperature": 0.8}}
{"schema": "v1", "run_id": "e9bde29ad39f", "event_id": "b504cca63444", "ts": 1774080512, "type": "iteration", "episode_id": "e9bde29ad39f", "iter": 2, "status": "failed", "decision": "discard", "metrics": {"train": 500.0, "eval": 200.0}, "params": {"learning_rate": 3e-06, "batch_size": 1, "max_steps": 50, "num_generations": 2, "temperature": 0.8}, "elapsed_s": 51.93349969852716}
{"schema": "v1", "run_id": "e9bde29ad39f", "event_id": "cbbde8c0176e", "ts": 1774080518, "type": "proposal", "episode_id": "e9bde29ad39f", "iter": 3, "params": {"learning_rate": 5e-06, "batch_size": 1, "max_steps": 100, "num_generations": 4, "temperature": 0.8}}
{"schema": "v1", "run_id": "e9bde29ad39f", "event_id": "e61f7093e465", "ts": 1774080662, "type": "iteration", "episode_id": "e9bde29ad39f", "iter": 3, "status": "failed", "decision": "discard", "metrics": {"train": 500.0, "eval": 200.0}, "params": {"learning_rate": 5e-06, "batch_size": 1, "max_steps": 100, "num_generations": 4, "temperature": 0.8}, "elapsed_s": 142.50885894615203}
{"schema": "v1", "run_id": "e9bde29ad39f", "event_id": "a5aacb098504", "ts": 1774080706, "type": "proposal", "episode_id": "e9bde29ad39f", "iter": 4, "params": {"learning_rate": 3e-06, "batch_size": 1, "max_steps": 100, "num_generations": 4, "temperature": 0.8}}
{"schema": "v1", "run_id": "e9bde29ad39f", "event_id": "9d2d8b4c6146", "ts": 1774080758, "type": "iteration", "episode_id": "e9bde29ad39f", "iter": 4, "status": "failed", "decision": "discard", "metrics": {"train": 500.0, "eval": 200.0}, "params": {"learning_rate": 3e-06, "batch_size": 1, "max_steps": 100, "num_generations": 4, "temperature": 0.8}, "elapsed_s": 51.79865853860974}
{"schema": "v1", "run_id": "e9bde29ad39f", "event_id": "94e16f1a24c3", "ts": 1774080765, "type": "proposal", "episode_id": "e9bde29ad39f", "iter": 5, "params": {"learning_rate": 1e-05, "batch_size": 1, "max_steps": 50, "num_generations": 4, "temperature": 1.0}}
{"schema": "v1", "run_id": "e9bde29ad39f", "event_id": "aa1d82dc3fb6", "ts": 1774080817, "type": "iteration", "episode_id": "e9bde29ad39f", "iter": 5, "status": "failed", "decision": "discard", "metrics": {"train": 500.0, "eval": 200.0}, "params": {"learning_rate": 1e-05, "batch_size": 1, "max_steps": 50, "num_generations": 4, "temperature": 1.0}, "elapsed_s": 51.65456631965935}
{"schema": "v1", "run_id": "e9bde29ad39f", "event_id": "65a691ee1be5", "ts": 1774080825, "type": "proposal", "episode_id": "e9bde29ad39f", "iter": 6, "params": {"learning_rate": 5e-06, "batch_size": 2, "max_steps": 50, "num_generations": 4, "temperature": 0.8}}
{"schema": "v1", "run_id": "e9bde29ad39f", "event_id": "ff53dddf1b6a", "ts": 1774080862, "type": "iteration", "episode_id": "e9bde29ad39f", "iter": 6, "status": "failed", "decision": "discard", "metrics": {"train": 500.0, "eval": 200.0}, "params": {"learning_rate": 5e-06, "batch_size": 2, "max_steps": 50, "num_generations": 4, "temperature": 0.8}, "elapsed_s": 36.6699939602986}
{"schema": "v1", "run_id": "e9bde29ad39f", "event_id": "3fc23632f31d", "ts": 1774080874, "type": "proposal", "episode_id": "e9bde29ad39f", "iter": 7, "params": {"learning_rate": 1e-05, "batch_size": 1, "max_steps": 50, "num_generations": 2, "temperature": 1.0}}
{"schema": "v1", "run_id": "e9bde29ad39f", "event_id": "18ecb26abb35", "ts": 1774080927, "type": "iteration", "episode_id": "e9bde29ad39f", "iter": 7, "status": "failed", "decision": "discard", "metrics": {"train": 500.0, "eval": 200.0}, "params": {"learning_rate": 1e-05, "batch_size": 1, "max_steps": 50, "num_generations": 2, "temperature": 1.0}, "elapsed_s": 51.676731096580625}
{"schema": "v1", "run_id": "3520d1a41e25", "event_id": "93de499a3056", "ts": 1774105168, "type": "proposal", "episode_id": "3520d1a41e25", "iter": 0, "params": {"learning_rate": 5e-06, "batch_size": 2, "max_steps": 100, "num_generations": 4, "temperature": 1.0}}
{"schema": "v1", "run_id": "3520d1a41e25", "event_id": "8f2a219e204a", "ts": 1774107627, "type": "iteration", "episode_id": "3520d1a41e25", "iter": 0, "status": "failed", "decision": "discard", "metrics": {}, "params": {"learning_rate": 5e-06, "batch_size": 2, "max_steps": 100, "num_generations": 4, "temperature": 1.0}, "elapsed_s": 2458.727164127864}
{"schema": "v1", "run_id": "3520d1a41e25", "event_id": "b2b23151d86e", "ts": 1774107634, "type": "proposal", "episode_id": "3520d1a41e25", "iter": 1, "params": {"learning_rate": 5e-06, "batch_size": 1, "max_steps": 100, "num_generations": 3, "temperature": 0.8}}
