{"schema": "v1", "run_id": "abaf0b3711bf", "event_id": "4ee090dfc9d0", "ts": 1777584443, "type": "proposal", "episode_id": "abaf0b3711bf", "iter": 0, "params": {"learning_rate": 5e-05, "max_steps": 50, "num_generations": 2, "temperature": 0.7, "lora_rank": 4, "AR_MODEL_DIR": "/data/models/ablation-v2-2026-04/B_seed3/v0000"}, "concurrency": 4}
{"schema": "v1", "run_id": "abaf0b3711bf", "event_id": "b212b01ce045", "ts": 1777584443, "type": "proposal", "episode_id": "abaf0b3711bf", "iter": 1, "params": {"learning_rate": 0.0003, "max_steps": 80, "num_generations": 3, "temperature": 0.9, "lora_rank": 16, "AR_MODEL_DIR": "/data/models/ablation-v2-2026-04/B_seed3/v0001"}, "concurrency": 4}
{"schema": "v1", "run_id": "abaf0b3711bf", "event_id": "6cf35fc36d25", "ts": 1777584443, "type": "proposal", "episode_id": "abaf0b3711bf", "iter": 2, "params": {"learning_rate": 0.0001, "max_steps": 30, "num_generations": 2, "temperature": 0.7, "lora_rank": 8, "AR_MODEL_DIR": "/data/models/ablation-v2-2026-04/B_seed3/v0002"}, "concurrency": 4}
{"schema": "v1", "run_id": "abaf0b3711bf", "event_id": "ecd0259aaf5c", "ts": 1777584443, "type": "proposal", "episode_id": "abaf0b3711bf", "iter": 3, "params": {"learning_rate": 5e-05, "max_steps": 80, "num_generations": 3, "temperature": 0.9, "lora_rank": 4, "AR_MODEL_DIR": "/data/models/ablation-v2-2026-04/B_seed3/v0003"}, "concurrency": 4}
{"schema": "v1", "run_id": "abaf0b3711bf", "event_id": "29935b1b9635", "ts": 1777584970, "type": "proposal", "episode_id": "abaf0b3711bf", "iter": 4, "params": {"learning_rate": 0.0001, "max_steps": 50, "num_generations": 2, "temperature": 0.7, "lora_rank": 8, "AR_MODEL_DIR": "/data/models/ablation-v2-2026-04/B_seed3/v0004"}, "concurrency": 4}
{"schema": "v1", "run_id": "abaf0b3711bf", "event_id": "c6e1a708cef0", "ts": 1777584970, "type": "iteration", "episode_id": "abaf0b3711bf", "iter": 0, "status": "ok", "decision": "keep", "metrics": {"rank": 4.0, "eval_score": 0.496364, "decision_accuracy": 0.209091, "json_compliance": 0.954545, "loss": 0.001159, "training_seconds": 128.6}, "params": {"learning_rate": 5e-05, "max_steps": 50, "num_generations": 2, "temperature": 0.7, "lora_rank": 4, "AR_MODEL_DIR": "/data/models/ablation-v2-2026-04/B_seed3/v0000"}, "elapsed_s": 248.46817907923833, "concurrency": 4}
{"schema": "v1", "run_id": "abaf0b3711bf", "event_id": "b5bdc46c7e45", "ts": 1777585147, "type": "proposal", "episode_id": "abaf0b3711bf", "iter": 5, "params": {"learning_rate": 0.0003, "max_steps": 30, "num_generations": 3, "temperature": 0.9, "lora_rank": 16, "AR_MODEL_DIR": "/data/models/ablation-v2-2026-04/B_seed3/v0005"}, "concurrency": 4}
{"schema": "v1", "run_id": "abaf0b3711bf", "event_id": "ec85a5d41fd9", "ts": 1777585147, "type": "proposal", "episode_id": "abaf0b3711bf", "iter": 6, "params": {"learning_rate": 0.0001, "max_steps": 80, "num_generations": 2, "temperature": 0.7, "lora_rank": 8, "AR_MODEL_DIR": "/data/models/ablation-v2-2026-04/B_seed3/v0006"}, "concurrency": 4}
{"schema": "v1", "run_id": "abaf0b3711bf", "event_id": "8b21e9a32dc2", "ts": 1777585147, "type": "proposal", "episode_id": "abaf0b3711bf", "iter": 7, "params": {"learning_rate": 0.0003, "max_steps": 50, "num_generations": 3, "temperature": 0.7, "lora_rank": 4, "AR_MODEL_DIR": "/data/models/ablation-v2-2026-04/B_seed3/v0007"}, "concurrency": 4}
{"schema": "v1", "run_id": "abaf0b3711bf", "event_id": "6e07e13b873e", "ts": 1777585147, "type": "iteration", "episode_id": "abaf0b3711bf", "iter": 1, "status": "ok", "decision": "discard", "metrics": {"rank": 16.0, "eval_score": 0.409091, "decision_accuracy": 0.2, "json_compliance": 0.963636, "loss": 0.000744, "training_seconds": 213.1}, "params": {"learning_rate": 0.0003, "max_steps": 80, "num_generations": 3, "temperature": 0.9, "lora_rank": 16, "AR_MODEL_DIR": "/data/models/ablation-v2-2026-04/B_seed3/v0001"}, "elapsed_s": 334.83858220791444, "concurrency": 4}
{"schema": "v1", "run_id": "abaf0b3711bf", "event_id": "ef0ac290b4bd", "ts": 1777585147, "type": "iteration", "episode_id": "abaf0b3711bf", "iter": 2, "status": "ok", "decision": "discard", "metrics": {"rank": 8.0, "eval_score": 0.490909, "decision_accuracy": 0.209091, "json_compliance": 0.963636, "loss": 0.002927, "training_seconds": 96.5}, "params": {"learning_rate": 0.0001, "max_steps": 30, "num_generations": 2, "temperature": 0.7, "lora_rank": 8, "AR_MODEL_DIR": "/data/models/ablation-v2-2026-04/B_seed3/v0002"}, "elapsed_s": 225.5437843380496, "concurrency": 4}
{"schema": "v1", "run_id": "abaf0b3711bf", "event_id": "59f8aec89ed4", "ts": 1777585147, "type": "iteration", "episode_id": "abaf0b3711bf", "iter": 3, "status": "ok", "decision": "discard", "metrics": {"rank": 4.0, "eval_score": 0.426364, "decision_accuracy": 0.218182, "json_compliance": 0.963636, "loss": 0.003857, "training_seconds": 220.6}, "params": {"learning_rate": 5e-05, "max_steps": 80, "num_generations": 3, "temperature": 0.9, "lora_rank": 4, "AR_MODEL_DIR": "/data/models/ablation-v2-2026-04/B_seed3/v0003"}, "elapsed_s": 328.43304431810975, "concurrency": 4}
{"schema": "v1", "run_id": "abaf0b3711bf", "event_id": "1896bc1903c1", "ts": 1777585261, "type": "iteration", "episode_id": "abaf0b3711bf", "iter": 4, "status": "ok", "decision": "discard", "metrics": {"rank": 8.0, "eval_score": 0.495909, "decision_accuracy": 0.209091, "json_compliance": 0.954545, "loss": 0.00142, "training_seconds": 129.2}, "params": {"learning_rate": 0.0001, "max_steps": 50, "num_generations": 2, "temperature": 0.7, "lora_rank": 8, "AR_MODEL_DIR": "/data/models/ablation-v2-2026-04/B_seed3/v0004"}, "elapsed_s": 248.76939229434356, "concurrency": 4}
{"schema": "v1", "run_id": "abaf0b3711bf", "event_id": "482c3ff49709", "ts": 1777585531, "type": "iteration", "episode_id": "abaf0b3711bf", "iter": 5, "status": "ok", "decision": "discard", "metrics": {"rank": 16.0, "eval_score": 0.265455, "decision_accuracy": 0.036364, "json_compliance": 0.436364, "loss": 0.009957, "training_seconds": 157.6}, "params": {"learning_rate": 0.0003, "max_steps": 30, "num_generations": 3, "temperature": 0.9, "lora_rank": 16, "AR_MODEL_DIR": "/data/models/ablation-v2-2026-04/B_seed3/v0005"}, "elapsed_s": 332.1526132649742, "concurrency": 4}
{"schema": "v1", "run_id": "abaf0b3711bf", "event_id": "0953093f1695", "ts": 1777585531, "type": "iteration", "episode_id": "abaf0b3711bf", "iter": 6, "status": "ok", "decision": "keep", "metrics": {"rank": 8.0, "eval_score": 0.53, "decision_accuracy": 0.209091, "json_compliance": 0.972727, "loss": 0.000289, "training_seconds": 162.9}, "params": {"learning_rate": 0.0001, "max_steps": 80, "num_generations": 2, "temperature": 0.7, "lora_rank": 8, "AR_MODEL_DIR": "/data/models/ablation-v2-2026-04/B_seed3/v0006"}, "elapsed_s": 266.7310287170112, "concurrency": 4}
{"schema": "v1", "run_id": "abaf0b3711bf", "event_id": "ccac1c308eeb", "ts": 1777585531, "type": "iteration", "episode_id": "abaf0b3711bf", "iter": 7, "status": "ok", "decision": "discard", "metrics": {"rank": 4.0, "eval_score": 0.411818, "decision_accuracy": 0.2, "json_compliance": 0.972727, "loss": 0.002573, "training_seconds": 165.9}, "params": {"learning_rate": 0.0003, "max_steps": 50, "num_generations": 3, "temperature": 0.7, "lora_rank": 4, "AR_MODEL_DIR": "/data/models/ablation-v2-2026-04/B_seed3/v0007"}, "elapsed_s": 286.6047596121207, "concurrency": 4}
{"schema": "v1", "run_id": "abaf0b3711bf", "event_id": "a9f0885d23b6", "ts": 1777585531, "type": "episode_summary", "episode_id": "abaf0b3711bf", "mean": 0.44073875, "median": 0.4586365, "min": 0.265455, "max": 0.53, "stdev": 0.08399963092733546, "count": 8, "trend_slope": -0.007072547619047684}
