{"schema": "v1", "run_id": "1ff96a48189d", "event_id": "cbe4566552f6", "ts": 1777573996, "type": "proposal", "episode_id": "1ff96a48189d", "iter": 0, "params": {"learning_rate": 5e-05, "max_steps": 50, "num_generations": 2, "temperature": 0.7, "lora_rank": 8, "AR_MODEL_DIR": "/data/models/ablation-2026-04/A_seed2/v0000"}, "concurrency": 4}
{"schema": "v1", "run_id": "1ff96a48189d", "event_id": "1689d40c816f", "ts": 1777573996, "type": "proposal", "episode_id": "1ff96a48189d", "iter": 1, "params": {"learning_rate": 0.0003, "max_steps": 30, "num_generations": 3, "temperature": 0.9, "lora_rank": 4, "AR_MODEL_DIR": "/data/models/ablation-2026-04/A_seed2/v0001"}, "concurrency": 4}
{"schema": "v1", "run_id": "1ff96a48189d", "event_id": "4c4f07bd1201", "ts": 1777573996, "type": "proposal", "episode_id": "1ff96a48189d", "iter": 2, "params": {"learning_rate": 0.0001, "max_steps": 80, "num_generations": 2, "temperature": 0.9, "lora_rank": 16, "AR_MODEL_DIR": "/data/models/ablation-2026-04/A_seed2/v0002"}, "concurrency": 4}
{"schema": "v1", "run_id": "1ff96a48189d", "event_id": "87266cfc007b", "ts": 1777573996, "type": "proposal", "episode_id": "1ff96a48189d", "iter": 3, "params": {"learning_rate": 0.0003, "max_steps": 50, "num_generations": 3, "temperature": 0.7, "lora_rank": 8, "AR_MODEL_DIR": "/data/models/ablation-2026-04/A_seed2/v0003"}, "concurrency": 4}
{"schema": "v1", "run_id": "1ff96a48189d", "event_id": "10271ecfc8e0", "ts": 1777574294, "type": "iteration", "episode_id": "1ff96a48189d", "iter": 0, "status": "ok", "decision": "keep", "metrics": {"rank": 8.0, "eval_score": 0.504545, "decision_accuracy": 0.209091, "json_compliance": 0.963636, "loss": 0.000491, "training_seconds": 126.5}, "params": {"learning_rate": 5e-05, "max_steps": 50, "num_generations": 2, "temperature": 0.7, "lora_rank": 8, "AR_MODEL_DIR": "/data/models/ablation-2026-04/A_seed2/v0000"}, "elapsed_s": 255.8157637589611, "concurrency": 4}
{"schema": "v1", "run_id": "1ff96a48189d", "event_id": "7f44f67e148d", "ts": 1777574294, "type": "iteration", "episode_id": "1ff96a48189d", "iter": 1, "status": "ok", "decision": "keep", "metrics": {"rank": 4.0, "eval_score": 0.527273, "decision_accuracy": 0.209091, "json_compliance": 0.981818, "loss": 0.011366, "training_seconds": 73.8}, "params": {"learning_rate": 0.0003, "max_steps": 30, "num_generations": 3, "temperature": 0.9, "lora_rank": 4, "AR_MODEL_DIR": "/data/models/ablation-2026-04/A_seed2/v0001"}, "elapsed_s": 269.6521834959276, "concurrency": 4}
{"schema": "v1", "run_id": "1ff96a48189d", "event_id": "be2ad7ec135c", "ts": 1777574299, "type": "iteration", "episode_id": "1ff96a48189d", "iter": 2, "status": "ok", "decision": "discard", "metrics": {"rank": 16.0, "eval_score": 0.527273, "decision_accuracy": 0.2, "json_compliance": 0.963636, "loss": 0.000844, "training_seconds": 92.9}, "params": {"learning_rate": 0.0001, "max_steps": 80, "num_generations": 2, "temperature": 0.9, "lora_rank": 16, "AR_MODEL_DIR": "/data/models/ablation-2026-04/A_seed2/v0002"}, "elapsed_s": 269.53699902491644, "concurrency": 4}
{"schema": "v1", "run_id": "1ff96a48189d", "event_id": "2bbbd4fa4e06", "ts": 1777574299, "type": "iteration", "episode_id": "1ff96a48189d", "iter": 3, "status": "ok", "decision": "discard", "metrics": {"rank": 8.0, "eval_score": 0.42, "decision_accuracy": 0.209091, "json_compliance": 0.981818, "loss": 0.002595, "training_seconds": 81.5}, "params": {"learning_rate": 0.0003, "max_steps": 50, "num_generations": 3, "temperature": 0.7, "lora_rank": 8, "AR_MODEL_DIR": "/data/models/ablation-2026-04/A_seed2/v0003"}, "elapsed_s": 255.39529164182022, "concurrency": 4}
{"schema": "v1", "run_id": "1ff96a48189d", "event_id": "28f00b161dc0", "ts": 1777574299, "type": "episode_summary", "episode_id": "1ff96a48189d", "mean": 0.49477275, "median": 0.515909, "min": 0.42, "max": 0.527273, "stdev": 0.050986905223302195, "count": 4, "trend_slope": -0.025363499999999917}
