{"schema": "v1", "run_id": "ba1841d60a06", "event_id": "f905396620e7", "ts": 1777587258, "type": "proposal", "episode_id": "ba1841d60a06", "iter": 0, "params": {"learning_rate": 5e-05, "max_steps": 50, "num_generations": 2, "temperature": 0.9, "lora_rank": 8, "AR_MODEL_DIR": "/data/models/ablation-v2-2026-04/B_seed4/v0000"}, "concurrency": 4}
{"schema": "v1", "run_id": "ba1841d60a06", "event_id": "fe318a0a3283", "ts": 1777587258, "type": "proposal", "episode_id": "ba1841d60a06", "iter": 1, "params": {"learning_rate": 5e-05, "max_steps": 30, "num_generations": 2, "temperature": 0.7, "lora_rank": 8, "AR_MODEL_DIR": "/data/models/ablation-v2-2026-04/B_seed4/v0001"}, "concurrency": 4}
{"schema": "v1", "run_id": "ba1841d60a06", "event_id": "c5680b4bb00d", "ts": 1777587258, "type": "proposal", "episode_id": "ba1841d60a06", "iter": 2, "params": {"learning_rate": 0.0003, "max_steps": 50, "num_generations": 2, "temperature": 0.7, "lora_rank": 16, "AR_MODEL_DIR": "/data/models/ablation-v2-2026-04/B_seed4/v0002"}, "concurrency": 4}
{"schema": "v1", "run_id": "ba1841d60a06", "event_id": "120f36632f58", "ts": 1777587258, "type": "proposal", "episode_id": "ba1841d60a06", "iter": 3, "params": {"learning_rate": 0.0003, "max_steps": 50, "num_generations": 3, "temperature": 0.7, "lora_rank": 4, "AR_MODEL_DIR": "/data/models/ablation-v2-2026-04/B_seed4/v0003"}, "concurrency": 4}
{"schema": "v1", "run_id": "ba1841d60a06", "event_id": "f45d7b1fad04", "ts": 1777587940, "type": "proposal", "episode_id": "ba1841d60a06", "iter": 4, "params": {"learning_rate": 0.0001, "max_steps": 30, "num_generations": 2, "temperature": 0.9, "lora_rank": 8, "AR_MODEL_DIR": "/data/models/ablation-v2-2026-04/B_seed4/v0004"}, "concurrency": 4}
{"schema": "v1", "run_id": "ba1841d60a06", "event_id": "5096d886b82d", "ts": 1777587941, "type": "iteration", "episode_id": "ba1841d60a06", "iter": 0, "status": "ok", "decision": "keep", "metrics": {"rank": 8.0, "eval_score": 0.526364, "decision_accuracy": 0.209091, "json_compliance": 0.963636, "loss": 0.000713, "training_seconds": 127.5}, "params": {"learning_rate": 5e-05, "max_steps": 50, "num_generations": 2, "temperature": 0.9, "lora_rank": 8, "AR_MODEL_DIR": "/data/models/ablation-v2-2026-04/B_seed4/v0000"}, "elapsed_s": 342.3206804632209, "concurrency": 4}
{"schema": "v1", "run_id": "ba1841d60a06", "event_id": "b0cb18c2d732", "ts": 1777587962, "type": "proposal", "episode_id": "ba1841d60a06", "iter": 5, "params": {"learning_rate": 0.0003, "max_steps": 80, "num_generations": 3, "temperature": 0.7, "lora_rank": 16, "AR_MODEL_DIR": "/data/models/ablation-v2-2026-04/B_seed4/v0005"}, "concurrency": 4}
{"schema": "v1", "run_id": "ba1841d60a06", "event_id": "b3cae40cb3b1", "ts": 1777587962, "type": "proposal", "episode_id": "ba1841d60a06", "iter": 6, "params": {"learning_rate": 0.0001, "max_steps": 30, "num_generations": 2, "temperature": 0.9, "lora_rank": 4, "AR_MODEL_DIR": "/data/models/ablation-v2-2026-04/B_seed4/v0006"}, "concurrency": 4}
{"schema": "v1", "run_id": "ba1841d60a06", "event_id": "ee2aa4d21385", "ts": 1777587962, "type": "proposal", "episode_id": "ba1841d60a06", "iter": 7, "params": {"learning_rate": 0.0003, "max_steps": 50, "num_generations": 3, "temperature": 0.7, "lora_rank": 8, "AR_MODEL_DIR": "/data/models/ablation-v2-2026-04/B_seed4/v0007"}, "concurrency": 4}
{"schema": "v1", "run_id": "ba1841d60a06", "event_id": "077d9de4366d", "ts": 1777587962, "type": "iteration", "episode_id": "ba1841d60a06", "iter": 1, "status": "ok", "decision": "discard", "metrics": {"rank": 8.0, "eval_score": 0.51, "decision_accuracy": 0.236364, "json_compliance": 0.963636, "loss": 0.000788, "training_seconds": 100.0}, "params": {"learning_rate": 5e-05, "max_steps": 30, "num_generations": 2, "temperature": 0.7, "lora_rank": 8, "AR_MODEL_DIR": "/data/models/ablation-v2-2026-04/B_seed4/v0001"}, "elapsed_s": 320.7873083371669, "concurrency": 4}
{"schema": "v1", "run_id": "ba1841d60a06", "event_id": "fb4c2806ce81", "ts": 1777587962, "type": "iteration", "episode_id": "ba1841d60a06", "iter": 2, "status": "ok", "decision": "discard", "metrics": {"rank": 16.0, "eval_score": 0.42, "decision_accuracy": 0.209091, "json_compliance": 0.981818, "loss": 0.00194, "training_seconds": 127.5}, "params": {"learning_rate": 0.0003, "max_steps": 50, "num_generations": 2, "temperature": 0.7, "lora_rank": 16, "AR_MODEL_DIR": "/data/models/ablation-v2-2026-04/B_seed4/v0002"}, "elapsed_s": 328.1123277521692, "concurrency": 4}
{"schema": "v1", "run_id": "ba1841d60a06", "event_id": "ece015850ea1", "ts": 1777587962, "type": "iteration", "episode_id": "ba1841d60a06", "iter": 3, "status": "ok", "decision": "discard", "metrics": {"rank": 4.0, "eval_score": 0.190909, "decision_accuracy": 0.036364, "json_compliance": 0.363636, "loss": 0.007868, "training_seconds": 195.2}, "params": {"learning_rate": 0.0003, "max_steps": 50, "num_generations": 3, "temperature": 0.7, "lora_rank": 4, "AR_MODEL_DIR": "/data/models/ablation-v2-2026-04/B_seed4/v0003"}, "elapsed_s": 373.26183315506205, "concurrency": 4}
{"schema": "v1", "run_id": "ba1841d60a06", "event_id": "543714d7d6c2", "ts": 1777588229, "type": "iteration", "episode_id": "ba1841d60a06", "iter": 4, "status": "ok", "decision": "discard", "metrics": {"rank": 8.0, "eval_score": 0.468182, "decision_accuracy": 0.209091, "json_compliance": 0.954545, "loss": 0.001388, "training_seconds": 103.1}, "params": {"learning_rate": 0.0001, "max_steps": 30, "num_generations": 2, "temperature": 0.9, "lora_rank": 8, "AR_MODEL_DIR": "/data/models/ablation-v2-2026-04/B_seed4/v0004"}, "elapsed_s": 227.98300389619544, "concurrency": 4}
{"schema": "v1", "run_id": "ba1841d60a06", "event_id": "2336cda653cf", "ts": 1777588611, "type": "iteration", "episode_id": "ba1841d60a06", "iter": 5, "status": "ok", "decision": "keep", "metrics": {"rank": 16.0, "eval_score": 0.535909, "decision_accuracy": 0.209091, "json_compliance": 0.990909, "loss": 0.01373, "training_seconds": 355.0}, "params": {"learning_rate": 0.0003, "max_steps": 80, "num_generations": 3, "temperature": 0.7, "lora_rank": 16, "AR_MODEL_DIR": "/data/models/ablation-v2-2026-04/B_seed4/v0005"}, "elapsed_s": 627.3846551608294, "concurrency": 4}
{"schema": "v1", "run_id": "ba1841d60a06", "event_id": "4e2dbf43fc01", "ts": 1777588611, "type": "iteration", "episode_id": "ba1841d60a06", "iter": 6, "status": "ok", "decision": "discard", "metrics": {"rank": 4.0, "eval_score": 0.491364, "decision_accuracy": 0.209091, "json_compliance": 0.954545, "loss": 0.002597, "training_seconds": 98.9}, "params": {"learning_rate": 0.0001, "max_steps": 30, "num_generations": 2, "temperature": 0.9, "lora_rank": 4, "AR_MODEL_DIR": "/data/models/ablation-v2-2026-04/B_seed4/v0006"}, "elapsed_s": 228.15465026395395, "concurrency": 4}
{"schema": "v1", "run_id": "ba1841d60a06", "event_id": "be1598f5922b", "ts": 1777588611, "type": "iteration", "episode_id": "ba1841d60a06", "iter": 7, "status": "ok", "decision": "keep", "metrics": {"rank": 8.0, "eval_score": 0.586364, "decision_accuracy": 0.209091, "json_compliance": 0.981818, "loss": 0.006782, "training_seconds": 168.4}, "params": {"learning_rate": 0.0003, "max_steps": 50, "num_generations": 3, "temperature": 0.7, "lora_rank": 8, "AR_MODEL_DIR": "/data/models/ablation-v2-2026-04/B_seed4/v0007"}, "elapsed_s": 266.8724414650351, "concurrency": 4}
{"schema": "v1", "run_id": "ba1841d60a06", "event_id": "aa5e8d394170", "ts": 1777588611, "type": "episode_summary", "episode_id": "ba1841d60a06", "mean": 0.4661365, "median": 0.5006820000000001, "min": 0.190909, "max": 0.586364, "stdev": 0.12153399061050488, "count": 8, "trend_slope": 0.011331190476190493}
