{"schema": "v1", "run_id": "fe687c535ffa", "event_id": "c1af066e8171", "ts": 1777588682, "type": "proposal", "episode_id": "fe687c535ffa", "iter": 0, "params": {"learning_rate": 5e-05, "max_steps": 30, "num_generations": 2, "temperature": 0.7, "lora_rank": 4, "AR_MODEL_DIR": "/data/models/ablation-v2-2026-04/A_seed5/v0000"}, "concurrency": 4}
{"schema": "v1", "run_id": "fe687c535ffa", "event_id": "fc1f119ab17b", "ts": 1777588682, "type": "proposal", "episode_id": "fe687c535ffa", "iter": 1, "params": {"learning_rate": 0.0003, "max_steps": 80, "num_generations": 3, "temperature": 0.9, "lora_rank": 16, "AR_MODEL_DIR": "/data/models/ablation-v2-2026-04/A_seed5/v0001"}, "concurrency": 4}
{"schema": "v1", "run_id": "fe687c535ffa", "event_id": "6c0d9b6eaba9", "ts": 1777588682, "type": "proposal", "episode_id": "fe687c535ffa", "iter": 2, "params": {"learning_rate": 0.0001, "max_steps": 50, "num_generations": 2, "temperature": 0.7, "lora_rank": 8, "AR_MODEL_DIR": "/data/models/ablation-v2-2026-04/A_seed5/v0002"}, "concurrency": 4}
{"schema": "v1", "run_id": "fe687c535ffa", "event_id": "f592dd2633e7", "ts": 1777588682, "type": "proposal", "episode_id": "fe687c535ffa", "iter": 3, "params": {"learning_rate": 5e-05, "max_steps": 80, "num_generations": 3, "temperature": 0.9, "lora_rank": 4, "AR_MODEL_DIR": "/data/models/ablation-v2-2026-04/A_seed5/v0003"}, "concurrency": 4}
{"schema": "v1", "run_id": "fe687c535ffa", "event_id": "f678306cd06e", "ts": 1777588913, "type": "iteration", "episode_id": "fe687c535ffa", "iter": 0, "status": "ok", "decision": "keep", "metrics": {"rank": 4.0, "eval_score": 0.521818, "decision_accuracy": 0.227273, "json_compliance": 0.963636, "loss": 0.00148, "training_seconds": 90.2}, "params": {"learning_rate": 5e-05, "max_steps": 30, "num_generations": 2, "temperature": 0.7, "lora_rank": 4, "AR_MODEL_DIR": "/data/models/ablation-v2-2026-04/A_seed5/v0000"}, "elapsed_s": 209.0641803513281, "concurrency": 4}
{"schema": "v1", "run_id": "fe687c535ffa", "event_id": "9f0332df7ff0", "ts": 1777588916, "type": "proposal", "episode_id": "fe687c535ffa", "iter": 4, "params": {"learning_rate": 0.0003, "max_steps": 50, "num_generations": 3, "temperature": 0.9, "lora_rank": 8, "AR_MODEL_DIR": "/data/models/ablation-v2-2026-04/A_seed5/v0004"}, "concurrency": 4}
{"schema": "v1", "run_id": "fe687c535ffa", "event_id": "62481d8cdf6b", "ts": 1777589010, "type": "proposal", "episode_id": "fe687c535ffa", "iter": 5, "params": {"learning_rate": 0.0001, "max_steps": 80, "num_generations": 2, "temperature": 0.7, "lora_rank": 16, "AR_MODEL_DIR": "/data/models/ablation-v2-2026-04/A_seed5/v0005"}, "concurrency": 4}
{"schema": "v1", "run_id": "fe687c535ffa", "event_id": "4112d468eac9", "ts": 1777589057, "type": "proposal", "episode_id": "fe687c535ffa", "iter": 6, "params": {"learning_rate": 0.0003, "max_steps": 50, "num_generations": 3, "temperature": 0.9, "lora_rank": 8, "AR_MODEL_DIR": "/data/models/ablation-v2-2026-04/A_seed5/v0006"}, "concurrency": 4}
{"schema": "v1", "run_id": "fe687c535ffa", "event_id": "82f8be803260", "ts": 1777589129, "type": "iteration", "episode_id": "fe687c535ffa", "iter": 1, "status": "ok", "decision": "keep", "metrics": {"rank": 16.0, "eval_score": 0.555455, "decision_accuracy": 0.209091, "json_compliance": 0.890909, "loss": 0.01736, "training_seconds": 298.4}, "params": {"learning_rate": 0.0003, "max_steps": 80, "num_generations": 3, "temperature": 0.9, "lora_rank": 16, "AR_MODEL_DIR": "/data/models/ablation-v2-2026-04/A_seed5/v0001"}, "elapsed_s": 435.95460301591083, "concurrency": 4}
{"schema": "v1", "run_id": "fe687c535ffa", "event_id": "581108950c1a", "ts": 1777589143, "type": "proposal", "episode_id": "fe687c535ffa", "iter": 7, "params": {"learning_rate": 0.0001, "max_steps": 50, "num_generations": 2, "temperature": 0.7, "lora_rank": 8, "AR_MODEL_DIR": "/data/models/ablation-v2-2026-04/A_seed5/v0007"}, "concurrency": 4}
{"schema": "v1", "run_id": "fe687c535ffa", "event_id": "2542dc0e0893", "ts": 1777589143, "type": "iteration", "episode_id": "fe687c535ffa", "iter": 2, "status": "ok", "decision": "discard", "metrics": {"rank": 8.0, "eval_score": 0.525455, "decision_accuracy": 0.209091, "json_compliance": 0.963636, "loss": 0.000929, "training_seconds": 131.0}, "params": {"learning_rate": 0.0001, "max_steps": 50, "num_generations": 2, "temperature": 0.7, "lora_rank": 8, "AR_MODEL_DIR": "/data/models/ablation-v2-2026-04/A_seed5/v0002"}, "elapsed_s": 251.13782532326877, "concurrency": 4}
{"schema": "v1", "run_id": "fe687c535ffa", "event_id": "a741433d6091", "ts": 1777589143, "type": "iteration", "episode_id": "fe687c535ffa", "iter": 3, "status": "ok", "decision": "discard", "metrics": {"rank": 4.0, "eval_score": 0.526364, "decision_accuracy": 0.2, "json_compliance": 0.945455, "loss": 0.003348, "training_seconds": 236.0}, "params": {"learning_rate": 5e-05, "max_steps": 80, "num_generations": 3, "temperature": 0.9, "lora_rank": 4, "AR_MODEL_DIR": "/data/models/ablation-v2-2026-04/A_seed5/v0003"}, "elapsed_s": 351.57154186069965, "concurrency": 4}
{"schema": "v1", "run_id": "fe687c535ffa", "event_id": "53d2b7674306", "ts": 1777589168, "type": "iteration", "episode_id": "fe687c535ffa", "iter": 4, "status": "ok", "decision": "keep", "metrics": {"rank": 8.0, "eval_score": 0.615455, "decision_accuracy": 0.209091, "json_compliance": 0.990909, "loss": 0.008291, "training_seconds": 91.2}, "params": {"learning_rate": 0.0003, "max_steps": 50, "num_generations": 3, "temperature": 0.9, "lora_rank": 8, "AR_MODEL_DIR": "/data/models/ablation-v2-2026-04/A_seed5/v0004"}, "elapsed_s": 237.9650873541832, "concurrency": 4}
{"schema": "v1", "run_id": "fe687c535ffa", "event_id": "d7b56c66c025", "ts": 1777589387, "type": "iteration", "episode_id": "fe687c535ffa", "iter": 5, "status": "ok", "decision": "discard", "metrics": {"rank": 16.0, "eval_score": 0.525455, "decision_accuracy": 0.2, "json_compliance": 0.954545, "loss": 0.001386, "training_seconds": 197.6}, "params": {"learning_rate": 0.0001, "max_steps": 80, "num_generations": 2, "temperature": 0.7, "lora_rank": 16, "AR_MODEL_DIR": "/data/models/ablation-v2-2026-04/A_seed5/v0005"}, "elapsed_s": 311.935881849844, "concurrency": 4}
{"schema": "v1", "run_id": "fe687c535ffa", "event_id": "2f96e265bcd5", "ts": 1777589518, "type": "iteration", "episode_id": "fe687c535ffa", "iter": 6, "status": "ok", "decision": "discard", "metrics": {"rank": 8.0, "eval_score": 0.512727, "decision_accuracy": 0.2, "json_compliance": 0.945455, "loss": 0.016299, "training_seconds": 254.9}, "params": {"learning_rate": 0.0003, "max_steps": 50, "num_generations": 3, "temperature": 0.9, "lora_rank": 8, "AR_MODEL_DIR": "/data/models/ablation-v2-2026-04/A_seed5/v0006"}, "elapsed_s": 450.59987106500193, "concurrency": 4}
{"schema": "v1", "run_id": "fe687c535ffa", "event_id": "aba5d9e0604d", "ts": 1777589518, "type": "iteration", "episode_id": "fe687c535ffa", "iter": 7, "status": "ok", "decision": "discard", "metrics": {"rank": 8.0, "eval_score": 0.501818, "decision_accuracy": 0.209091, "json_compliance": 0.963636, "loss": 0.001023, "training_seconds": 135.7}, "params": {"learning_rate": 0.0001, "max_steps": 50, "num_generations": 2, "temperature": 0.7, "lora_rank": 8, "AR_MODEL_DIR": "/data/models/ablation-v2-2026-04/A_seed5/v0007"}, "elapsed_s": 299.31846639188007, "concurrency": 4}
{"schema": "v1", "run_id": "fe687c535ffa", "event_id": "eb3aaf51224d", "ts": 1777589518, "type": "episode_summary", "episode_id": "fe687c535ffa", "mean": 0.535568375, "median": 0.525455, "min": 0.501818, "max": 0.615455, "stdev": 0.03569017666344419, "count": 8, "trend_slope": -0.003149392857142843}
