{"schema": "v1", "run_id": "87e19991011d", "event_id": "89dbebb7eab6", "ts": 1777585828, "type": "proposal", "episode_id": "87e19991011d", "iter": 0, "params": {"learning_rate": 5e-05, "max_steps": 50, "num_generations": 2, "temperature": 0.9, "lora_rank": 8, "AR_MODEL_DIR": "/data/models/ablation-v2-2026-04/A_seed4/v0000"}, "concurrency": 4}
{"schema": "v1", "run_id": "87e19991011d", "event_id": "37d365ec8189", "ts": 1777585828, "type": "proposal", "episode_id": "87e19991011d", "iter": 1, "params": {"learning_rate": 5e-05, "max_steps": 30, "num_generations": 2, "temperature": 0.7, "lora_rank": 8, "AR_MODEL_DIR": "/data/models/ablation-v2-2026-04/A_seed4/v0001"}, "concurrency": 4}
{"schema": "v1", "run_id": "87e19991011d", "event_id": "478fe1cedbca", "ts": 1777585828, "type": "proposal", "episode_id": "87e19991011d", "iter": 2, "params": {"learning_rate": 0.0003, "max_steps": 50, "num_generations": 2, "temperature": 0.7, "lora_rank": 16, "AR_MODEL_DIR": "/data/models/ablation-v2-2026-04/A_seed4/v0002"}, "concurrency": 4}
{"schema": "v1", "run_id": "87e19991011d", "event_id": "9ab41c061f87", "ts": 1777585828, "type": "proposal", "episode_id": "87e19991011d", "iter": 3, "params": {"learning_rate": 0.0003, "max_steps": 50, "num_generations": 3, "temperature": 0.7, "lora_rank": 4, "AR_MODEL_DIR": "/data/models/ablation-v2-2026-04/A_seed4/v0003"}, "concurrency": 4}
{"schema": "v1", "run_id": "87e19991011d", "event_id": "5f002f57d87f", "ts": 1777586358, "type": "proposal", "episode_id": "87e19991011d", "iter": 4, "params": {"learning_rate": 0.0001, "max_steps": 30, "num_generations": 2, "temperature": 0.9, "lora_rank": 8, "AR_MODEL_DIR": "/data/models/ablation-v2-2026-04/A_seed4/v0004"}, "concurrency": 4}
{"schema": "v1", "run_id": "87e19991011d", "event_id": "38a910442d01", "ts": 1777586358, "type": "iteration", "episode_id": "87e19991011d", "iter": 0, "status": "ok", "decision": "keep", "metrics": {"rank": 8.0, "eval_score": 0.504545, "decision_accuracy": 0.2, "json_compliance": 0.954545, "loss": 0.001993, "training_seconds": 143.6}, "params": {"learning_rate": 5e-05, "max_steps": 50, "num_generations": 2, "temperature": 0.9, "lora_rank": 8, "AR_MODEL_DIR": "/data/models/ablation-v2-2026-04/A_seed4/v0000"}, "elapsed_s": 403.23260271921754, "concurrency": 4}
{"schema": "v1", "run_id": "87e19991011d", "event_id": "3559029256ce", "ts": 1777586404, "type": "proposal", "episode_id": "87e19991011d", "iter": 5, "params": {"learning_rate": 0.0003, "max_steps": 80, "num_generations": 3, "temperature": 0.7, "lora_rank": 16, "AR_MODEL_DIR": "/data/models/ablation-v2-2026-04/A_seed4/v0005"}, "concurrency": 4}
{"schema": "v1", "run_id": "87e19991011d", "event_id": "2deb3ca52dbc", "ts": 1777586404, "type": "proposal", "episode_id": "87e19991011d", "iter": 6, "params": {"learning_rate": 0.0001, "max_steps": 30, "num_generations": 2, "temperature": 0.9, "lora_rank": 4, "AR_MODEL_DIR": "/data/models/ablation-v2-2026-04/A_seed4/v0006"}, "concurrency": 4}
{"schema": "v1", "run_id": "87e19991011d", "event_id": "0971e5641347", "ts": 1777586405, "type": "iteration", "episode_id": "87e19991011d", "iter": 1, "status": "ok", "decision": "keep", "metrics": {"rank": 8.0, "eval_score": 0.524545, "decision_accuracy": 0.209091, "json_compliance": 0.963636, "loss": 0.000876, "training_seconds": 100.9}, "params": {"learning_rate": 5e-05, "max_steps": 30, "num_generations": 2, "temperature": 0.7, "lora_rank": 8, "AR_MODEL_DIR": "/data/models/ablation-v2-2026-04/A_seed4/v0001"}, "elapsed_s": 228.45627808524296, "concurrency": 4}
{"schema": "v1", "run_id": "87e19991011d", "event_id": "0b71a65eacba", "ts": 1777586405, "type": "iteration", "episode_id": "87e19991011d", "iter": 2, "status": "ok", "decision": "keep", "metrics": {"rank": 16.0, "eval_score": 0.559273, "decision_accuracy": 0.2, "json_compliance": 0.963636, "loss": 0.002671, "training_seconds": 132.3}, "params": {"learning_rate": 0.0003, "max_steps": 50, "num_generations": 2, "temperature": 0.7, "lora_rank": 16, "AR_MODEL_DIR": "/data/models/ablation-v2-2026-04/A_seed4/v0002"}, "elapsed_s": 270.6547528738156, "concurrency": 4}
{"schema": "v1", "run_id": "87e19991011d", "event_id": "4685310d51b9", "ts": 1777586502, "type": "iteration", "episode_id": "87e19991011d", "iter": 3, "status": "ok", "decision": "discard", "metrics": {"rank": 4.0, "eval_score": 0.517273, "decision_accuracy": 0.2, "json_compliance": 0.954545, "loss": 0.010241, "training_seconds": 263.0}, "params": {"learning_rate": 0.0003, "max_steps": 50, "num_generations": 3, "temperature": 0.7, "lora_rank": 4, "AR_MODEL_DIR": "/data/models/ablation-v2-2026-04/A_seed4/v0003"}, "elapsed_s": 657.060209156014, "concurrency": 4}
{"schema": "v1", "run_id": "87e19991011d", "event_id": "1e244c4a1d71", "ts": 1777586561, "type": "proposal", "episode_id": "87e19991011d", "iter": 7, "params": {"learning_rate": 0.0001, "max_steps": 80, "num_generations": 3, "temperature": 0.9, "lora_rank": 16, "AR_MODEL_DIR": "/data/models/ablation-v2-2026-04/A_seed4/v0007"}, "concurrency": 4}
{"schema": "v1", "run_id": "87e19991011d", "event_id": "80aac295a1b9", "ts": 1777586595, "type": "iteration", "episode_id": "87e19991011d", "iter": 4, "status": "ok", "decision": "discard", "metrics": {"rank": 8.0, "eval_score": 0.520909, "decision_accuracy": 0.209091, "json_compliance": 0.954545, "loss": 0.004146, "training_seconds": 110.2}, "params": {"learning_rate": 0.0001, "max_steps": 30, "num_generations": 2, "temperature": 0.9, "lora_rank": 8, "AR_MODEL_DIR": "/data/models/ablation-v2-2026-04/A_seed4/v0004"}, "elapsed_s": 225.79828447988257, "concurrency": 4}
{"schema": "v1", "run_id": "87e19991011d", "event_id": "c5c4a3d697b2", "ts": 1777586819, "type": "iteration", "episode_id": "87e19991011d", "iter": 5, "status": "ok", "decision": "discard", "metrics": {"rank": 16.0, "eval_score": 0.392727, "decision_accuracy": 0.190909, "json_compliance": 0.927273, "loss": 0.0105, "training_seconds": 237.8}, "params": {"learning_rate": 0.0003, "max_steps": 80, "num_generations": 3, "temperature": 0.7, "lora_rank": 16, "AR_MODEL_DIR": "/data/models/ablation-v2-2026-04/A_seed4/v0005"}, "elapsed_s": 371.8683251477778, "concurrency": 4}
{"schema": "v1", "run_id": "87e19991011d", "event_id": "1458a9e1273a", "ts": 1777586819, "type": "iteration", "episode_id": "87e19991011d", "iter": 6, "status": "ok", "decision": "discard", "metrics": {"rank": 4.0, "eval_score": 0.504545, "decision_accuracy": 0.209091, "json_compliance": 0.963636, "loss": 0.004179, "training_seconds": 95.9}, "params": {"learning_rate": 0.0001, "max_steps": 30, "num_generations": 2, "temperature": 0.9, "lora_rank": 4, "AR_MODEL_DIR": "/data/models/ablation-v2-2026-04/A_seed4/v0006"}, "elapsed_s": 230.16529868822545, "concurrency": 4}
{"schema": "v1", "run_id": "87e19991011d", "event_id": "f5b989c54175", "ts": 1777586992, "type": "iteration", "episode_id": "87e19991011d", "iter": 7, "status": "ok", "decision": "discard", "metrics": {"rank": 16.0, "eval_score": 0.409091, "decision_accuracy": 0.2, "json_compliance": 0.963636, "loss": 0.006101, "training_seconds": 276.5}, "params": {"learning_rate": 0.0001, "max_steps": 80, "num_generations": 3, "temperature": 0.9, "lora_rank": 16, "AR_MODEL_DIR": "/data/models/ablation-v2-2026-04/A_seed4/v0007"}, "elapsed_s": 412.3855961081572, "concurrency": 4}
{"schema": "v1", "run_id": "87e19991011d", "event_id": "fb5f0c92ab69", "ts": 1777586992, "type": "episode_summary", "episode_id": "87e19991011d", "mean": 0.4916135, "median": 0.5109090000000001, "min": 0.392727, "max": 0.559273, "stdev": 0.05867815140480923, "count": 8, "trend_slope": -0.0150497619047619}
