{"schema": "v1", "run_id": "40b8d50b1730", "event_id": "25b866d24da2", "ts": 1777570299, "type": "proposal", "episode_id": "40b8d50b1730", "iter": 0, "params": {"learning_rate": 0.0001, "max_steps": 30, "num_generations": 3, "temperature": 0.7, "lora_rank": 4, "AR_MODEL_DIR": "/data/models/repro-2026-04/v0000"}, "concurrency": 4}
{"schema": "v1", "run_id": "40b8d50b1730", "event_id": "436a0b84afaf", "ts": 1777570299, "type": "proposal", "episode_id": "40b8d50b1730", "iter": 1, "params": {"learning_rate": 0.0003, "max_steps": 30, "num_generations": 3, "temperature": 0.7, "lora_rank": 16, "AR_MODEL_DIR": "/data/models/repro-2026-04/v0001"}, "concurrency": 4}
{"schema": "v1", "run_id": "40b8d50b1730", "event_id": "5b8f90b18462", "ts": 1777570299, "type": "proposal", "episode_id": "40b8d50b1730", "iter": 2, "params": {"learning_rate": 5e-05, "max_steps": 30, "num_generations": 2, "temperature": 0.9, "lora_rank": 8, "AR_MODEL_DIR": "/data/models/repro-2026-04/v0002"}, "concurrency": 4}
{"schema": "v1", "run_id": "40b8d50b1730", "event_id": "1d1dd7f6d5ad", "ts": 1777570299, "type": "proposal", "episode_id": "40b8d50b1730", "iter": 3, "params": {"learning_rate": 5e-05, "max_steps": 30, "num_generations": 2, "temperature": 0.9, "lora_rank": 4, "AR_MODEL_DIR": "/data/models/repro-2026-04/v0003"}, "concurrency": 4}
{"schema": "v1", "run_id": "40b8d50b1730", "event_id": "967d8056f63b", "ts": 1777570880, "type": "iteration", "episode_id": "40b8d50b1730", "iter": 0, "status": "ok", "decision": "keep", "metrics": {"rank": 4.0, "eval_score": 0.423636, "decision_accuracy": 0.209091, "json_compliance": 0.963636, "loss": 0.003463, "training_seconds": 125.8}, "params": {"learning_rate": 0.0001, "max_steps": 30, "num_generations": 3, "temperature": 0.7, "lora_rank": 4, "AR_MODEL_DIR": "/data/models/repro-2026-04/v0000"}, "elapsed_s": 569.0844677072018, "concurrency": 4}
{"schema": "v1", "run_id": "40b8d50b1730", "event_id": "f8f064c225aa", "ts": 1777571122, "type": "iteration", "episode_id": "40b8d50b1730", "iter": 1, "status": "failed", "decision": "discard", "metrics": {}, "params": {"learning_rate": 0.0003, "max_steps": 30, "num_generations": 3, "temperature": 0.7, "lora_rank": 16, "AR_MODEL_DIR": "/data/models/repro-2026-04/v0001"}, "elapsed_s": 822.6737550110556, "concurrency": 4}
{"schema": "v1", "run_id": "40b8d50b1730", "event_id": "fd18a783cc3d", "ts": 1777571344, "type": "iteration", "episode_id": "40b8d50b1730", "iter": 2, "status": "ok", "decision": "keep", "metrics": {"rank": 8.0, "eval_score": 0.521818, "decision_accuracy": 0.209091, "json_compliance": 0.963636, "loss": 0.001292, "training_seconds": 79.8}, "params": {"learning_rate": 5e-05, "max_steps": 30, "num_generations": 2, "temperature": 0.9, "lora_rank": 8, "AR_MODEL_DIR": "/data/models/repro-2026-04/v0002"}, "elapsed_s": 1034.3777352739125, "concurrency": 4}
{"schema": "v1", "run_id": "40b8d50b1730", "event_id": "f72de937e3ce", "ts": 1777571344, "type": "iteration", "episode_id": "40b8d50b1730", "iter": 3, "status": "ok", "decision": "discard", "metrics": {"rank": 4.0, "eval_score": 0.515455, "decision_accuracy": 0.209091, "json_compliance": 0.963636, "loss": 0.001177, "training_seconds": 94.7}, "params": {"learning_rate": 5e-05, "max_steps": 30, "num_generations": 2, "temperature": 0.9, "lora_rank": 4, "AR_MODEL_DIR": "/data/models/repro-2026-04/v0003"}, "elapsed_s": 949.1062137079425, "concurrency": 4}
{"schema": "v1", "run_id": "40b8d50b1730", "event_id": "4af53e7c974a", "ts": 1777571344, "type": "episode_summary", "episode_id": "40b8d50b1730", "mean": 0.4869696666666667, "median": 0.515455, "min": 0.423636, "max": 0.521818, "stdev": 0.054940758479778314, "count": 3, "trend_slope": 0.04590950000000005}
