{"schema": "v1", "run_id": "286f9a5a62ac", "event_id": "c83311635862", "ts": 1777582961, "type": "proposal", "episode_id": "286f9a5a62ac", "iter": 0, "params": {"learning_rate": 5e-05, "max_steps": 30, "num_generations": 2, "temperature": 0.7, "lora_rank": 4, "AR_MODEL_DIR": "/data/models/ablation-v2-2026-04/A_seed3/v0000"}, "concurrency": 4}
{"schema": "v1", "run_id": "286f9a5a62ac", "event_id": "e6037c068679", "ts": 1777582961, "type": "proposal", "episode_id": "286f9a5a62ac", "iter": 1, "params": {"learning_rate": 0.0001, "max_steps": 50, "num_generations": 3, "temperature": 0.9, "lora_rank": 8, "AR_MODEL_DIR": "/data/models/ablation-v2-2026-04/A_seed3/v0001"}, "concurrency": 4}
{"schema": "v1", "run_id": "286f9a5a62ac", "event_id": "aed500a65778", "ts": 1777582961, "type": "proposal", "episode_id": "286f9a5a62ac", "iter": 2, "params": {"learning_rate": 0.0003, "max_steps": 80, "num_generations": 2, "temperature": 0.7, "lora_rank": 16, "AR_MODEL_DIR": "/data/models/ablation-v2-2026-04/A_seed3/v0002"}, "concurrency": 4}
{"schema": "v1", "run_id": "286f9a5a62ac", "event_id": "507599215ede", "ts": 1777582961, "type": "proposal", "episode_id": "286f9a5a62ac", "iter": 3, "params": {"learning_rate": 5e-05, "max_steps": 50, "num_generations": 3, "temperature": 0.9, "lora_rank": 16, "AR_MODEL_DIR": "/data/models/ablation-v2-2026-04/A_seed3/v0003"}, "concurrency": 4}
{"schema": "v1", "run_id": "286f9a5a62ac", "event_id": "396fd11e24ce", "ts": 1777583902, "type": "proposal", "episode_id": "286f9a5a62ac", "iter": 4, "params": {"learning_rate": 5e-05, "max_steps": 80, "num_generations": 2, "temperature": 0.9, "lora_rank": 16, "AR_MODEL_DIR": "/data/models/ablation-v2-2026-04/A_seed3/v0004"}, "concurrency": 4}
{"schema": "v1", "run_id": "286f9a5a62ac", "event_id": "3208cd676de7", "ts": 1777583902, "type": "iteration", "episode_id": "286f9a5a62ac", "iter": 0, "status": "ok", "decision": "keep", "metrics": {"rank": 4.0, "eval_score": 0.52, "decision_accuracy": 0.218182, "json_compliance": 0.963636, "loss": 0.003519, "training_seconds": 74.0}, "params": {"learning_rate": 5e-05, "max_steps": 30, "num_generations": 2, "temperature": 0.7, "lora_rank": 4, "AR_MODEL_DIR": "/data/models/ablation-v2-2026-04/A_seed3/v0000"}, "elapsed_s": 685.1008388758637, "concurrency": 4}
{"schema": "v1", "run_id": "286f9a5a62ac", "event_id": "feb0a9db20b4", "ts": 1777583978, "type": "proposal", "episode_id": "286f9a5a62ac", "iter": 5, "params": {"learning_rate": 0.0001, "max_steps": 50, "num_generations": 3, "temperature": 0.9, "lora_rank": 8, "AR_MODEL_DIR": "/data/models/ablation-v2-2026-04/A_seed3/v0005"}, "concurrency": 4}
{"schema": "v1", "run_id": "286f9a5a62ac", "event_id": "95f41681f8cf", "ts": 1777583978, "type": "proposal", "episode_id": "286f9a5a62ac", "iter": 6, "params": {"learning_rate": 0.0003, "max_steps": 80, "num_generations": 2, "temperature": 0.7, "lora_rank": 16, "AR_MODEL_DIR": "/data/models/ablation-v2-2026-04/A_seed3/v0006"}, "concurrency": 4}
{"schema": "v1", "run_id": "286f9a5a62ac", "event_id": "20f2671a6143", "ts": 1777583978, "type": "proposal", "episode_id": "286f9a5a62ac", "iter": 7, "params": {"learning_rate": 5e-05, "max_steps": 30, "num_generations": 3, "temperature": 0.9, "lora_rank": 4, "AR_MODEL_DIR": "/data/models/ablation-v2-2026-04/A_seed3/v0007"}, "concurrency": 4}
{"schema": "v1", "run_id": "286f9a5a62ac", "event_id": "a1340147ae3e", "ts": 1777583978, "type": "iteration", "episode_id": "286f9a5a62ac", "iter": 1, "status": "ok", "decision": "discard", "metrics": {"rank": 8.0, "eval_score": 0.406364, "decision_accuracy": 0.2, "json_compliance": 0.954545, "loss": 0.002207, "training_seconds": 136.1}, "params": {"learning_rate": 0.0001, "max_steps": 50, "num_generations": 3, "temperature": 0.9, "lora_rank": 8, "AR_MODEL_DIR": "/data/models/ablation-v2-2026-04/A_seed3/v0001"}, "elapsed_s": 624.8711334164254, "concurrency": 4}
{"schema": "v1", "run_id": "286f9a5a62ac", "event_id": "9d5490815f09", "ts": 1777583978, "type": "iteration", "episode_id": "286f9a5a62ac", "iter": 2, "status": "ok", "decision": "keep", "metrics": {"rank": 16.0, "eval_score": 0.552727, "decision_accuracy": 0.2, "json_compliance": 0.954545, "loss": 0.000708, "training_seconds": 120.6}, "params": {"learning_rate": 0.0003, "max_steps": 80, "num_generations": 2, "temperature": 0.7, "lora_rank": 16, "AR_MODEL_DIR": "/data/models/ablation-v2-2026-04/A_seed3/v0002"}, "elapsed_s": 740.4057122510858, "concurrency": 4}
{"schema": "v1", "run_id": "286f9a5a62ac", "event_id": "c381e45add23", "ts": 1777583978, "type": "iteration", "episode_id": "286f9a5a62ac", "iter": 3, "status": "ok", "decision": "discard", "metrics": {"rank": 16.0, "eval_score": 0.459091, "decision_accuracy": 0.209091, "json_compliance": 0.963636, "loss": 0.006754, "training_seconds": 139.8}, "params": {"learning_rate": 5e-05, "max_steps": 50, "num_generations": 3, "temperature": 0.9, "lora_rank": 16, "AR_MODEL_DIR": "/data/models/ablation-v2-2026-04/A_seed3/v0003"}, "elapsed_s": 646.9653684692457, "concurrency": 4}
{"schema": "v1", "run_id": "286f9a5a62ac", "event_id": "ee8e2195a3a5", "ts": 1777584335, "type": "iteration", "episode_id": "286f9a5a62ac", "iter": 4, "status": "ok", "decision": "discard", "metrics": {"rank": 16.0, "eval_score": 0.525455, "decision_accuracy": 0.2, "json_compliance": 0.954545, "loss": 0.001826, "training_seconds": 180.0}, "params": {"learning_rate": 5e-05, "max_steps": 80, "num_generations": 2, "temperature": 0.9, "lora_rank": 16, "AR_MODEL_DIR": "/data/models/ablation-v2-2026-04/A_seed3/v0004"}, "elapsed_s": 418.49295295309275, "concurrency": 4}
{"schema": "v1", "run_id": "286f9a5a62ac", "event_id": "9b831f9be8ed", "ts": 1777584335, "type": "iteration", "episode_id": "286f9a5a62ac", "iter": 5, "status": "ok", "decision": "discard", "metrics": {"rank": 8.0, "eval_score": 0.424545, "decision_accuracy": 0.2, "json_compliance": 0.963636, "loss": 0.00283, "training_seconds": 162.7}, "params": {"learning_rate": 0.0001, "max_steps": 50, "num_generations": 3, "temperature": 0.9, "lora_rank": 8, "AR_MODEL_DIR": "/data/models/ablation-v2-2026-04/A_seed3/v0005"}, "elapsed_s": 270.575935699977, "concurrency": 4}
{"schema": "v1", "run_id": "286f9a5a62ac", "event_id": "55a7fc7f43e5", "ts": 1777584388, "type": "iteration", "episode_id": "286f9a5a62ac", "iter": 6, "status": "ok", "decision": "discard", "metrics": {"rank": 16.0, "eval_score": 0.520909, "decision_accuracy": 0.209091, "json_compliance": 0.954545, "loss": 0.000355, "training_seconds": 167.5}, "params": {"learning_rate": 0.0003, "max_steps": 80, "num_generations": 2, "temperature": 0.7, "lora_rank": 16, "AR_MODEL_DIR": "/data/models/ablation-v2-2026-04/A_seed3/v0006"}, "elapsed_s": 378.71851210901514, "concurrency": 4}
{"schema": "v1", "run_id": "286f9a5a62ac", "event_id": "e6a0f170e8e2", "ts": 1777584388, "type": "iteration", "episode_id": "286f9a5a62ac", "iter": 7, "status": "ok", "decision": "discard", "metrics": {"rank": 4.0, "eval_score": 0.519091, "decision_accuracy": 0.2, "json_compliance": 0.963636, "loss": 0.0047, "training_seconds": 122.6}, "params": {"learning_rate": 5e-05, "max_steps": 30, "num_generations": 3, "temperature": 0.9, "lora_rank": 4, "AR_MODEL_DIR": "/data/models/ablation-v2-2026-04/A_seed3/v0007"}, "elapsed_s": 316.6985429371707, "concurrency": 4}
{"schema": "v1", "run_id": "286f9a5a62ac", "event_id": "440d731b47e9", "ts": 1777584388, "type": "episode_summary", "episode_id": "286f9a5a62ac", "mean": 0.49102275, "median": 0.5195455, "min": 0.406364, "max": 0.552727, "stdev": 0.05361199463006655, "count": 8, "trend_slope": 0.002954523809523826}
