{"schema": "v1", "run_id": "0604a564254d", "event_id": "f7a940e34547", "ts": 1777578278, "type": "proposal", "episode_id": "0604a564254d", "iter": 0, "params": {"learning_rate": 5e-05, "max_steps": 80, "num_generations": 2, "temperature": 0.9, "lora_rank": 4, "AR_MODEL_DIR": "/data/models/ablation-v2-2026-04/B_seed1/v0000"}, "concurrency": 4}
{"schema": "v1", "run_id": "0604a564254d", "event_id": "8367f3804b5a", "ts": 1777578278, "type": "proposal", "episode_id": "0604a564254d", "iter": 1, "params": {"learning_rate": 0.0001, "max_steps": 50, "num_generations": 3, "temperature": 0.9, "lora_rank": 4, "AR_MODEL_DIR": "/data/models/ablation-v2-2026-04/B_seed1/v0001"}, "concurrency": 4}
{"schema": "v1", "run_id": "0604a564254d", "event_id": "d5c2460e8fdc", "ts": 1777578278, "type": "proposal", "episode_id": "0604a564254d", "iter": 2, "params": {"learning_rate": 5e-05, "max_steps": 50, "num_generations": 2, "temperature": 0.9, "lora_rank": 8, "AR_MODEL_DIR": "/data/models/ablation-v2-2026-04/B_seed1/v0002"}, "concurrency": 4}
{"schema": "v1", "run_id": "0604a564254d", "event_id": "fe7e44d9e682", "ts": 1777578278, "type": "proposal", "episode_id": "0604a564254d", "iter": 3, "params": {"learning_rate": 0.0003, "max_steps": 30, "num_generations": 3, "temperature": 0.9, "lora_rank": 16, "AR_MODEL_DIR": "/data/models/ablation-v2-2026-04/B_seed1/v0003"}, "concurrency": 4}
{"schema": "v1", "run_id": "0604a564254d", "event_id": "b8094759c0d9", "ts": 1777578911, "type": "proposal", "episode_id": "0604a564254d", "iter": 4, "params": {"learning_rate": 5e-05, "max_steps": 80, "num_generations": 2, "temperature": 0.9, "lora_rank": 4, "AR_MODEL_DIR": "/data/models/ablation-v2-2026-04/B_seed1/v0004"}, "concurrency": 4}
{"schema": "v1", "run_id": "0604a564254d", "event_id": "3b9e93de2e86", "ts": 1777578911, "type": "iteration", "episode_id": "0604a564254d", "iter": 0, "status": "ok", "decision": "keep", "metrics": {"rank": 4.0, "eval_score": 0.503636, "decision_accuracy": 0.2, "json_compliance": 0.945455, "loss": 0.000803, "training_seconds": 90.7}, "params": {"learning_rate": 5e-05, "max_steps": 80, "num_generations": 2, "temperature": 0.9, "lora_rank": 4, "AR_MODEL_DIR": "/data/models/ablation-v2-2026-04/B_seed1/v0000"}, "elapsed_s": 616.5289247869514, "concurrency": 4}
{"schema": "v1", "run_id": "0604a564254d", "event_id": "8f50cb72714b", "ts": 1777579180, "type": "proposal", "episode_id": "0604a564254d", "iter": 5, "params": {"learning_rate": 5e-05, "max_steps": 30, "num_generations": 2, "temperature": 0.9, "lora_rank": 16, "AR_MODEL_DIR": "/data/models/ablation-v2-2026-04/B_seed1/v0005"}, "concurrency": 4}
{"schema": "v1", "run_id": "0604a564254d", "event_id": "a1c5a3e0ae1a", "ts": 1777579180, "type": "iteration", "episode_id": "0604a564254d", "iter": 1, "status": "ok", "decision": "discard", "metrics": {"rank": 4.0, "eval_score": 0.43, "decision_accuracy": 0.2, "json_compliance": 0.972727, "loss": 0.002633, "training_seconds": 161.4}, "params": {"learning_rate": 0.0001, "max_steps": 50, "num_generations": 3, "temperature": 0.9, "lora_rank": 4, "AR_MODEL_DIR": "/data/models/ablation-v2-2026-04/B_seed1/v0001"}, "elapsed_s": 356.82292064093053, "concurrency": 4}
{"schema": "v1", "run_id": "0604a564254d", "event_id": "58872be578a8", "ts": 1777579461, "type": "proposal", "episode_id": "0604a564254d", "iter": 6, "params": {"learning_rate": 5e-05, "max_steps": 50, "num_generations": 2, "temperature": 0.7, "lora_rank": 8, "AR_MODEL_DIR": "/data/models/ablation-v2-2026-04/B_seed1/v0006"}, "concurrency": 4}
{"schema": "v1", "run_id": "0604a564254d", "event_id": "b1d2647349fa", "ts": 1777579461, "type": "proposal", "episode_id": "0604a564254d", "iter": 7, "params": {"learning_rate": 0.0001, "max_steps": 80, "num_generations": 2, "temperature": 0.9, "lora_rank": 4, "AR_MODEL_DIR": "/data/models/ablation-v2-2026-04/B_seed1/v0007"}, "concurrency": 4}
{"schema": "v1", "run_id": "0604a564254d", "event_id": "d9fad6b689b3", "ts": 1777579461, "type": "iteration", "episode_id": "0604a564254d", "iter": 2, "status": "ok", "decision": "keep", "metrics": {"rank": 8.0, "eval_score": 0.520455, "decision_accuracy": 0.209091, "json_compliance": 0.963636, "loss": 0.002889, "training_seconds": 84.0}, "params": {"learning_rate": 5e-05, "max_steps": 50, "num_generations": 2, "temperature": 0.9, "lora_rank": 8, "AR_MODEL_DIR": "/data/models/ablation-v2-2026-04/B_seed1/v0002"}, "elapsed_s": 712.9952388796955, "concurrency": 4}
{"schema": "v1", "run_id": "0604a564254d", "event_id": "31d23e4f0942", "ts": 1777579461, "type": "iteration", "episode_id": "0604a564254d", "iter": 3, "status": "ok", "decision": "keep", "metrics": {"rank": 16.0, "eval_score": 0.551818, "decision_accuracy": 0.190909, "json_compliance": 0.918182, "loss": 0.015577, "training_seconds": 97.4}, "params": {"learning_rate": 0.0003, "max_steps": 30, "num_generations": 3, "temperature": 0.9, "lora_rank": 16, "AR_MODEL_DIR": "/data/models/ablation-v2-2026-04/B_seed1/v0003"}, "elapsed_s": 713.1544457329437, "concurrency": 4}
{"schema": "v1", "run_id": "0604a564254d", "event_id": "3bb926aeaa7d", "ts": 1777579461, "type": "iteration", "episode_id": "0604a564254d", "iter": 4, "status": "ok", "decision": "discard", "metrics": {"rank": 4.0, "eval_score": 0.524091, "decision_accuracy": 0.209091, "json_compliance": 0.963636, "loss": 0.002817, "training_seconds": 166.9}, "params": {"learning_rate": 5e-05, "max_steps": 80, "num_generations": 2, "temperature": 0.9, "lora_rank": 4, "AR_MODEL_DIR": "/data/models/ablation-v2-2026-04/B_seed1/v0004"}, "elapsed_s": 412.74774185195565, "concurrency": 4}
{"schema": "v1", "run_id": "0604a564254d", "event_id": "44e2a78284b8", "ts": 1777579461, "type": "iteration", "episode_id": "0604a564254d", "iter": 5, "status": "ok", "decision": "discard", "metrics": {"rank": 16.0, "eval_score": 0.513636, "decision_accuracy": 0.209091, "json_compliance": 0.963636, "loss": 0.004062, "training_seconds": 103.2}, "params": {"learning_rate": 5e-05, "max_steps": 30, "num_generations": 2, "temperature": 0.9, "lora_rank": 16, "AR_MODEL_DIR": "/data/models/ablation-v2-2026-04/B_seed1/v0005"}, "elapsed_s": 229.44060877384618, "concurrency": 4}
{"schema": "v1", "run_id": "0604a564254d", "event_id": "2f3fb0a874f1", "ts": 1777579722, "type": "iteration", "episode_id": "0604a564254d", "iter": 6, "status": "ok", "decision": "discard", "metrics": {"rank": 8.0, "eval_score": 0.505455, "decision_accuracy": 0.209091, "json_compliance": 0.963636, "loss": 0.0018, "training_seconds": 123.8}, "params": {"learning_rate": 5e-05, "max_steps": 50, "num_generations": 2, "temperature": 0.7, "lora_rank": 8, "AR_MODEL_DIR": "/data/models/ablation-v2-2026-04/B_seed1/v0006"}, "elapsed_s": 248.70577171072364, "concurrency": 4}
{"schema": "v1", "run_id": "0604a564254d", "event_id": "75416499fec0", "ts": 1777579913, "type": "iteration", "episode_id": "0604a564254d", "iter": 7, "status": "ok", "decision": "discard", "metrics": {"rank": 4.0, "eval_score": 0.548636, "decision_accuracy": 0.2, "json_compliance": 0.954545, "loss": 0.001992, "training_seconds": 179.9}, "params": {"learning_rate": 0.0001, "max_steps": 80, "num_generations": 2, "temperature": 0.9, "lora_rank": 4, "AR_MODEL_DIR": "/data/models/ablation-v2-2026-04/B_seed1/v0007"}, "elapsed_s": 398.55102349212393, "concurrency": 4}
{"schema": "v1", "run_id": "0604a564254d", "event_id": "1aa1fc91ac6b", "ts": 1777579913, "type": "episode_summary", "episode_id": "0604a564254d", "mean": 0.512215875, "median": 0.5170455, "min": 0.43, "max": 0.551818, "stdev": 0.03776704180494455, "count": 8, "trend_slope": 0.007667749999999952}
