{"schema": "v1", "run_id": "e92167e16168", "event_id": "627c7d54ee2e", "ts": 1777572419, "type": "proposal", "episode_id": "e92167e16168", "iter": 0, "params": {"learning_rate": 5e-05, "max_steps": 30, "num_generations": 2, "temperature": 0.7, "lora_rank": 4, "AR_MODEL_DIR": "/data/models/ablation-2026-04/A_seed1/v0000"}, "concurrency": 4}
{"schema": "v1", "run_id": "e92167e16168", "event_id": "3c4f29f63bba", "ts": 1777572419, "type": "proposal", "episode_id": "e92167e16168", "iter": 1, "params": {"learning_rate": 0.0003, "max_steps": 80, "num_generations": 3, "temperature": 0.9, "lora_rank": 16, "AR_MODEL_DIR": "/data/models/ablation-2026-04/A_seed1/v0001"}, "concurrency": 4}
{"schema": "v1", "run_id": "e92167e16168", "event_id": "f6fe46066a88", "ts": 1777572419, "type": "proposal", "episode_id": "e92167e16168", "iter": 2, "params": {"learning_rate": 0.0001, "max_steps": 50, "num_generations": 2, "temperature": 0.9, "lora_rank": 8, "AR_MODEL_DIR": "/data/models/ablation-2026-04/A_seed1/v0002"}, "concurrency": 4}
{"schema": "v1", "run_id": "e92167e16168", "event_id": "69c9bd384505", "ts": 1777572419, "type": "proposal", "episode_id": "e92167e16168", "iter": 3, "params": {"learning_rate": 5e-05, "max_steps": 80, "num_generations": 3, "temperature": 0.7, "lora_rank": 16, "AR_MODEL_DIR": "/data/models/ablation-2026-04/A_seed1/v0003"}, "concurrency": 4}
{"schema": "v1", "run_id": "e92167e16168", "event_id": "364059d5307e", "ts": 1777573376, "type": "iteration", "episode_id": "e92167e16168", "iter": 0, "status": "ok", "decision": "keep", "metrics": {"rank": 4.0, "eval_score": 0.520909, "decision_accuracy": 0.218182, "json_compliance": 0.963636, "loss": 0.001609, "training_seconds": 94.2}, "params": {"learning_rate": 5e-05, "max_steps": 30, "num_generations": 2, "temperature": 0.7, "lora_rank": 4, "AR_MODEL_DIR": "/data/models/ablation-2026-04/A_seed1/v0000"}, "elapsed_s": 933.3922060807236, "concurrency": 4}
{"schema": "v1", "run_id": "e92167e16168", "event_id": "e5adfb5f0946", "ts": 1777573376, "type": "iteration", "episode_id": "e92167e16168", "iter": 1, "status": "ok", "decision": "discard", "metrics": {"rank": 16.0, "eval_score": 0.422727, "decision_accuracy": 0.209091, "json_compliance": 0.990909, "loss": 0.006034, "training_seconds": 144.1}, "params": {"learning_rate": 0.0003, "max_steps": 80, "num_generations": 3, "temperature": 0.9, "lora_rank": 16, "AR_MODEL_DIR": "/data/models/ablation-2026-04/A_seed1/v0001"}, "elapsed_s": 879.0757442791946, "concurrency": 4}
{"schema": "v1", "run_id": "e92167e16168", "event_id": "08a8aa5d187e", "ts": 1777573376, "type": "iteration", "episode_id": "e92167e16168", "iter": 2, "status": "ok", "decision": "keep", "metrics": {"rank": 8.0, "eval_score": 0.525455, "decision_accuracy": 0.209091, "json_compliance": 0.963636, "loss": -0.000704, "training_seconds": 65.5}, "params": {"learning_rate": 0.0001, "max_steps": 50, "num_generations": 2, "temperature": 0.9, "lora_rank": 8, "AR_MODEL_DIR": "/data/models/ablation-2026-04/A_seed1/v0002"}, "elapsed_s": 809.504962653853, "concurrency": 4}
{"schema": "v1", "run_id": "e92167e16168", "event_id": "b1a291e362a4", "ts": 1777573459, "type": "iteration", "episode_id": "e92167e16168", "iter": 3, "status": "ok", "decision": "discard", "metrics": {"rank": 16.0, "eval_score": 0.513182, "decision_accuracy": 0.290909, "json_compliance": 0.963636, "loss": 0.004454, "training_seconds": 153.9}, "params": {"learning_rate": 5e-05, "max_steps": 80, "num_generations": 3, "temperature": 0.7, "lora_rank": 16, "AR_MODEL_DIR": "/data/models/ablation-2026-04/A_seed1/v0003"}, "elapsed_s": 1022.0356339309365, "concurrency": 4}
{"schema": "v1", "run_id": "e92167e16168", "event_id": "e0c985ec621e", "ts": 1777573459, "type": "episode_summary", "episode_id": "e92167e16168", "mean": 0.49556825, "median": 0.5170455, "min": 0.422727, "max": 0.525455, "stdev": 0.04882439051249555, "count": 4, "trend_slope": 0.00795470000000007}
