{"schema": "v1", "run_id": "d19d1b813017", "event_id": "1901a35b0d4e", "ts": 1777589734, "type": "proposal", "episode_id": "d19d1b813017", "iter": 0, "params": {"learning_rate": 5e-05, "max_steps": 30, "num_generations": 2, "temperature": 0.7, "lora_rank": 4, "AR_MODEL_DIR": "/data/models/ablation-v2-2026-04/B_seed5/v0000"}, "concurrency": 4}
{"schema": "v1", "run_id": "d19d1b813017", "event_id": "4116b49b23e2", "ts": 1777589734, "type": "proposal", "episode_id": "d19d1b813017", "iter": 1, "params": {"learning_rate": 0.0003, "max_steps": 80, "num_generations": 3, "temperature": 0.9, "lora_rank": 16, "AR_MODEL_DIR": "/data/models/ablation-v2-2026-04/B_seed5/v0001"}, "concurrency": 4}
{"schema": "v1", "run_id": "d19d1b813017", "event_id": "d1994f4395a7", "ts": 1777589734, "type": "proposal", "episode_id": "d19d1b813017", "iter": 2, "params": {"learning_rate": 0.0001, "max_steps": 50, "num_generations": 2, "temperature": 0.9, "lora_rank": 8, "AR_MODEL_DIR": "/data/models/ablation-v2-2026-04/B_seed5/v0002"}, "concurrency": 4}
{"schema": "v1", "run_id": "d19d1b813017", "event_id": "fd381271ffb7", "ts": 1777589734, "type": "proposal", "episode_id": "d19d1b813017", "iter": 3, "params": {"learning_rate": 5e-05, "max_steps": 80, "num_generations": 3, "temperature": 0.7, "lora_rank": 16, "AR_MODEL_DIR": "/data/models/ablation-v2-2026-04/B_seed5/v0003"}, "concurrency": 4}
{"schema": "v1", "run_id": "d19d1b813017", "event_id": "67c1d6193876", "ts": 1777590022, "type": "iteration", "episode_id": "d19d1b813017", "iter": 0, "status": "ok", "decision": "keep", "metrics": {"rank": 4.0, "eval_score": 0.494545, "decision_accuracy": 0.209091, "json_compliance": 0.963636, "loss": 0.000772, "training_seconds": 100.4}, "params": {"learning_rate": 5e-05, "max_steps": 30, "num_generations": 2, "temperature": 0.7, "lora_rank": 4, "AR_MODEL_DIR": "/data/models/ablation-v2-2026-04/B_seed5/v0000"}, "elapsed_s": 228.21569899842143, "concurrency": 4}
{"schema": "v1", "run_id": "d19d1b813017", "event_id": "9becac130147", "ts": 1777590310, "type": "proposal", "episode_id": "d19d1b813017", "iter": 4, "params": {"learning_rate": 0.0003, "max_steps": 50, "num_generations": 3, "temperature": 0.7, "lora_rank": 8, "AR_MODEL_DIR": "/data/models/ablation-v2-2026-04/B_seed5/v0004"}, "concurrency": 4}
{"schema": "v1", "run_id": "d19d1b813017", "event_id": "cdfbc68ba8e1", "ts": 1777590501, "type": "proposal", "episode_id": "d19d1b813017", "iter": 5, "params": {"learning_rate": 0.0001, "max_steps": 50, "num_generations": 3, "temperature": 0.9, "lora_rank": 8, "AR_MODEL_DIR": "/data/models/ablation-v2-2026-04/B_seed5/v0005"}, "concurrency": 4}
{"schema": "v1", "run_id": "d19d1b813017", "event_id": "bcc5efc58caf", "ts": 1777590501, "type": "proposal", "episode_id": "d19d1b813017", "iter": 6, "params": {"learning_rate": 0.0003, "max_steps": 80, "num_generations": 2, "temperature": 0.7, "lora_rank": 16, "AR_MODEL_DIR": "/data/models/ablation-v2-2026-04/B_seed5/v0006"}, "concurrency": 4}
{"schema": "v1", "run_id": "d19d1b813017", "event_id": "42665c81f368", "ts": 1777590519, "type": "iteration", "episode_id": "d19d1b813017", "iter": 1, "status": "ok", "decision": "discard", "metrics": {"rank": 16.0, "eval_score": 0.321818, "decision_accuracy": 0.145455, "json_compliance": 0.545455, "loss": 0.025934, "training_seconds": 456.4}, "params": {"learning_rate": 0.0003, "max_steps": 80, "num_generations": 3, "temperature": 0.9, "lora_rank": 16, "AR_MODEL_DIR": "/data/models/ablation-v2-2026-04/B_seed5/v0001"}, "elapsed_s": 724.4193314011209, "concurrency": 4}
{"schema": "v1", "run_id": "d19d1b813017", "event_id": "a07c67561b9d", "ts": 1777590544, "type": "proposal", "episode_id": "d19d1b813017", "iter": 7, "params": {"learning_rate": 0.0001, "max_steps": 50, "num_generations": 3, "temperature": 0.7, "lora_rank": 8, "AR_MODEL_DIR": "/data/models/ablation-v2-2026-04/B_seed5/v0007"}, "concurrency": 4}
{"schema": "v1", "run_id": "d19d1b813017", "event_id": "372b3e9643c6", "ts": 1777590544, "type": "iteration", "episode_id": "d19d1b813017", "iter": 2, "status": "ok", "decision": "keep", "metrics": {"rank": 8.0, "eval_score": 0.528182, "decision_accuracy": 0.2, "json_compliance": 0.954545, "loss": 0.003081, "training_seconds": 129.3}, "params": {"learning_rate": 0.0001, "max_steps": 50, "num_generations": 2, "temperature": 0.9, "lora_rank": 8, "AR_MODEL_DIR": "/data/models/ablation-v2-2026-04/B_seed5/v0002"}, "elapsed_s": 249.36763678258285, "concurrency": 4}
{"schema": "v1", "run_id": "d19d1b813017", "event_id": "1ad022eddc24", "ts": 1777590544, "type": "iteration", "episode_id": "d19d1b813017", "iter": 3, "status": "ok", "decision": "discard", "metrics": {"rank": 16.0, "eval_score": 0.409091, "decision_accuracy": 0.2, "json_compliance": 0.963636, "loss": 0.002237, "training_seconds": 240.3}, "params": {"learning_rate": 5e-05, "max_steps": 80, "num_generations": 3, "temperature": 0.7, "lora_rank": 16, "AR_MODEL_DIR": "/data/models/ablation-v2-2026-04/B_seed5/v0003"}, "elapsed_s": 464.4265754520893, "concurrency": 4}
{"schema": "v1", "run_id": "d19d1b813017", "event_id": "b013650684b2", "ts": 1777590656, "type": "iteration", "episode_id": "d19d1b813017", "iter": 4, "status": "ok", "decision": "discard", "metrics": {"rank": 8.0, "eval_score": 0.42, "decision_accuracy": 0.209091, "json_compliance": 0.981818, "loss": 0.00349, "training_seconds": 177.6}, "params": {"learning_rate": 0.0003, "max_steps": 50, "num_generations": 3, "temperature": 0.7, "lora_rank": 8, "AR_MODEL_DIR": "/data/models/ablation-v2-2026-04/B_seed5/v0004"}, "elapsed_s": 311.95478466991335, "concurrency": 4}
{"schema": "v1", "run_id": "d19d1b813017", "event_id": "c0ca3be04ad2", "ts": 1777590909, "type": "iteration", "episode_id": "d19d1b813017", "iter": 5, "status": "ok", "decision": "discard", "metrics": {"rank": 8.0, "eval_score": 0.406364, "decision_accuracy": 0.2, "json_compliance": 0.954545, "loss": 0.007254, "training_seconds": 171.7}, "params": {"learning_rate": 0.0001, "max_steps": 50, "num_generations": 3, "temperature": 0.9, "lora_rank": 8, "AR_MODEL_DIR": "/data/models/ablation-v2-2026-04/B_seed5/v0005"}, "elapsed_s": 377.66649152804166, "concurrency": 4}
{"schema": "v1", "run_id": "d19d1b813017", "event_id": "5d0ea04b8a40", "ts": 1777590909, "type": "iteration", "episode_id": "d19d1b813017", "iter": 6, "status": "ok", "decision": "keep", "metrics": {"rank": 16.0, "eval_score": 0.553791, "decision_accuracy": 0.190909, "json_compliance": 0.945455, "loss": 0.004664, "training_seconds": 212.2}, "params": {"learning_rate": 0.0003, "max_steps": 80, "num_generations": 2, "temperature": 0.7, "lora_rank": 16, "AR_MODEL_DIR": "/data/models/ablation-v2-2026-04/B_seed5/v0006"}, "elapsed_s": 374.59013963583857, "concurrency": 4}
{"schema": "v1", "run_id": "d19d1b813017", "event_id": "3f18c6bd55cf", "ts": 1777590909, "type": "iteration", "episode_id": "d19d1b813017", "iter": 7, "status": "ok", "decision": "discard", "metrics": {"rank": 8.0, "eval_score": 0.523636, "decision_accuracy": 0.181818, "json_compliance": 0.863636, "loss": 0.004734, "training_seconds": 184.2}, "params": {"learning_rate": 0.0001, "max_steps": 50, "num_generations": 3, "temperature": 0.7, "lora_rank": 8, "AR_MODEL_DIR": "/data/models/ablation-v2-2026-04/B_seed5/v0007"}, "elapsed_s": 311.678768129088, "concurrency": 4}
{"schema": "v1", "run_id": "d19d1b813017", "event_id": "fcdd44842908", "ts": 1777590909, "type": "episode_summary", "episode_id": "d19d1b813017", "mean": 0.457178375, "median": 0.45727249999999997, "min": 0.321818, "max": 0.553791, "stdev": 0.07998888644758721, "count": 8, "trend_slope": 0.012011392857142842}
