{"schema": "v1", "run_id": "5797bf7f0c20", "event_id": "2f2f8a03cd85", "ts": 1777581794, "type": "proposal", "episode_id": "5797bf7f0c20", "iter": 0, "params": {"learning_rate": 5e-05, "max_steps": 30, "num_generations": 2, "temperature": 0.9, "lora_rank": 4, "AR_MODEL_DIR": "/data/models/ablation-v2-2026-04/B_seed2/v0000"}, "concurrency": 4}
{"schema": "v1", "run_id": "5797bf7f0c20", "event_id": "0ee797123c3f", "ts": 1777581794, "type": "proposal", "episode_id": "5797bf7f0c20", "iter": 1, "params": {"learning_rate": 0.0003, "max_steps": 80, "num_generations": 3, "temperature": 0.9, "lora_rank": 16, "AR_MODEL_DIR": "/data/models/ablation-v2-2026-04/B_seed2/v0001"}, "concurrency": 4}
{"schema": "v1", "run_id": "5797bf7f0c20", "event_id": "d92110809d21", "ts": 1777581794, "type": "proposal", "episode_id": "5797bf7f0c20", "iter": 2, "params": {"learning_rate": 5e-05, "max_steps": 80, "num_generations": 2, "temperature": 0.7, "lora_rank": 8, "AR_MODEL_DIR": "/data/models/ablation-v2-2026-04/B_seed2/v0002"}, "concurrency": 4}
{"schema": "v1", "run_id": "5797bf7f0c20", "event_id": "8ae92e4def6d", "ts": 1777581794, "type": "proposal", "episode_id": "5797bf7f0c20", "iter": 3, "params": {"learning_rate": 0.0003, "max_steps": 50, "num_generations": 3, "temperature": 0.9, "lora_rank": 16, "AR_MODEL_DIR": "/data/models/ablation-v2-2026-04/B_seed2/v0003"}, "concurrency": 4}
{"schema": "v1", "run_id": "5797bf7f0c20", "event_id": "9f261d7feba1", "ts": 1777582031, "type": "iteration", "episode_id": "5797bf7f0c20", "iter": 0, "status": "ok", "decision": "keep", "metrics": {"rank": 4.0, "eval_score": 0.510909, "decision_accuracy": 0.272727, "json_compliance": 0.954545, "loss": 0.002474, "training_seconds": 100.2}, "params": {"learning_rate": 5e-05, "max_steps": 30, "num_generations": 2, "temperature": 0.9, "lora_rank": 4, "AR_MODEL_DIR": "/data/models/ablation-v2-2026-04/B_seed2/v0000"}, "elapsed_s": 224.7417948069051, "concurrency": 4}
{"schema": "v1", "run_id": "5797bf7f0c20", "event_id": "40a165f7e95b", "ts": 1777582401, "type": "proposal", "episode_id": "5797bf7f0c20", "iter": 4, "params": {"learning_rate": 0.0003, "max_steps": 50, "num_generations": 3, "temperature": 0.7, "lora_rank": 8, "AR_MODEL_DIR": "/data/models/ablation-v2-2026-04/B_seed2/v0004"}, "concurrency": 4}
{"schema": "v1", "run_id": "5797bf7f0c20", "event_id": "0fd988efb848", "ts": 1777582401, "type": "iteration", "episode_id": "5797bf7f0c20", "iter": 1, "status": "ok", "decision": "keep", "metrics": {"rank": 16.0, "eval_score": 0.533636, "decision_accuracy": 0.209091, "json_compliance": 0.981818, "loss": 0.00333, "training_seconds": 119.5}, "params": {"learning_rate": 0.0003, "max_steps": 80, "num_generations": 3, "temperature": 0.9, "lora_rank": 16, "AR_MODEL_DIR": "/data/models/ablation-v2-2026-04/B_seed2/v0001"}, "elapsed_s": 289.95033278595656, "concurrency": 4}
{"schema": "v1", "run_id": "5797bf7f0c20", "event_id": "a05826311382", "ts": 1777582411, "type": "proposal", "episode_id": "5797bf7f0c20", "iter": 5, "params": {"learning_rate": 0.0001, "max_steps": 50, "num_generations": 3, "temperature": 0.7, "lora_rank": 8, "AR_MODEL_DIR": "/data/models/ablation-v2-2026-04/B_seed2/v0005"}, "concurrency": 4}
{"schema": "v1", "run_id": "5797bf7f0c20", "event_id": "20b78c79ab20", "ts": 1777582411, "type": "proposal", "episode_id": "5797bf7f0c20", "iter": 6, "params": {"learning_rate": 0.0003, "max_steps": 30, "num_generations": 2, "temperature": 0.9, "lora_rank": 4, "AR_MODEL_DIR": "/data/models/ablation-v2-2026-04/B_seed2/v0006"}, "concurrency": 4}
{"schema": "v1", "run_id": "5797bf7f0c20", "event_id": "6aa22254bcac", "ts": 1777582411, "type": "proposal", "episode_id": "5797bf7f0c20", "iter": 7, "params": {"learning_rate": 5e-05, "max_steps": 80, "num_generations": 3, "temperature": 0.7, "lora_rank": 16, "AR_MODEL_DIR": "/data/models/ablation-v2-2026-04/B_seed2/v0007"}, "concurrency": 4}
{"schema": "v1", "run_id": "5797bf7f0c20", "event_id": "f4eb23b07f2e", "ts": 1777582411, "type": "iteration", "episode_id": "5797bf7f0c20", "iter": 2, "status": "ok", "decision": "discard", "metrics": {"rank": 8.0, "eval_score": 0.519545, "decision_accuracy": 0.209091, "json_compliance": 0.963636, "loss": 0.001147, "training_seconds": 166.8}, "params": {"learning_rate": 5e-05, "max_steps": 80, "num_generations": 2, "temperature": 0.7, "lora_rank": 8, "AR_MODEL_DIR": "/data/models/ablation-v2-2026-04/B_seed2/v0002"}, "elapsed_s": 564.6453929231502, "concurrency": 4}
{"schema": "v1", "run_id": "5797bf7f0c20", "event_id": "c77c9df115a9", "ts": 1777582411, "type": "iteration", "episode_id": "5797bf7f0c20", "iter": 3, "status": "ok", "decision": "discard", "metrics": {"rank": 16.0, "eval_score": 0.400455, "decision_accuracy": 0.181818, "json_compliance": 0.8, "loss": 0.012498, "training_seconds": 193.7}, "params": {"learning_rate": 0.0003, "max_steps": 50, "num_generations": 3, "temperature": 0.9, "lora_rank": 16, "AR_MODEL_DIR": "/data/models/ablation-v2-2026-04/B_seed2/v0003"}, "elapsed_s": 374.28485927078873, "concurrency": 4}
{"schema": "v1", "run_id": "5797bf7f0c20", "event_id": "925f54744b4d", "ts": 1777582756, "type": "iteration", "episode_id": "5797bf7f0c20", "iter": 4, "status": "ok", "decision": "keep", "metrics": {"rank": 8.0, "eval_score": 0.581364, "decision_accuracy": 0.227273, "json_compliance": 0.981818, "loss": 0.007338, "training_seconds": 194.3}, "params": {"learning_rate": 0.0003, "max_steps": 50, "num_generations": 3, "temperature": 0.7, "lora_rank": 8, "AR_MODEL_DIR": "/data/models/ablation-v2-2026-04/B_seed2/v0004"}, "elapsed_s": 332.7507099718787, "concurrency": 4}
{"schema": "v1", "run_id": "5797bf7f0c20", "event_id": "e92d9cc1d160", "ts": 1777582903, "type": "iteration", "episode_id": "5797bf7f0c20", "iter": 5, "status": "ok", "decision": "discard", "metrics": {"rank": 8.0, "eval_score": 0.418182, "decision_accuracy": 0.209091, "json_compliance": 0.954545, "loss": 0.006163, "training_seconds": 189.1}, "params": {"learning_rate": 0.0001, "max_steps": 50, "num_generations": 3, "temperature": 0.7, "lora_rank": 8, "AR_MODEL_DIR": "/data/models/ablation-v2-2026-04/B_seed2/v0005"}, "elapsed_s": 479.8586066882126, "concurrency": 4}
{"schema": "v1", "run_id": "5797bf7f0c20", "event_id": "01988d89d6bc", "ts": 1777582911, "type": "iteration", "episode_id": "5797bf7f0c20", "iter": 6, "status": "ok", "decision": "discard", "metrics": {"rank": 4.0, "eval_score": 0.568636, "decision_accuracy": 0.209091, "json_compliance": 0.972727, "loss": 0.001641, "training_seconds": 111.9}, "params": {"learning_rate": 0.0003, "max_steps": 30, "num_generations": 2, "temperature": 0.9, "lora_rank": 4, "AR_MODEL_DIR": "/data/models/ablation-v2-2026-04/B_seed2/v0006"}, "elapsed_s": 487.71036783931777, "concurrency": 4}
{"schema": "v1", "run_id": "5797bf7f0c20", "event_id": "88136bbcdb56", "ts": 1777582911, "type": "iteration", "episode_id": "5797bf7f0c20", "iter": 7, "status": "ok", "decision": "discard", "metrics": {"rank": 16.0, "eval_score": 0.41, "decision_accuracy": 0.209091, "json_compliance": 0.954545, "loss": 0.004171, "training_seconds": 234.5}, "params": {"learning_rate": 5e-05, "max_steps": 80, "num_generations": 3, "temperature": 0.7, "lora_rank": 16, "AR_MODEL_DIR": "/data/models/ablation-v2-2026-04/B_seed2/v0007"}, "elapsed_s": 361.0858104028739, "concurrency": 4}
{"schema": "v1", "run_id": "5797bf7f0c20", "event_id": "af23aa1d21ec", "ts": 1777582911, "type": "episode_summary", "episode_id": "5797bf7f0c20", "mean": 0.492840875, "median": 0.515227, "min": 0.400455, "max": 0.581364, "stdev": 0.07295474367899497, "count": 8, "trend_slope": -0.007792178571428575}
