{"schema": "v1", "run_id": "a6bc62f47dc6", "event_id": "f2b99e49e8bd", "ts": 1777573489, "type": "proposal", "episode_id": "a6bc62f47dc6", "iter": 0, "params": {"learning_rate": 5e-05, "max_steps": 30, "num_generations": 2, "temperature": 0.7, "lora_rank": 4, "AR_MODEL_DIR": "/data/models/ablation-2026-04/B_seed1/v0000"}, "concurrency": 4}
{"schema": "v1", "run_id": "a6bc62f47dc6", "event_id": "894459d92613", "ts": 1777573489, "type": "proposal", "episode_id": "a6bc62f47dc6", "iter": 1, "params": {"learning_rate": 0.0003, "max_steps": 80, "num_generations": 3, "temperature": 0.9, "lora_rank": 16, "AR_MODEL_DIR": "/data/models/ablation-2026-04/B_seed1/v0001"}, "concurrency": 4}
{"schema": "v1", "run_id": "a6bc62f47dc6", "event_id": "1c9b44326d7a", "ts": 1777573489, "type": "proposal", "episode_id": "a6bc62f47dc6", "iter": 2, "params": {"learning_rate": 0.0001, "max_steps": 50, "num_generations": 2, "temperature": 0.9, "lora_rank": 8, "AR_MODEL_DIR": "/data/models/ablation-2026-04/B_seed1/v0002"}, "concurrency": 4}
{"schema": "v1", "run_id": "a6bc62f47dc6", "event_id": "fce9717f72ef", "ts": 1777573489, "type": "proposal", "episode_id": "a6bc62f47dc6", "iter": 3, "params": {"learning_rate": 5e-05, "max_steps": 80, "num_generations": 3, "temperature": 0.7, "lora_rank": 16, "AR_MODEL_DIR": "/data/models/ablation-2026-04/B_seed1/v0003"}, "concurrency": 4}
{"schema": "v1", "run_id": "a6bc62f47dc6", "event_id": "9382c0a86c50", "ts": 1777573876, "type": "iteration", "episode_id": "a6bc62f47dc6", "iter": 0, "status": "ok", "decision": "keep", "metrics": {"rank": 4.0, "eval_score": 0.52, "decision_accuracy": 0.263636, "json_compliance": 0.954545, "loss": 0.002462, "training_seconds": 96.5}, "params": {"learning_rate": 5e-05, "max_steps": 30, "num_generations": 2, "temperature": 0.7, "lora_rank": 4, "AR_MODEL_DIR": "/data/models/ablation-2026-04/B_seed1/v0000"}, "elapsed_s": 356.24210732104257, "concurrency": 4}
{"schema": "v1", "run_id": "a6bc62f47dc6", "event_id": "a1f98386695e", "ts": 1777573965, "type": "iteration", "episode_id": "a6bc62f47dc6", "iter": 1, "status": "ok", "decision": "keep", "metrics": {"rank": 16.0, "eval_score": 0.571818, "decision_accuracy": 0.209091, "json_compliance": 0.981818, "loss": 0.014721, "training_seconds": 286.6}, "params": {"learning_rate": 0.0003, "max_steps": 80, "num_generations": 3, "temperature": 0.9, "lora_rank": 16, "AR_MODEL_DIR": "/data/models/ablation-2026-04/B_seed1/v0001"}, "elapsed_s": 464.56814028602093, "concurrency": 4}
{"schema": "v1", "run_id": "a6bc62f47dc6", "event_id": "9be8eb999a70", "ts": 1777573965, "type": "iteration", "episode_id": "a6bc62f47dc6", "iter": 2, "status": "ok", "decision": "discard", "metrics": {"rank": 8.0, "eval_score": 0.420909, "decision_accuracy": 0.2, "json_compliance": 0.954545, "loss": 0.001737, "training_seconds": 133.5}, "params": {"learning_rate": 0.0001, "max_steps": 50, "num_generations": 2, "temperature": 0.9, "lora_rank": 8, "AR_MODEL_DIR": "/data/models/ablation-2026-04/B_seed1/v0002"}, "elapsed_s": 401.3540267259814, "concurrency": 4}
{"schema": "v1", "run_id": "a6bc62f47dc6", "event_id": "3547976d571a", "ts": 1777573968, "type": "iteration", "episode_id": "a6bc62f47dc6", "iter": 3, "status": "ok", "decision": "discard", "metrics": {"rank": 16.0, "eval_score": 0.512727, "decision_accuracy": 0.2, "json_compliance": 0.963636, "loss": 0.002849, "training_seconds": 223.7}, "params": {"learning_rate": 5e-05, "max_steps": 80, "num_generations": 3, "temperature": 0.7, "lora_rank": 16, "AR_MODEL_DIR": "/data/models/ablation-2026-04/B_seed1/v0003"}, "elapsed_s": 466.416937363334, "concurrency": 4}
{"schema": "v1", "run_id": "a6bc62f47dc6", "event_id": "f063d1a59b08", "ts": 1777573968, "type": "episode_summary", "episode_id": "a6bc62f47dc6", "mean": 0.5063635, "median": 0.5163635, "min": 0.420909, "max": 0.571818, "stdev": 0.06275139149851582, "count": 4, "trend_slope": -0.017272799999999932}
