{"schema": "v1", "run_id": "583968cfff64", "event_id": "916bad8fc87e", "ts": 1777576610, "type": "proposal", "episode_id": "583968cfff64", "iter": 0, "params": {"learning_rate": 5e-05, "max_steps": 30, "num_generations": 2, "temperature": 0.7, "lora_rank": 4, "AR_MODEL_DIR": "/data/models/ablation-v2-2026-04/A_seed1/v0000"}, "concurrency": 4}
{"schema": "v1", "run_id": "583968cfff64", "event_id": "42d1a9df73ec", "ts": 1777576610, "type": "proposal", "episode_id": "583968cfff64", "iter": 1, "params": {"learning_rate": 0.0003, "max_steps": 80, "num_generations": 3, "temperature": 0.9, "lora_rank": 16, "AR_MODEL_DIR": "/data/models/ablation-v2-2026-04/A_seed1/v0001"}, "concurrency": 4}
{"schema": "v1", "run_id": "583968cfff64", "event_id": "2df553e0f165", "ts": 1777576610, "type": "proposal", "episode_id": "583968cfff64", "iter": 2, "params": {"learning_rate": 0.0001, "max_steps": 50, "num_generations": 2, "temperature": 0.9, "lora_rank": 8, "AR_MODEL_DIR": "/data/models/ablation-v2-2026-04/A_seed1/v0002"}, "concurrency": 4}
{"schema": "v1", "run_id": "583968cfff64", "event_id": "8860e98118cf", "ts": 1777576610, "type": "proposal", "episode_id": "583968cfff64", "iter": 3, "params": {"learning_rate": 0.0003, "max_steps": 30, "num_generations": 3, "temperature": 0.7, "lora_rank": 4, "AR_MODEL_DIR": "/data/models/ablation-v2-2026-04/A_seed1/v0003"}, "concurrency": 4}
{"schema": "v1", "run_id": "583968cfff64", "event_id": "02a8bced2128", "ts": 1777577158, "type": "iteration", "episode_id": "583968cfff64", "iter": 0, "status": "ok", "decision": "keep", "metrics": {"rank": 4.0, "eval_score": 0.5, "decision_accuracy": 0.209091, "json_compliance": 0.963636, "loss": 0.001269, "training_seconds": 96.5}, "params": {"learning_rate": 5e-05, "max_steps": 30, "num_generations": 2, "temperature": 0.7, "lora_rank": 4, "AR_MODEL_DIR": "/data/models/ablation-v2-2026-04/A_seed1/v0000"}, "elapsed_s": 537.418230202049, "concurrency": 4}
{"schema": "v1", "run_id": "583968cfff64", "event_id": "b59460776672", "ts": 1777577176, "type": "proposal", "episode_id": "583968cfff64", "iter": 4, "params": {"learning_rate": 0.0003, "max_steps": 80, "num_generations": 3, "temperature": 0.9, "lora_rank": 16, "AR_MODEL_DIR": "/data/models/ablation-v2-2026-04/A_seed1/v0004"}, "concurrency": 4}
{"schema": "v1", "run_id": "583968cfff64", "event_id": "6a847cf3ba54", "ts": 1777577219, "type": "proposal", "episode_id": "583968cfff64", "iter": 5, "params": {"learning_rate": 0.0001, "max_steps": 50, "num_generations": 2, "temperature": 0.7, "lora_rank": 8, "AR_MODEL_DIR": "/data/models/ablation-v2-2026-04/A_seed1/v0005"}, "concurrency": 4}
{"schema": "v1", "run_id": "583968cfff64", "event_id": "5399c661b187", "ts": 1777577247, "type": "proposal", "episode_id": "583968cfff64", "iter": 6, "params": {"learning_rate": 0.0003, "max_steps": 80, "num_generations": 3, "temperature": 0.9, "lora_rank": 16, "AR_MODEL_DIR": "/data/models/ablation-v2-2026-04/A_seed1/v0006"}, "concurrency": 4}
{"schema": "v1", "run_id": "583968cfff64", "event_id": "bc0897d271c6", "ts": 1777577426, "type": "iteration", "episode_id": "583968cfff64", "iter": 1, "status": "ok", "decision": "keep", "metrics": {"rank": 16.0, "eval_score": 0.601636, "decision_accuracy": 0.209091, "json_compliance": 0.981818, "loss": 0.019852, "training_seconds": 320.4}, "params": {"learning_rate": 0.0003, "max_steps": 80, "num_generations": 3, "temperature": 0.9, "lora_rank": 16, "AR_MODEL_DIR": "/data/models/ablation-v2-2026-04/A_seed1/v0001"}, "elapsed_s": 801.5104948151857, "concurrency": 4}
{"schema": "v1", "run_id": "583968cfff64", "event_id": "6982a021553e", "ts": 1777577711, "type": "proposal", "episode_id": "583968cfff64", "iter": 7, "params": {"learning_rate": 5e-05, "max_steps": 80, "num_generations": 2, "temperature": 0.9, "lora_rank": 4, "AR_MODEL_DIR": "/data/models/ablation-v2-2026-04/A_seed1/v0007"}, "concurrency": 4}
{"schema": "v1", "run_id": "583968cfff64", "event_id": "6987d234fcdc", "ts": 1777577711, "type": "iteration", "episode_id": "583968cfff64", "iter": 2, "status": "ok", "decision": "discard", "metrics": {"rank": 8.0, "eval_score": 0.492727, "decision_accuracy": 0.2, "json_compliance": 0.963636, "loss": 0.001584, "training_seconds": 137.4}, "params": {"learning_rate": 0.0001, "max_steps": 50, "num_generations": 2, "temperature": 0.9, "lora_rank": 8, "AR_MODEL_DIR": "/data/models/ablation-v2-2026-04/A_seed1/v0002"}, "elapsed_s": 575.5750526948832, "concurrency": 4}
{"schema": "v1", "run_id": "583968cfff64", "event_id": "d45f81e1ab3c", "ts": 1777577711, "type": "iteration", "episode_id": "583968cfff64", "iter": 3, "status": "ok", "decision": "discard", "metrics": {"rank": 4.0, "eval_score": 0.483636, "decision_accuracy": 0.190909, "json_compliance": 0.890909, "loss": 0.009641, "training_seconds": 173.3}, "params": {"learning_rate": 0.0003, "max_steps": 30, "num_generations": 3, "temperature": 0.7, "lora_rank": 4, "AR_MODEL_DIR": "/data/models/ablation-v2-2026-04/A_seed1/v0003"}, "elapsed_s": 617.386126710102, "concurrency": 4}
{"schema": "v1", "run_id": "583968cfff64", "event_id": "42ca652bc3a7", "ts": 1777577711, "type": "iteration", "episode_id": "583968cfff64", "iter": 4, "status": "ok", "decision": "discard", "metrics": {"rank": 16.0, "eval_score": 0.537273, "decision_accuracy": 0.209091, "json_compliance": 0.990909, "loss": 0.011033, "training_seconds": 246.9}, "params": {"learning_rate": 0.0003, "max_steps": 80, "num_generations": 3, "temperature": 0.9, "lora_rank": 16, "AR_MODEL_DIR": "/data/models/ablation-v2-2026-04/A_seed1/v0004"}, "elapsed_s": 449.9872914031148, "concurrency": 4}
{"schema": "v1", "run_id": "583968cfff64", "event_id": "db8a2fab85ed", "ts": 1777577711, "type": "iteration", "episode_id": "583968cfff64", "iter": 5, "status": "ok", "decision": "discard", "metrics": {"rank": 8.0, "eval_score": 0.530455, "decision_accuracy": 0.2, "json_compliance": 0.954545, "loss": 0.004405, "training_seconds": 68.0}, "params": {"learning_rate": 0.0001, "max_steps": 50, "num_generations": 2, "temperature": 0.7, "lora_rank": 8, "AR_MODEL_DIR": "/data/models/ablation-v2-2026-04/A_seed1/v0005"}, "elapsed_s": 237.33510418981314, "concurrency": 4}
{"schema": "v1", "run_id": "583968cfff64", "event_id": "482b58c448a8", "ts": 1777577711, "type": "iteration", "episode_id": "583968cfff64", "iter": 6, "status": "ok", "decision": "discard", "metrics": {"rank": 16.0, "eval_score": 0.42, "decision_accuracy": 0.209091, "json_compliance": 0.981818, "loss": 0.000884, "training_seconds": 223.3}, "params": {"learning_rate": 0.0003, "max_steps": 80, "num_generations": 3, "temperature": 0.9, "lora_rank": 16, "AR_MODEL_DIR": "/data/models/ablation-v2-2026-04/A_seed1/v0006"}, "elapsed_s": 339.9613988697529, "concurrency": 4}
{"schema": "v1", "run_id": "583968cfff64", "event_id": "9dfbaf474a50", "ts": 1777577965, "type": "iteration", "episode_id": "583968cfff64", "iter": 7, "status": "ok", "decision": "discard", "metrics": {"rank": 4.0, "eval_score": 0.520909, "decision_accuracy": 0.209091, "json_compliance": 0.972727, "loss": 0.000334, "training_seconds": 151.5}, "params": {"learning_rate": 5e-05, "max_steps": 80, "num_generations": 2, "temperature": 0.9, "lora_rank": 4, "AR_MODEL_DIR": "/data/models/ablation-v2-2026-04/A_seed1/v0007"}, "elapsed_s": 244.57796057732776, "concurrency": 4}
{"schema": "v1", "run_id": "583968cfff64", "event_id": "c485b6487795", "ts": 1777577965, "type": "episode_summary", "episode_id": "583968cfff64", "mean": 0.5108295, "median": 0.5104545, "min": 0.42, "max": 0.601636, "stdev": 0.05191517641306826, "count": 8, "trend_slope": -0.007083285714285736}
